,tweet,polarity_score
244, still short usd long  and long eur moved stops tighter just incase of any curve balls,0
245,id recommend having very large positions on both sides of the eurusd usdcad and usdjpy because today could be a trend changer,0
246,afr prices page lists bidoffer spread on audusd and audeur at 710 time to ditch westpac as the info source and join the real world gb,0
247, when qe2 came in nov 2010 usd fell against eur day of extended its losses 24 hrs later stabilized and rallied,0
248, when qe2 came in nov 2010 usd fell against eur day of extended its losses 24 hrs later stabilized and rallied,0
249,when qe2 came in nov 2010 usd fell against eur day of extended its losses 24 hrs later stabilized and rallied aggressively for next month,0
250,usd well touted 12900 digital and vanilla option expiries containing spottalk some eur 10mln of direct payout attached to the digital,0
251, i believe eurusd might know a significant move upwards according to stimulus from the market and momentum,0
252,rand coming under big pressure today on the back of continuing unrest in the mining sector down almost 4 on the day vs usd  gbp and eur,0
253, dear memberbhiner accept usdeursgd and cny the rate of usd is 0166if you have any problemsplease feel free contact us,0
254,back to i can see a typical rinse and repeat scenario in the eurusd pairguess it is gona be like that till  later,0
255,update eurusd continues to move higher and could test the key level at 13000 next,0
256,news now eurusd continues to move higher and could test the key level at 13000 next,0
257,breaking news eurusd continues to move higher and could test the key level at 13000 next,0
258,currency news gtgt eurusd continues to move higher and could test the key level at 13000 next,0
259,attention fx news eurusd continues to move higher and could test the key level at 13000 next,0
260,only from technicals eurusd should tankgtbad thing iseurusd not interested in technicals and could go through the roof as well 13000131,0
261,gbpeur at 12477 at market open gbpusd 16115 but fomc releases may see usd drop further  unemployment and low rates remain concern,0
262, ooh does the app have a setting to automatically print a currency of choice or is it preset to usd and eur,0
263,eurusd will 12936 breal and close the gap double top,0
264,elliott wave analysis of eurusd eurjpy and eurnzd,0
265,in asian trading on thursday eurusd was trading up 004 at 12904 up from a low of 12902 and off from a high of 12906,0
266,buy eurusd 12900 and 12826 with tp  12975 and 13050 with sl 12751,0
267, duh eurusd and usdeur are reciprocals have you looked at the components of dxy recently,0
268, should be fun do you prefer the chf and eur or cad and auud vs the usd,0
269,re your eur imperfect and doomed bashsince 725 vs usd still earned 7 cash too much social reposting of trash its a  crash,0
270,bit gutted i was stopped out of my eurusd and lt crude positions ftse short and dax short still in play,0
271,wow eur strengning aganist usd12919 and aganist gbp  08017 ,0
272,  hey a lot are nzdusd amp eurusd already have and i think upside momentum is slowing down,0
273,took profits on eurusd and spx longs just bought the market overreaction orange juice acts great to the downside nice trades ,0
274,for the eurusd an intellectually short market is ripe for a squeeze higher eurusd above 200dma and above technical resistance,0
275,there are plenty of banks and advisors with stale sell the eurusd on rallies and eurusd at parity market remains intellectually short,0
276, pops to 835 to  and 1075 to  weakest against euro for the year mining concerns as amplats lonmin and impala report unrest,0
277,so slight bounce after esm verdict but gbp lost vs eur and down to 12470 on the mid rate gbpusd 16103,0
278,world markets and us futures rallying this morning on german court backed europes rescue fund eurusd xlf spy esf,0
279,  eurcad flying on its way to 127128 and dragging usdcad along like the snail it is,0
280,the eurusd has finally broken above 12900 in early trading and now pushing on towards 12930 still looking bullish in the short to,0
281,the eurusd has finally broken above 12900 in early trading and now pushing on towards 12930 still looking bullish in the short to,0
282,erk with my job i need to lol rt  if you know the current exchange rate for usd sgd inr and eur youre a mamak,0
283, if you know the current exchange rate for usd sgd inr and eur youre a mamak  does that make me one too ,0
284,if you know the current exchange rate for usd sgd inr and eur youre a mamak,0
285,usd hits 4 month and session high at 12883,0
286,eurusd rising back to 13000 soon come on break the 12900 resistance and make it the support,0
287, ive got now active trades with audusd long 10455 euraud short 12348 eurusd long 12887 and gbpjpy long 12519,0
288,hearing good size nok buying against everything  most usd jpy and eur i think this level around 743 in eurnok will hold today,0
289,usd 12935 is key level for now618 pct retrace 1348612042 decline break above opens 12950 and 13000 option barriers,0
290,usd bias for 13000the 10day and 30day moving averages are positively aligned,0
291,just exited usd longs and sold short ,0
292,just chilling waiting for my trades to finish haha  usdjpy open 78292 profit 8000 and eurusd open 127737 profit 125,0
293,eurusd after hectic and spuffing by brokers up again,0
294,looks like the news has settled in and its not looking good for the eurusd  watch for pops though once more has been read,0
295,update eurusd the market has broken above 12750 on monday we see former support now resistance at 12825 and above that is the key,0
296,breaking news eurusd the market has broken above 12750 on monday we see former support now resistance at 12825 and above that is,0
297,currency news gtgt eurusd the market has broken above 12750 on monday we see former support now resistance at 12825 and above that is,0
298,attention fx news eurusd the market has broken above 12750 on monday we see former support now resistance at 12825 and above that,0
299,news now eurusd the market has broken above 12750 on monday we see former support now resistance at 12825 and above that is the,0
300,investors are now extremely bearish on the usd and euro shorts are close to their smallest levels euro gains to reach 12865 now ,0
301,the news could help to underpin equities at the open has resulted in asian bourses ticking higher and eurusd hitting a four month high,0
302,buy eurusd 12854 and 12797 with tp  12911 and 12968 with sl 12740,0
303, with respect to my timezone and my technical analysis ability i find the eurusd suitable for my trading plan,0
304,big morning on deck eurusd to 130 if germany votes in favor of the bailout  dollar will fall and commodities will rise gld slv udn,0
305,the chinese yuan trading band will appreciate against the dollar but it will be a steady and gradual nothing like usd to eur swings,0
306, two weeks ago eur was a candidate4extinctionand today usdx breaks 80 and people panic now that the usd is doomed  revolving door,0
307,short  short usd short light crude and leave,0
308,again eur deletes any losses against usd now going long and watching for the rest of the week,0
309,eurusd hits a 4mth highs of 12819 barrier at 12825 and sls above,0
310,the eurusd currency pair recently hit its lowest level in 8 years and is retracing to the 12693 level,0
311,eurusd got a pump around 3am and hasnt been able to do anything but red since ,0
312,target hit with 25 points taken from ftse and eurusd shorts and todays target hit 73 for the week  late finish today ,0
313,macro fund sells usd for tp 1280510fast money continues to buy looking to gun 12825 barriers and fill 12830 stops,0
314,will be focussing on eurgbp  gbpusd eurusd  usdcad and audusd for the rest of the month,0
315,currency news gtgt eurusd at first i thought we had much more in this recent move as we were testing 12566 and 12753,0
316,news now eurusd at first i thought we had much more in this recent move as we were testing 12566 and 12753,0
317,update eurusd at first i thought we had much more in this recent move as we were testing 12566 and 12753,0
318,attention fx news eurusd at first i thought we had much more in this recent move as we were testing 12566 and 12753,0
319,breaking news eurusd at first i thought we had much more in this recent move as we were testing 12566 and 12753,0
320,eurusd audusd and gbpusd rallied after german courts announced that they will not delay esm ruling,0
321,fiatcurrency eurusd and eurjpy algo pop up on esm headline,0
322,sell eurusd at 12790 stop 12850 targets 1273012670 and 12610,0
323,nzd eur amp gbp firm gtaustralia swiss and scandinavia soft v usd psst kiwi youre in bad company,0
324,eurusd pivot points r312852 r212832 r112795 pp12775 s112738 s212718 s312681 support and resistance could be found at levels,0
325,sell eurusd 12759 and 12823 with tp  12695 and 12631 with sl 12888,0
326,markets continue to be range bound and choppy if still in the eurusd on the sell hold and if position taken today protect profits,0
327,took small profit in eurusd short 2785 waiting for another setup to emerge or stay away from that pair cheers and good eve all,0
328, i know i talked about support levels at 121 eurusd and nothing after down to parity if i did say parity i take it back ,0
329,currently short spx from 143679 short audusd from 10378 and short eurgbp from 079917 all opened last night mostly flat today,0
330, i will accept this as sell signal and sell 100 lots eurusd thanks for the tip,0
331, bulb 20 and maker faire africa 2012 for the price of kshs 30  eur 027 or usd 035 youll manage to pick  h,0
332,market has well and truly bought the fact with s plan and with  likely this week usd looks to have plenty of headroom,0
333,eurusd looks to be held for now by the 200day moving average at 12828 get short there and get long at 12715 support seems sensible to me,0
334,watching the eurusd 1275566 zone for support which is monthly and daily pivot,0
335,eurusd cycle from 12500 is not over yet and we see further strength to complete this cycle   ,0
336,eurusd rally limited by spain and italy  jp morgan,0
337,eurusd widened both the lower and the higher end of its range during the euro session from 1277595 to 1277012805wwwnatureforexcom,0
338,usd shows strength cross the board today audusd  015 eurusd  015 usdjpy  007 usdcad however is bearish and so far  017,0
339,within a month  eurusd at 13150 and eurjpy at 10420 and audusd at 9985,0
340,it is more safe to long eurusd around 126602710 and gbpusd around 159155960 and target 150 pips each,0
341,it is more safe to long eurusd around 126602710 and gbpusd around 159155960 and target 150 pips each,0
342,007 when eurusd was around 123 somebody said a fina institu has bought eur and it would rise to 125they were correct,0
343,bids reported at 1276012765 and again at 12740 offers reported around 12825 in eurusd,0
344,sell eurusd 12809 and 12864 with tp  12755 and 12700 with sl 12918,0
345, tawing with the idea of taking a small short here eur usd but think may have some upsidebefore court ruling and dutch elections,0
346,no qe3 amp esm vote is both eur and usd positive gt good luck picking which way it will go i guess only cot speculators report will tell u,0
347,hrm soon to be long spx on a pull back and short eurusd also long the steelers short the pats,0
348,saturday humor hsbc says time to stop worrying about the eur and to start worrying about the usd,0
349, well i dont know about you but the last two or three days have shattered my boredom  big moves in aussie  eurusd and stocks,0
350, hopeless call you made on eurusd why were you so keen to short aherad of ecb bond buying and qe to comeat least admit the mistake,0
351,dont know about you but i call eurusd bar that closed today a breakout have a nice weekend and good luck trading next week,0
352,eurusd slowly crawling its way into moon 128100 and stil in be 80 see yall next week have a great weekend,0
353,went long usd at 12535 great price but butchered the trade by in and outs was targeting 12770 so i wasnt too far off,0
354,gotta laugh i thought the eurusd was heavy and outta gas at nyse close yesterday lol  so if that was heavy this is  looks like 130,0
355, my apologies you were correct  i was referring to andy and rebecca  would you short eurusd if it got close to 13,0
356,back  a terminal and seeing a nice bid in riskies but not sure this is risk on or eur strength whacking usd due to its  of dxf ,0
357,in the money at euraud pair and staying putnegative on eurusd but with good leverageso no worriesalso shunting for entry point 4long,0
358,aussieshort banked 038510 and eurusd from 12800 banked 27928 ,0
359,eurusd pull back till 12749 and then a sinking ship trapping all bulls,0
360,getting short eurusd in size as i see this being a flushout to overbought levels weak shorts now out and bulls ready to feel the pain,0
361,nfp came out bad so am long eurusd and audusd,0
362,going in to this holding a short eurusd position lt and a long gc and long si positions,0
363, hello sir what is your strategy if nfp turns out positivestill short on euraud and eurusd,0
364,nfp numbers wont matter levels will eurusd watch break higher to 12745 and above 12800 sellers may appear only below 12650,0
365,a strong figure gt130k will boost the usd especially against the eur chf and jpy,0
366,this overnight rally in the eurusd and audusd isnt gonna be pretty when it ends  ,0
367, a strong figure gt130k will boost the usd especially against the eur chf and jpy,0
368, nfp more likely affect eur and usd and jpy doesnt mean it wont affect aud audnzd counter  slow slight bull if cgt 12860 h4,0
369, good call yesterday on eurusd  longs from  around  12550 retracement nfps next  and it cld add extra momentum for longs,0
370,got long or longer on usdcad and eurcad today can at major resistance level at 102 so ill short canadian here,0
371,risk appetite seems to be creeping in after yesterdays ecb bond buying announcement  futures and markets slightly up  long on the eurusd,0
372,buy eurusd 12630 and 12566 with tp  12694 and 12758 with sl 12503,0
373,goldmans reiterate their long spanish italian 5yr bond calls and sees another 5075bp falls in yields sees 140 in eurusd in 12 month,0
374,  no offense but are you stupid the kindle costs 69 usd in the usampa and 79 eur in germany wtf who taught you maths,0
375,central banks that despise hard currency with their disgraceful undemocratic keynesian methods usd jpy gbp and now eur buy aud amp gold,0
376,eurusd sell orders real money and corporate 1265060 hedge funds buying on stop above 12665 and 12680 adding to existing positions,0
377, eurusd is flying high if and when sh0rting via euo etf be consdered,0
378,ending diagonal 5th wave for eurusd and usdchf,0
379, on the 30 min chart is there a divergence in rsi and eurusd,0
380,cards yeah usdeur and usdcad are much tighter too,0
381,quick cheat 1000 jpy is approximately 1250 usd and 10 eur  mt cards  info better get used to yen ,0
382,usd to see  move this pair aud and cad shown some clue if the greenback as expected would it bring big move hmm,0
383, all i can say is i am looking ofr a selective usd rally and eur rally vs everything,0
384,sold more eurusd 2630 and audusd 0290,0
385,i see money flow into europe and eur out of the us and usd us market slowly starts to crack as invstrs chase foreign returns  aha,0
386,geeee what did you guys do lol leaving things like it is with eurgbp and eurusd,0
387,looks like strong adp numbers giving a boost to usd and fading expectations of qe3 by fed probably helping eur stay lower,0
388,top tip exchanging usd eur gbp or cad  send your funds to us by midday and we guarantee a same day transfer ,0
389,sold eurusd 2590 and sold auduad 10263,0
390,sampp500 is roaring back as expected and our audusd bullish call is progressing well it would not surprise me if euraud carves out a high,0
391,up financial sector plus things affected by inflation down things people actually buy and use probably not a good sign eurusd amp crude,0
392,meanwhile in other news the eurusd is tanking new lows for the day125724 and counting,0
393,eurusd shorters yawn at draghi and now the fight begin around the level 126,0
394,eurusd back to where it was 24 hours ago  german dax back to where it was 48 hours ago non event and all factored in ,0
395,usd now ask and answer session at ecb conference press,0
396,strict and unlimited rally en eurusd en 3 2 1,0
397,eurusd should be limited rally  and just terminal thrust looking to start down trend soon ,0
398,i made over 100 pips on both eurusd and gbpusd eachso i am out for awhile till after the meetingi think people will want to sell both,0
399,i made over 100 pips on both eurusd and gbpusd eachso am out for awhile till after the meetingi think people will want to sell both,0
400,the draghi eurusd short squeeze restarts where will his speech take it hedge funds and algos are bracing themselves for more volatility,0
401,rix expects the krona to strengthen to 11670 in tcwindex that indicates a eursek around 825830 and usdsek around 660,0
402,aud up on employment data and china rate cut chatter possible doublebottom on st audusd charts eur quiet ahead of ecb,0
403,good morning mates eurusd in range 1260030 flat and neutral here at moment,0
404,will the ecb force both a eurusd breakout and trend,0
405,market expectations really high before super marios press conference later that day and again futures rise eurusd up  but for how long,0
406,buy eurusd 122601 and 12545 with tp  12657 and 12714 with sl 12489,0
407, tfl tv  with eur and aud going in oposite directions against the usd can you please comment on eur aud,0
408,now searching for short positions in usdchf close of 09555 and going long in eurusd arround 12600,0
409,im actually a little worried about my eurusd short investors are irrational and if this thing breaks to the upside then bombs away,0
410,in my opinion buying unlimited debt program is not realistic and will cause severe damages in euro economies eurusd   gbpusd,0
411,twitter wont let me post charts so ill just tweet about it anyone else see an inverted head and shoulders forming in the weekly eurusd,0
412,i have changed some forecasts please see my tweets eurusd gbpusd and audcad,0
413,covered my latenight short on the usdchf looks like the eur is fixing to drop and its got this crazy batwing hamps pattern  ,0
414,126051 in eurusd is a problem for euro bulls would be impressive if they could take that out and hold it ,0
415, ive just taken short positions in aud and eur  usd,0
416,lower highs eurusd and eurgbp still a little early to be comfortable about it though,0
417, the app doesnt cache all currencies also if i cache eur to usd and usd to gbp it cant calc eur to gbp offline,0
418,10yr yield 158 eurusd strength may be shortlived investors looking for unsterilized and yield caps no bazooka have a good one,0
419,usd the optimum moving avg 16 and 70 dma crossed following these returned 17 over the past yr indicates models will buy usd,0
420,ecb bond plan  unlimited and sterilized purchases of government debt reports eurusd spikes higher,0
421,1st unit eurusd  12550 2nd order  126 and if we break out looking for 12670 wide stop at 1275,0
422,sold eurusd 13 of size and prepared to build all the way to 127 in a worst case scenario 127 wide  safe stop,0
423,buy eurusd at 12530 stop 12470 targets 12590 and 12670,0
424,eurusd recovering from 12500 mantains bullish divergences on short timeframes and our preferred oscillator is closing the downmove in 13,0
425,we are long eurusd and short usdchf at 12542,0
426,i closed sell eurusd order 2 with tp limit at 12520 from 12590  and buy usdchf order 2 with tp limit at 09595 from 09508,0
427, youll have trouble getting the local currency even in dubai usdeur is good and you can change it in af itself,0
428,sell eurusd 12567 and 12615 with tp  12519 and 12474 with sl 12663,0
429,should hit the trend line on the eurusd and usdchf and then throough,0
430,dx eurusd  on technical analysis  a man should look for what is and not for what he thinks should be einstein  a favorite quote,0
431,surprised audusd hasnt flushed yet its near support n pts and the eurusd is near 50 fib support from last week so maybe thats why,0
432,as i mentioned yesterday usd broke 12570 and target 12515 keep follow me,0
433,scottish jewellery payment available in different currencies usd  cad  nzd aud  eur and even the japanese yen ,0
434,sellers aggressively fading all pops in eurusd   should buyers regain 595 and hold those aggressors will be sqeezed,0
435,ok so far we had good eur datagt euro up bad eur data gt euro up bad usd datagt euro up but bad us data and euro down what is going on,0
436,usd stops also touted under 12540 and 12520 with us buy orders mixed in from 30,0
437,long eurusd at 12574 stop at 12557 and a target of 12608,0
438,i am not jumping yet because ism is coming and we can see usdollard higher and bring us to eurusd to dip around 12534 will see,0
439,eurusd i think bottomed for now and will start to complete last wave to touch 12640 before downtrend start,0
440, everything is the vat is 23 249 usd is about 198 eur and that times 123 is 243,0
441,i saw a fat bear on usd hour4 and hour1 reversal euraud also shorted on 1231020 at be now,0
442,us investment bank and us prime name sell usd for hf acb seen bottom fishing around 1256570,0
443, on the basis of this news and the break of 12604 suppor decided to cut my losses and sold eurusd at current market price,0
444,closed the long eurusd and opened a short cable,0
445,fully loaded for the week 5 units eurgbp and 2 eurusd movie time cheers everyone,0
446,large 12550 usd expiry today  also 12540 and 12600,0
447, for today i do expect plenty of volatility for eurjpy and have a pending short with usdcad at 09858 which is a key level,0
448,this morning i have mostly been shorting eurusd dax and ftse nice pips so far and a good start to the month,0
449,commerzbanks usd order book model has more sellers than buyers at 12618 and its not until levels around 12540 where its equal,0
450,sold 1 more eurusd and after careful analysis and looking at the 5wave move up from low im removing my stop and building short units,0
451,woweurusd might go on bullish to 12667 and might also go on bearish to 12559sigh,0
452,european session september 4eurusd  test 127gbpusd  15891 and upaudusd  risingusdchf  target is 0946055,0
453, heres a question does it make sense to place a eurusd long and a audusd short at the same time  ie going long,0
454,sell eurusd 12593 and 12647 with tp  12539 and 12485 with sl 12702,0
455,eur  usd  technical analysis  sitting below 126 the euro finished last week with a flurry as it surged higher and burst through ,0
456,the pivot points for this week weekly and monthly for eurusd are 12558 weekly 12448 monthly,0
457, what do you think about usdnok or eurnoknoweursek and usdsek had a small run today,0
458,28 average return of my personal portfolio during 2012 so far not bad for such a c year and that is exclusive of the usdeur fluctu,0
459,eurusd buy long if close above 12565 take profit at 12652 and 12730 stop loss is below weekly pivot of 12558,0
460,eurusd sell short at 12650 take profit at 12480 and 12386 stop loss is above wr1,0
461, me too i was buying eurusd got 15 points only closing at 12604 and theres still momentum,0
462,and it begins  looking to buy 3yr paper does not see it as state financing eur up usd down eu making changes while us tweets chairs,0
463,sell eurusd 12572 and 12621 with tp  12523 and 12474 with sl 12670,0
464,traders are bullish on jpynok and bearish on euraudthe view on usd is split,0
465,update market review 3912 after hitting a twomonth high last friday the eurusd saw little movement in overnight trading and is,0
466,taking wagers that merkel has a trading account short eurusd short ftse mib amp ibex long schatz bunds and dax,0
467,news now eurusd the market continued to climb as it hit a high at 12636 and closed lower at 12576,0
468,currency news gtgt eurusd the market continued to climb as it hit a high at 12636 and closed lower at 12576,0
469,update eurusd the market continued to climb as it hit a high at 12636 and closed lower at 12576,0
470,attention fx news eurusd the market continued to climb as it hit a high at 12636 and closed lower at 12576,0
471,breaking news eurusd the market continued to climb as it hit a high at 12636 and closed lower at 12576,0
472,sell eurusd target 12574  sl12587  tp112556  tp212519 tp312489  good lucktraders and have a good week,0
473,usd talk of a large 12550 expiry tuesday ny cutsome looking at 12430 as key 21dma and cloud base close by,0
474,eurusd serious resistance at 12657 and 12748  commerzbank,0
475,buy the dips sell the rips on eurusd and gbpusd for our trading plan for the next month or so,0
476,eurusd  option barriers at 12650 see offers in the pair above 12600 12620 and more around 12640,0
477,starting a new eurusd short 2575  adding 2655 a lot of news due and september will be hot for our euro ,0
478,adjusted targets on eurusd trade after looking at support and resistance during the weekend new sl12686 tp12396 trade still running,0
479, im short aud against both the usd and eur,0
480,we have aud  cad  gbp  eur and usd so it could be a choppy week or a week thats sorts the direction out for the major pairs,0
481,eurusd technicals fairly decent resistance in the 12645 area so fardaily wick hit it and stoppedcurrently trading at 12565,0
482,eurusd is in supply area and confirm and sell,0
483,closed the long eurusd position and reversed it  currently short,0
484,eurusd doji star after 4 weeks of up trend  good indication of turn point and top in the place,0
485, mr david whats your tp for audusd and what about eurusd wana short,0
486,eurusd back and forth after bernanke,0
