,tweet,polarity_score
497,the cost of usd swap lines is in no way fundamental to the ez crisis and i suggest fading this riskon move in eur gbp and equities,0
498, im now short again aususd eurusd and jpyusd,0
499,five central banks lower interest rates on dollar swaps in order to boost liquidity euro and stocks spikes higher   ,0
500,watch out eurusd up and away,0
501,thnx for pms yes main pre ny open move on wti crude can be circa 125 to 150 pipsand more or same after ny open eurusd 80 to 125 pips,0
502,i have a multicultural wallet  3 currencies gbpeurusd and an old british sixpence coin,0
503,took 15 pips on eurusd and taking a break now,0
504,predicting a flat day in  with eurusd down and new debt ratings from p but there is momentum to keep it somewhat up,0
505,entered a short position on eurusd and will be shocked if i dont hit the profit zone ,0
506,in house model our in house model has established fresh short positions in eurusd and gbpusd on wednesday,0
507, kes snapshot  8990 to the usd 11928 to the eur 139745 to the gbp and 1068 to the rand importers cashing in reuters,0
508,kes snapshot  8990 to the usd 11928 to the eur 139745 to the gbp and 1068 to the rand importers cashing in reuters,0
509,short on eurusd and jpyusd,0
510, kes snapshot8990 to the usd 11928 to the eur 139745 to the gbp and 1068 to the rand importers cashing in  reuters,0
511, kes snapshot8990 to the usd 11928 to the eur 139745 to the gbp and 1068 to the rand importers cashing in  reuters,0
512,morning kes snapshot  8990 to the usd 11928 to the eur 139745 to the gbp and 1068 to the rand importers cashing in  reuters,0
513,eurusd classical technical report 1130 eurusd the market remains under some intense pressure and is now fixated on a retest of t,0
514,eurusd 13330 area resistance and 4 am 4 hour pivot,0
515,close eurcad 15pips  and close short audusd45pips still long usdcad from 10300 in the money,0
516,eur  usdthere are initial signs of a good corrective recovery towards 13379 or even 13410 supports at 13301 and 13254 zone,0
517, i mean this isnt thailand or malaysia that mom and pop will sell eur buy usd and chf they cant do any transactions with those,0
518, cont and the eur will strengthenwhile the usd is less weak now due to qebut will weaken even more in the long run,0
519, convert to usd and if you still want to be long eur maybe buy xde call option ,0
520,prepared for short entry sell stop orders in audusd at 09980 and 09950 with stops at 10020 and 09990 eurusd at 13270 sl 13310,0
521,pointed to eurusd 10min chart and asked wifey what happens next  she said bam bam pointing down,0
522,currencynews daily summary on usd eur jpy gbp aud cad and nzd v riskon environment drives gain across key asset classe htt,0
523,were back in the eurusd this morning late morning theres time for entry so log in and see the entry details,0
524,sorry could not update eurusd earlier technical problems and twitter overloadwhy it came down there was no move above 13450 13436 high,0
525,13367 ish for the right shoulder on eur usd1530 and 1 hr charts,0
526,buy usd sell eurusd and  sell audusd,0
527,bull markets are born on pessimism grow on skepticism mature on optimism and die on euphoria sir jtempleton spx djia eurusd dxy,0
528,justin  now we have 2 dojis in the eurusd daychart as the market lost confidence targets are 132 and much lower  jnussbaum,0
529,took a long on eurlong eurusd at 16 and cable at 99,0
530,took a long on eurlong eurusd at 16 and cable at 99,0
531,as stock futures ease strength comes into the usdindex and eurusd turns negative eurusd trades 13319 last 1 pip,0
532,took a long on eursold eurusd at 33 and cable at 15,0
533,sold cable at 31 and eurusd at 90 with 20 sl ea,0
534,eurusd  caution for shorts upside move could continue till 13520 13600 13740 and 13800 respectively,0
535,sold cable at 36 and eurusd at 94,0
536,be cautious with buying the eurusd and aususd the buying is because of the positive results of the italy bonds,0
537,kes afternoon snapshot  8959 to the usd 11964 to the eur 13957 to the gbp and 1073 to the rand prethursday hedging,0
538,took 5 pips on cable and 22 pips on eurusd may resell,0
539,sold eurusd at 17 and cable at 44,0
540,sold cable at 36 and eurusd at 13,0
541,eurusd and gbpusd trade near session highs after good demand in the italian btp auctions eurusd 13421 last 101 pips,0
542,commodities arent signaling this bid to the eurusd is in the area code of sustainable  gold and copper resist intact,0
543,sold cable at 35 and eurusd ay 29,0
544,what happend  789 and a massive spike in eurusd,0
545,sold cable at 30 and eurusd at 03,0
546,eurusd  offers had been reported in place to 13430 and remain in place,0
547, you have any idea whats going on  all my news stream says the euro zone is fucked and the eurusd goes through the roof,0
548,spot eurusd needs to push through 3385 and then 3400 to continue updpp has offered some support 3330 to the current rise,0
549,and eurusd at 45 long,0
550,currency news gtgt  eurusd and cdss of european nations fell after italian prime minister monti said he will propose more austerity,0
551,news now  eurusd and cdss of european nations fell after italian prime minister monti said he will propose more austerity measures,0
552,breaking news  eurusd and cdss of european nations fell after italian prime minister monti said he will propose more austerity,0
553,update  eurusd and cdss of european nations fell after italian prime minister monti said he will propose more austerity measures this,0
554,attention fx news  eurusd and cdss of european nations fell after italian prime minister monti said he will propose more austerity,0
555,expect usd strength to remain a sell with both eurjpyand eurchf bounces both now attracting renewed supply    ,0
556,eurusd classical technical report 1129 eurusd the market remains under some intense pressure and is now fixated on a retest of t,0
557,some positions closed this morning to reduce the exposure still short in audusd and eurusd,0
558,correlation between eurusd and gbpusd,0
559,took eurusd long at 35 and cable long at 11,0
560,eur  usdresistances lie around 13359 and 13388 it should test lower towards 13262 zone a clear break of 13287 would be bearish,0
561,eurusd trading very poorly considering the rally we had had in equities and commodities yesterday very poor relative strength,0
562,eurusd if price reaches 13250 we should see bounce cause there stand monthly and daily pivot points,0
563,huge head and shoulder on eurusd right now  double top on the right shoulder this is one of my favorite setups,0
564,eurusd below 13270 sell off will accelerate and we will retest 13220 from last week below there is 13145,0
565,the battle is on worldwide on resistance level is getting hotter and hotter eurusd droppings which may signals more cash on the market,0
566,eurusd trade looking good still the gbpusd is setting up nicely as well watch the video and be ready for an entry sooner than later,0
567,see how mrkts look overnight and tomorrow morning but might add to shorts fking blatant manipulation of eurusd pair around 1330,0
568,still short audusd 70 pips and eurusd 80 pips when the world is on risk were off,0
569,all i am saying is ignore the weakness in crude eurusd and btps at your own peril,0
570,stay short on eurusd stop losses at 13488 on daily close further upside could open doors to 13750 13915 and phsy 140,0
571, gm dr and the eurusd ,0
572,eurusd  bids and stops clustered around 1332025,0
573,audjpy closed classic b locked in profits eurjpy usdcad may close eurjpy watchin eurusd and usdjpy note levels on both,0
574,would  sp500 catch up on the eurusd and gbpusd down trend since opening,0
575,dropped cable at 10 pips and eurusd 5,0
576,eurusd audnzd shorth  at 13375 and 13165 stop 1345 and 1322 targets 1325 and 13080         long usdcad at 10310,0
577,long eurusd at 69 and cable at 54,0
578,long cable at 67 and eurusd at 73,0
579, hohum will have to find somewhere safe to invest and not sure its anything denominated in eur or usd any decade soon,0
580,sell eurusd 13394 tp13368 sl13415 wait for it to go near the ma 20 in 5 min and then wait for it to break it to move the tp to13348,0
581,resold eurusd at 88 and cable at 86,0
582,sold eurusd andat 85 and cable at 78,0
583, i closed some of my positions and i am short eurusd and dow i will reopen crude if break 9456 or at 1033565,0
584,sold eurusd at 57 and cable at 57 with 20 sl each,0
585,targeting 30 pips on eurusd trade and 20 on cable initially,0
586,collecting some pippers here in eurusd gtgt out off my shots from 13250 and 13350 here 3375 gt 12525,0
587,look for more weakness in sp and eurusd into us opennot sure on the close yet,0
588,13400 looks like an area to add 2 my short in the eurusd and this will give me 20 of my position size i am trading really small right now,0
589,whats going on with czk lost to usd 16 and even to eur 7,0
590, on the sidelines took profits on dax  eurusd now coffee and watching will react only if possible on news,0
591,eurusd 4 hour pivot 8am was 13295 once clear of it and above that 20ma on 15min chart off it went,0
592,usd germanyis not working on plans to issue a joint euro bond and there are currently no plans to headlines from local officials,0
593,eurusd classical technical report 1128 eurusd the market remains under some intense pressure and is now fixated on a retest of t,0
594,usdsek clears 700 focus on test of key november 2010 high eursekthe market remains very well supported and we look for a continu,0
595,entered audusd short at 09870 took a small eurusd short at 133000 and usdchf long at 09276 these are all small positions 20 loaded,0
596,ecbs noyer says ecb is lender of last result and that a breakup of euro is out of the question eurusd trades lower at 13284,0
597,funny how every1 wants to be a hero strange i never had that desirei d just rather sit and clap while the fools just walked by usd,0
598,good morning a strong open for the risk pairs all my audusd eurusd and eurchf longs working well so far lets see if it continues,0
599,good morning a strong open for the risk pairs all my audusd eurusd and eurchf longs working well so far lets see if it continues,0
600,how is it that the inr is rs 52 against the usd but has remained consistent against the eur and the gbp euro crisis,0
601, cents 08 pips on some of our most popular pairs such as eurusd usdjpy and audusd,0
602,my currency model is indicating that the eurusd should bounce here to 133037  and then fall to zero  ,0
603,eurusd trapped in his 100 and 200 sma 13317  13278,0
604,next few minutes of eurusd chart are crucial waiting to report first 5 waves down and maybe call it a faker,0
605,yaaaawwwwnn eurusd sliding now gold holding up silver not so much lol get an 24h fx acc and lose sleep or go  ,0
606,big gaps on the audusd and eurusd paircant quite figure out whyso am on the sidelines  ,0
607,from the middle of december the volatility will be high expected leader of the movenentseur and usd,0
