,tweet,polarity_score
246,eurusd 102 inrusd 160 and sp 500 futures 45,0
247,eurusd thoughts  rt might get to 129 before we see a decent bounce failure there and its hallo 1245,0
248,when people talked last year about eurusd parity it made me laughand now i have been hearing the same thing lol lol lol,0
249,eurusd 130 lowest since last january lets get even lower im going in italy for holidays and i dont wanna spend too much,0
250,be very cautious if you are short eurusd  it cannot keep falling and 130 barrier should hold  could even sqeeze higher,0
251,lots on today italian and german bond auctions  talking to parliament on intergovernmental treaty can eurusd get to 129 today,0
252,eurusd  minor barrier interest at 12980 and 12975 ahead of next larger interest at 12950,0
253,usdnok looking to establish back above 6 handle eursekthe market remains very well supported and we look for a continuation of gai,0
254,daily report eurusd pressing 13 as italy and german auctions eyed,0
255,eurusd fell sharply last night to an 11month low and within spitting distance of the 13000 level usdzar has been dragged along,0
256,opening calls ftse 30 dax 35 and eurusd at 13028,0
257,eur usd is set to end 2011 with a bang my latest forecasts for eur jpy gbp chf aud and nzd  now available by email  trlnetnz,0
258,world is stuck with us dollar because euro is the second biggest reserve currency behind it  hit number 2 and number 1 gains  usdx eurusd,0
259,now up almost 200 pips this month big moves in gold and eurusd stop losses crucial in these times,0
260,long term bottom in the making good place and time to get long spx eurusd usdcad,0
261,eurusd reached first and the second target 160 pips close half of your posetion and move your sl to be   ,0
262,rt    eurusd extends loss after breaking fibo support gold stocks and the euro are all lower as the odd ,0
263,the eurusd can be oversold all the way to less then 0 and the stoch can merge and fuse under the lbb for same duration,0
264,new low for the day on eurusd 13026 and counting,0
265,imho break at 13 and then quickly to 125   down down down  eurusd 13053 101,0
266,we believe  eurusd bottomed today and could drive risks higher into xmas  long positions should be monitored respect 1300050 spx,0
267,in  out of usdchf  usdcad longs with 35 pips each and a great 70 pip short on the eurusd now on sidelines waiting for puulbacks,0
268,there goes the eurusd crashes right through support at 13150 and is sitting below 13100 if it holds below 13150 next target at 12875,0
269,serious divergence between eurusd and the sp 500 hereequities should follow the currency pair,0
270,looking like a retrace on aud usd and eur usd,0
271, i bought eur and usd and sell jpy and theyre related sighhhh,0
272,correlation between eurusd and     broken today,0
273,continua come segnalato il declino di eurusd and watch what cococa is doing,0
274,will add one long for eurusd 13075  always think about 05rule risk and moneymanagement ,0
275,usdchf hits 09400 as mentioned 1 hour ago and eurusd drops to 13115 at the same time,0
276, stayed up late and woke up early checking up on eurusd i already see how this is finna go lol,0
277,buy orders on eurusd and gbpusd remember the trend is your friend ,0
278,demand for usd vs eur growing much faster and close to record levels,0
279,7 min til ny flows will see if eurusd gonna push till recent lows and test it one again,0
280,retail sales 02 missing expectations of 06 esz1 coming of session highs time to short again wait and see 1st eurusd heading to lows,0
281,long aussie at 27 and eurusd at 05,0
282,positive data of eureconomic sentiments has refrained the eurusd and other highyielding currencies to go further downward,0
283,reversed my position with sell of eurusd at 84 and aussie at 94 as i said already topped out earlier in the hr,0
284,long eurusd at 13200 and aussie at 13199 with 20 sl ea,0
285,eurusd classical technical report 1213 eurusd the latest corrective rally appears to have stalled out by 13550 and the market l,0
286,eurusd touch lower rally above 13200 proved fleeting and we re presently back down at 13175 russia notable seller in recent trad,0
287,eurusd  buy stops 13210 and more through 13225 offers  1320010 with larger 13250 bids  13150 with stops below through 13140,0
288, was scratching my head until i remembered your eurgbp and did the fib there figured thats what you meant im long usdchf,0
289,can i get a break on the market can the eurusd go up up and a way its pretty low isnt it,0
290,was looking for 13150 on short eurusd trade and got 13160flat now,0
291, 110 in audusd and 138 in eurusd are my approximate conservative targets,0
292,eem fxi ssec and eurusd look like hell,0
293,looking to buy more than to sell eurusd and to sell usdcad,0
294,looking to see the eurusd on 13131 resistance levels to buy around there and also to short usdcad patience,0
295,eurusd falls to below 132 as predicted last evening and now in 13160s zone audusd heading back to parity once again,0
296,i am not trading eurusd the next key level is a biggie at 13145 below here and there is a potential waterfall chart be careful though,0
297,  yo dr j hope ur well my friendeurusd getting very close to 041011 low of 13146 break out play here entry and stop,0
298,how long before parity in eurusd place your bets against fxe and into euo if you think it is only a matter of time,0
299, bernanke just spent mega  on swap lines to prop eur and keep usd lowseems idiotic to add to the decline now,0
300,usd breaking away via eur usd monthly support broken and failed on a retest of former supportresistance,0
301,so many conflicting indicators weak gains in tlt and vxx despite equity slide very low volume but eurusd level is very bearish,0
302, thanks today has been gud sold eurusd and did well just anticipation a buy move now with the strong indication of upward move,0
303,13 theyre done and gone and so is the euro eurusd,0
304,eurusd trapped at session lows and support at 13210 not making much attempt at a rebound despite some rebound in commodity prices,0
305,eurusd 3200 is holding for support and 5600 for gbpusd if the eurusd breaks 3200 look for 3180 next key support to get broken,0
306,gbpusd 5620 looks to be good resistance for now and 3230 on the eurusd both pairs are just grinding it out,0
307,new lows for eurusd 1321517 and counting,0
308,eurusd is holding the key area of support between 13230 and 13210,0
309,dear w3c please add currency entities to html matching the iso codes like usd eur jpy gbp thb and so on people will thank you,0
310,eurusd gbpusd audusd all look to be moving south and picking up some momentum,0
311,the eurusd has already broken fridays low and now testing the down trend support,0
312, when 99 are bearish sometimes things happenbtw eurusd gets more and more political biasmuppets,0
313, hey louisa have a look at the market effect of your pms comments on friday bids for bgpusd and offers for eurusd nice,0
314,out of eurusd short at 13250  i dont want to push for lower as downside is limited and a squeeze could take out all profits 120 pips,0
315,eurusd retrace possible sell zones 32920 and 33043  10 20 sl should suffice targeting 3220,0
316,euro crumbling down in eurusd now attempting to break 13250 and targeting 13200,0
317,market talk of a uk clearer buying gbp gbpusd trades 15615 56pips last and eurgbp trades at session low at 08500 38pips last,0
318,long eurusd at 79 and aussie at 14,0
319,usd stops below 13250 and more bids 1321513200 with barriers definately cited at 13200with stops below,0
320,would a long be wise on the eurusd pair or wait and see for more clearer signals,0
321,long aussie at 44 and eurusd at 10,0
322,eurusd is still a sell on rallies with a target of 130 into year end and 125 in 1q 2012 ,0
323,eurusd classical technical report 1212 eurusd  the latest corrective rally appears to have stalled out by 13550 and the market ,0
324,good news from my last post for the inrusd and eurusd  shorting both pair has been profitable  consumer stocks are still in vogue,0
325,inrusd 118 eurusd 61 and sp 500 futures 60  jap tobac and seven  i held up fine this session  indian cons stocks hlding ok,0
326,long aussie at 34 and eurusd at 05,0
327,eurusd tests 133 in early europe while cable breaks support at 156 and dips to lows at 15553,0
328,eurusd classical technical report 1212 eurusd  the latest corrective rally appears to have stalled out by 13550 and the market ,0
329,usd eur and sdr will go down the toilet if not backed by ,0
330, for this daytokyo market is closeeurusd go to down and gold towhat can something even neutron system floting 8 gold 135,0
331,maybe eurusd will now fall to 12800 and then the ecb will step in after this week it may be better to stay in cash too much volatility,0
332,you can buy eurusd 30 and buy usddkk 70 and take profit of both sides of this december volatility,0
333,eur usd scrach the wall to 13373 and want to move bearis but lets see,0
334, yeaph and this is why expeculators will focus on it big economy in a weak position somewhere in between usd and eur,0
335,also and i hate to trot this out big pic macrotech eurusd top false 126 down break shud mean 160 was not ultimate high macro ,0
336,  when the eur and usd are in trouble out govt says indian economy grows strong but inr weakening says otherwise,0
337,we forecast eurusd to 120 by  q2 2011  downside risks and for h2 2012 we forecast only a slight eurusd recovery towards 125 nomura,0
338,and fx voodoo2 open sell eurusd,0
339,euro stronger today over eu fiscal union and stops being triggred below the 133 level early in the session eurusd 13375,0
340,were all sitting on our hands remembering the end of the last summit and the eurusd squeeze,0
341,long cabe at 19 and eurusd at 47,0
342,took cable long at 39 eurusd at 54 and aussie at 67 looking for a break of current resistance levels here but will stay vigilant,0
343,long aussie at 62 cable at 41 and eurusd at 67,0
344,long cable at 42 eurusd at 69 and aussie at 53,0
345,reverse position on eurusd to long usdcad long gold long short bce  rogers long alexza pharm and thq inc,0
346,currencynews eurusd update fundamental and technical outlook until now leaders where able to cover most of the subjects a htt,0
347,the usd and eur ping pong game is still on,0
348,am i the only one that checks the usdeur bal and not the eurusd when i shop in  i need to know how much  i will be spending ,0
349,long cable atb 50 and eurusd at 39,0
350,spot eurusd trying for 335061 currently would need to move above both and 3400 to continue in decline 32663250 would need to give way,0
351,market talk of middle eastern and asian names buying eurusd trades 13313 26pips last  unconfirmed,0
352,market talk of middle eastern and asian names buying eurusd trades 13313 26pips last  unconfirmed,0
353,eurusd x rate below 133 wondering the currency swap volume and whos making the big bucks,0
354,eurusd 13308 trading buy it wll go upto 13335 and then 13355,0
355,what to watch todayeu leaders comments following the summit and the market reaction notably in european bond markets and eurusd,0
356,major currency rates per usd eur  075 gbp  064 jpy  7764 chf  093 aud  098 cad  102 and hkd  778,0
357,i got a some usd and eur in my pocket ,0
358,i hope it goes up on this bullshit so i can resell ym eurusd gbpusd and put a full es position on again  i want it to go quickly,0
359,i will be with  on  betweeen 5pm and 6pm discussing the imf eu merkel sarkozy eur usd and the eu summit,0
360,out of my eurusd gbpusd ym sell contracts have nq and es short still on the table,0
361,usd strength cable and eur back into the selling trend 12650 by xmas still on the radar,0
362,days like today you should be hedged  i was at first long the eurusd and ecb news caused a spike then price reversed,0
363,we had a nice 70 pip morning with trades on eurusd eurjpy and gbpjpy 445am turned out to be a great time see you tomorrow same time,0
364,any way i think you can get in any after the bounce back long usd and short audeurgbp,0
365,i take my 75 pips and run gt eurusd short from 13401 closed 3326,0
366, placing a eurusd  limit buy order  13260 with 13195 stop lt at this rate youll get filled and stopped out by 10am ny ,0
367,close audusd and audnzd and eurusd,0
368, and eurusd and gbpusd,0
369, if its risk off wouldnt that mean usd will rise and eur aud will also rise,0
370,eurusd moved 15 pips higher and euribor fell 6 ticks after the ecb cut interest rates by 025 as expected,0
371,eurusd testing intraday highs and major resistance,0
372,haha look at the difference between es and eurusd  no 50 bps cut ,0
373, likewise for eur and usd pairs only rumors will move this market from here on,0
374,eurusd will fall and fall big holding till next week,0
375,no trades for me on m1 eurusd so far chppy markets price is inside h1 aims level and never broke it so far so off until nyo cheers,0
376,market talk of middle eastern and uk names buying eurusd trades 13421 9pips  unconfirmed,0
377,market talk of middle eastern and uk names buying eurusd trades 13421 9pips  unconfirmed,0
378,esf and eurusd moving in opposite directions,0
379,posting in rmb is currently disabled u may still post in usd and eur,0
380,eurusd turns at 13351 and back up 13427 looks like it could be a pivot high a move below 13414 today and us could take it lower,0
381,eurusd trapped between 13350 and 13400 gold its starting to show an ascending triangle pattern,0
382,mcg how does this work they borrow free usd swap for eur only to have eur avail cheaper in the future and repay in stronger usd,0
383, i think it would be more likely that sterling is being treated as a safe haven its up against both usd and eur,0
384, the solution is default and repay debt inevitably a lower eurusd,0
385,anonymous german official comments to be taken with grain of salt bad and false rumor again eurusd aapl spx dax ftse gbpusd,0
386,sa retail sales down 03 yoy also further eurusd weakness dragging zar with itnow trading at usd 808 eur 1082 and gbp 1262,0
387, who is this german official and in what capacity looks to me anyone can euofficial these days for exitement eurusd,0
388,hourly charts of  and  are in sideways trends but the daily charts remain negative so i still favor the downside a rise for ,0
389,sold eurusd at 05 and cable at 09,0
390,audusd still in the range but break may follow soon towards 104 in such case wathc out for more weakness on euraud and gbpaud,0
391,holding eurusd short at 134158 and 133158 is my tp i gonna sleepzzzzz,0
392, can u plz explain to me why 2 entries and 2 targets for eurusd   iam new supcriper,0
393,out of my eurusd and audusd longs 67  73 pips respectively dont want to be overexposed to this market lt audusd longs working,0
394,out of my eurusd and audusd longs 67  73 pips respectively dont want to be overexposed to this market lt audusd longs working,0
395,jp eurusd hourly  keysupport between 1332713292 and 13214 has to be defended to prevent a strong selloff,0
396,attention fx news  eurusd touched new lows following merkel comments on joint eur bond issuance and in the illiquid conditions of,0
397,audusd still in the range but break may follow soon towards 104 in such case wathc out for more weakness on euraud and gbpaud,0
398,audusd still in the range but break may follow soon towards 104 in such case wathc out for more weakness on euraud and gbpaud,0
399,trading the range looking for top to form on 15 m on audusd and eurusd it could reverse sharply if it was to hold the range or breakout,0
400,packing for my final trip of the year to oslo but i have no nok notes  i do have dkk huf pln eur and usd though,0
401,filled 34 on eurusd waiting for trend reversal and shorting for another quick scalp in and out people    ,0
402,parabolic sar started a new uptrend selling all of my holdings in eurusd  134  if it rips ill wait for psar confirmation and short,0
403,es run to 1259 hit a wall cl hanging out at 101 dx stalled and eurusd stuck under 134 nobodys having fun today,0
404,nice pop against usd eur and aud moving,0
405,eurusds sideway trading is still in progress and intraday bias remains neutral with focus on 13260,0
406,eurusd looks to pare losses and retake the 13400 handle last 13395 7 pips,0
407,as expected the market is trying to get back to a normalisationsee how eurusd is going down and usuchf going upjpy is still so strong,0
408,the eurusd continues to twist and turn is consolidation which is developing into a large triangle note the recent inability of cont,0
409,eurusd pair moving upmrkts will swallow this and move on during us sessionwould like to see silver gt32 and gold gt1720 to feel comfortable,0
410,short eur  usd possible head and shoulders here  looking for good things with eur  cad short as well,0
411,ssi has seen a very big shift overnight everyone was previously long usd vs eur and gbp but theyve flipped contrarian gbpusd bearish,0
412, eurusd 13369 down by 00033 or 23 this will hold grains prices and thus mos cf pot down unless they have stock specific news,0
413,bate  only usdchf and eurusd have enough swings but eur 36th bar is just below red line chf has enough bars,0
414,usdchf above 09330 we are up off and away the charts look really bullsish may coincide with a eurusd breakdown,0
415,rt   european market update french and german bonds decline as sp raises stakes for this weeks eu summit eurusd  h,0
416,sp pressure on germany france and cois very bullish for stocks though being dismissedit decision process will be easier eurusd,0
417,closed the eurusd positions from 13340 and 13440 3405 6535,0
418, so if i have some eur should i leave them be or convert them to aud chf gbp or usd and if so which lt ita lira is best,0
419, i think market is work very hard to convince me to go long on eurusd and it allmost did ,0
420,spot eurusd 3400 and 3420 for any try towards 3450 in decline 3350 then lower than 3336 for any go lower towards 3300,0
421,took aussie long again at 03 and eurusd at 75 long also,0
422,took sells at 5610 on the pound and 3360 eur eurusd closed below s1 on the hour,0
423,eurusd at 13368 talk of sell stops through 13360 and 13350,0
424,important support for eurusd and key support at 13360 then 13360 would be seen through further weakening of the eurusd steve,0
425,still long the usdchf from yesterday at 09218 and now looking for eurusd short,0
426, so lets get an update on positions i am short eurgbp eurusd and gbpusd,0
427,can the  keep up the bank and financials tomorrow theyre soothing for a sideways with sp news pray aapl bac dji eurusd,0
428,and as i said dont trade etfs daily settled you will be puking tomorrow futures should be ok eurusd drop should also help hedge,0
429,ft story on sp so called warning to germany and co of downgrade another false job to spook the market to some advantage eurusd spx,0
430,currently selling audusd and buying eurusd  i am in negative lets see if market will adjust,0
431,trading  eurusd gbpusd usdjpy and gold,0
432,as always eurusd and gbpusd is on the watch list  but remember to minimize your risk especially due to the never ending euro troubles,0
433,lets hope ny open brings more momentum all levels quoted for eurusd usdchf and wti crude remain in view until any breaks up or down,0
434,level money on euraud  usdchf longs and out of the money 20pips on nzdusd short i am continuing to hold,0
435,spot eurusd rise would need to get above 13500 and 13550 to continue counter move would need to move through 13430 and 13400 to continue,0
436,eurusd daily 20 ma resistance waiting for 4 hour candle and pivot at 8am there is good space above to fill,0
437,4h chart bearish divergence stochastics and market sentiment indicates a bearish eur usd dont get fooled by those mofos who say we,0
438,the  indicative nzd levels are 07785 usd 07605 aud 05815 eur 04990 gbp and 6080 jpy,0
439,the  indicative nzd levels are 07785 usd 07605 aud 05815 eur 04990 gbp and 6080 jpy,0
440,the  indicative nzd levels are 07785 usd 07605 aud 05815 eur 04990 gbp and 6080 jpy,0
441,the  indicative nzd levels are 07785 usd 07605 aud 05815 eur 04990 gbp and 6080 jpy,0
442,the  indicative aud levels are 10250 usd 13150 nzd 07635 eur 06560 gbp and 8000 jpy,0
443,the  indicative aud levels are 10250 usd 13150 nzd 07635 eur 06560 gbp and 8000 jpy,0
444,the  indicative aud levels are 10250 usd 13150 nzd 07635 eur 06560 gbp and 8000 jpy,0
445,the  indicative aud levels are 10250 usd 13150 nzd 07635 eur 06560 gbp and 8000 jpy,0
446,took a swift 30 pips trading the gap on open with eurusd and audusd off to bed,0
447, sp and eurusd,0
448,eurusd outlook december 59 eurodollarenjoyed the new hope for a big plan to resolve the crisis the upcoming week is very busy and,0
449, yes the fed  eurusd swap line and discount window borrowing for the likes of deutsche and soc gen,0
450,to play neutral on currencies id go long the eur sell usd and buy usd and sell nzd  gives you a hedge just in case eu doesnt deliver,0
451,eurusd outlook december 59 eurodollarenjoyed the new hope for a big plan to resolve the crisis the upcoming week is very busy and,0
452,wrap up will be next and will post the final adrs for dec 2 shortly still watching eurusd to see if it reaches target,0
453,rt major bullish usd move today and not just vs eur  brit pound very weak too  no inflation and intl worries  king dollar,0
454,with the euro tanking and bonds rallying i would expect esf to close down for the day tlt eurusd euo spx,0
455,major bullish usd move today and not just vs eur  brit pound very weak too  no inflation and intl worries  king dollar,0
456,eur usd  lower and lower,0
457,eurusd takes a dive below 134 and so does us equities spy shedding gains fast still solid green possible nearterm buying opportunity,0
458,eurusd  13560 and 13610 are very critical levels at the moment 13650 could be the final target for longs,0
459,covered short eurusd 100 cash and not touching a thing until sunday at 5pm dont trust any of this have a good weekend all,0
460,covered short gbpusd waiting to cover eurusd and hit the sidelines for the rest of the day dont like what im seeing here,0
461,one thing to note on teh eurusd it broke out of the tri and has since dropped back in hmmm,0
462,eurusd trades back below 13500 following the us nonfarm payroll and unemployment data trades 13498 37 pips,0
463,going down and down classical sell on news still expect eurusd to fill hourly gap at 13240 before jumping again,0
464,short eurusd and gbpusd ,0
465,usd london dealers always noted decent offers into the 13550area and these are still looking to cap the topside bofore nfp ,0
466,in one cc transaction aa mixed usd eur and gbp will be fun to see the final total in the statement   ,0
467,eurusd im long  13488 with tp 13530 and sl 13475 i will try to turn my 1000 account in 10000 by today a lot of work to do,0
468,short eurusd to 13488 tp to 13453 and sl to 13520,0
469,eurusd  picking up talk that stops are beginning to build above 13500 and 13530,0
470,sold aussie at 62 and eurusd at 82,0
471,very borring trade for eurusdbut in few hours the us news will move our eyes up and down up and downdespite the down trend,0
472,eurusd classical technical report 1202 eurusd overall the market is still locked in a downtrend and we expect a retest and brea,0
473, and even if say ecb theoretically ceases to exist fed can sell eur buy usd at market price loss wouldnt be 100 on exnn,0
474, buying ys30s tighteners on tsykurv and usd dollar vs eur best way to park assets and exploit 12 ez macro,0
475,seems like eurusd will go down this night and tomorrow but still it depends on news i have opened short position  13471 with tp 13449,0
476,still have working orders to short eurusd and gbpusd remember people in and out all we do is scalp some pips here and few there ,0
477,working orders to short eurusd and gbpusd ,0
478,in and out quickly this am for 20 pips each on eurusd  gbpusd flat nowbe careful on day following a big range day happy trading all,0
479,its the same with eurusd stuck to a major resistance   gtgtgtgtgt must pop or both will fade and the greenback will rise,0
480,audusd capped at 10245 eurusd at 13500 i hate it but sit back and wait after yesterdays moves let the dust settle let market come 2u,0
481,audusd and eurusd bull flags seem to be breaking out lets see if it continues,0
482,prepare for a sudden spike down for eurusd as there will be a great deal of buyers today let me check sentiments index and brb,0
483,short eurusd at 13450 with technical target 12850 and stoploss at 13600,0
484,gs liquid reserves eur and usd pictet liquidity chf blackrock sterling liquidity db portfolio eur liquiditydws us dollar reserve,0
485, short those nzd pairs still short audusd  long euraud and loving the 30 minutes charts right now both bouncing,0
486,eurusd  caution for shorts upside move could continue till 13520 13600 13740 and 13800 respectively yesterdays tweet ,0
487,if you love trading the majors then today is your lucky day because i have spotted awesome setups on eurusd gbpusd and usdchf,0
488,the ss eurusd working nicely for the daypeopledontand refuse to understand monetary policy and cbanking,0
489,eurusd will touch 3400 and go up 50 pips,0
490,coordinated intervention by fed ecb boe boc boj snb and china to drive usd down and save the others audgbp  eur etc,0
491,in eurusd an abc from the 13260 low looks to be over or is going to be over soon expecting a correction and an upside continuation,0
492, eh eurusd at 13519 and rising ,0
493,trailing stops to be eurusd  13288 audusd  09737 and 09839  ,0
494,trailing stops to be eurusd  13288 audusd  09737 and 09839  ,0
495, sorry im just pissed at myself right now i was long both eurusd and audusd but changed position just before big move,0
496,wtfi walk the dogs and come back to wwiii out of my lt usdchf long stopped out but covered it with a great eurusd long and made pips,0
