,tweet,polarity_score
487,if the usd will gain from here perhaps the eur and gbp will drop stronger than aud or nzd just for some days,0
488,eurusd  sell  12606 with tp  12453 and 12377 with sl 12682,0
489,usdjpy i sense a lot of confusion in the yen this morning still very weak against the usd aud and cad only eur love ,0
490,if i had to bet i would say eurusd would drop into its next long setup and we will see a eur  usd rally in the next 12 months,0
491,us gets the usd selling bug and pushes usd to a fresh days high of 12611 next resistance is at 12624,0
492, on a bit of a tear this morning as it moves within striking distance of recent highs against  and ,0
493,the trends for eurusd euraud and audchf are still strong might enter with fresh positions after bernanke speech,0
494, i expect no qe3 action and then usd stronger than eur gives downtrend eurusd,0
495,usd mideast and asia buy orders eyed 1248090 fund pt buy orders seen 1243040   ,0
496,it seem to me that the pound is heading low and the euro high im short gbpusd and long eurjpy we see how that gos,0
497,trading the eurusd  at times life can be plain and boring until its not,0
498,sampp futures and usdeur unchanged the markets dont care how it begins because they know how it ends ,0
499,eurusd showing indecision and mixed signals id go long because of the signals on which i rely but im usually an hour early ill wait,0
500,look to buy the eurusd at the 12449 area sl 75 pips and tp  125 pips use 05  1 of account risked,0
501,spanish refusal of bailout terms sees fractional drop on eur and upswing in usd gbpusd high of 15874 low of 15781,0
502,so the eurusd rallied from a consolidation double bottom weeks ago and now it faces a consolidation double top ,0
503,very good rr ratios for long eurusd and gbpusd positions,0
504, it helps that the volume is so low if egypt starts issuing a lot the eur and usd yields would come up sharply,0
505,will post my new fx trades please keep updated so far i already shorted audusd eurusd nzdusd small drawdown on euro and,0
506,have u seen as soon as we book profit in our short trade of aud usd and eur ussd  both are up by nearly 25 pip,0
507,eurusd gains rising toward 100dma at 12589 german bunds gain spanish and italian 10yr yields rise,0
508,eurusd and esf bleeding over central bank additional stimulus uncertainty,0
509,sell eurusd at 12560 stop 12630 targets 12490 and 12420,0
510,eurusd starting to see buyers mixture of macro and real money names,0
511,danske looking to fade usd strength and sell if the august high of 12589 is seen for an exp decline back to the aug 28th low of 12466,0
512,eurusd  the door is open for 12600 and may be more ,0
513,update eurusd the market lost some steam just ahead of 12589 and appears to be consolidating,0
514,attention fx news eurusd the market lost some steam just ahead of 12589 and appears to be consolidating,0
515,news now eurusd the market lost some steam just ahead of 12589 and appears to be consolidating,0
516,currency news gtgt eurusd the market lost some steam just ahead of 12589 and appears to be consolidating,0
517,breaking news eurusd the market lost some steam just ahead of 12589 and appears to be consolidating,0
518,who is better eur or usd dont forget that both of them are reserve currency and bear in the mind there are many standby buyers for eur,0
519,thanks eur   and you usd just get out from my way gto,0
520,we are going to offfer a special low spread festival where customer will be charged 16 pip eurusd trade come join and love the trades ,0
521, in eur and actually had a debate with me for 1 hour on this make me to  go for usd knowing full well i am a professional trader,0
522,trader  lost 30 eurusd then screwed my head on straight and made it back to break even for day  woopie,0
523,usdcad is moving up nicely now and the eurusd is staying in a downward range istill expect lower targets from the eu but it is slow,0
524,if stocks start to go down i may jump short audjpy and gbpjpy eurusd will see,0
525,usd usd  the us beige book has released and in simple word the us economic growth it shown on every district,0
526,boamlgt buy usd against eur and jpy in anticipation of a disappointment in fed chairman bernankes speech at jackson hole on friday ,0
527, audchf short and euraud long since monday and gbpusd long since a few minutes,0
528,eurusd is making another try to take out the 125 high and sampp500 is also trying to take out its key level,0
529,eurusd needs to clear 12556 to get any upward momentum so still under presure tough end of thin month trading tight ranges and volitlity,0
530,light and would short more heavily at 12650 rt  are you still looking for 12620 to go short as you said its an ideal entry eurusd,0
531,draghi oped takes place of jackson hole speech eurusd support strong and unwavering,0
532,eurusdthe euro rose on weak us consumer confidence report and renewed expectations that the ecb would take the necessary steps to cope w,0
533,eurusd looks like it wants to correct parts of yesterdays gain i think we might trade lower and try to reach 12510 before buyers step in,0
534,eurusd sell 12565 and 12612 with tp  12518 and 12471 with sl 12660,0
535, eur  usd  technical analysis having recently broken through the medium term resistance level at 124 and in d,0
536, eur  usd  technical analysis having recently broken through the medium term resistance level at 124 and in d,0
537,eur  usd  technical analysis having recently broken through the medium term resistance level at 124 and in doing so completing th,0
538,the aud opens at 10370 usd 08255 eur 06555 gbp 8140 jpy and 12890 nzd,0
539,the aud opens at 10370 usd 08255 eur 06555 gbp 8140 jpy and 12890 nzd,0
540,  im short aud from 10370 and eur usd from 12559 these are for long term holds for at least 200 pips each,0
541,as the eurusd moves higher simply protect those profits if you are still in like me and let the usdcad run too book 50,0
542,sell eur usd from 12580  12620 to target one the weekly pivot 12465 and target two weekly s1 12340 stop loss above 12700goodluck,0
543,i open short in eurusd and i got 8 pips profit,0
544,eurusd to rangebound between 12377 and 12570  danske bank,0
545,in eurusd the 100day sma currently comes in ahead of the 126 figure and is likely to be a key resistance level,0
546, was long now flat looking at crosses right now majors fraught with eur and usd confusion,0
547,eurusd up as spain and italy conduct successful security auctions isaac causes major shutdowns in gulf,0
548,eurusd up as spain and italy conduct successful security auctions isaac causes major shutdowns in gulf,0
549,eurusd up as spain and italy conduct successful security auctions isaac causes major shutdowns in gulf,0
550,eurusd up as spain and italy conduct successful security auctions isaac causes major shutdowns in gulf,0
551,eurusd up as spain and italy conduct successful security auctions isaac causes major shutdowns in gulf,0
552,eurusd up as spain and italy conduct successful security auctions isaac causes major shutdowns in gulf,0
553,eurusd up as spain and italy conduct successful security auctions isaac causes major shutdowns in gulf  ,0
554,eurusd likely to test 12600 and even 12700 ahead of jackson hole,0
555,emini sampps are unchanged and commodity prices are mildly lower as japan downgrades economy eurusd up  ,0
556,emini sampps are unchanged and commodity prices are mildly lower as japan downgrades economy eurusd up  ,0
557,emini sampps are unchanged and commodity prices are mildly lower as japan downgrades economy eurusd up  ,0
558,emini sampps are unchanged and commodity prices are mildly lower as japan downgrades economy eurusd up  ,0
559,usd short get squeezed with focus on ez m3 and jackson hole better selling eyed now into 12600 ,0
560,mario draghi not going to jackson hole  lets see what investors read into this and ifhow  it affects the eurusd,0
561, great product guys any clue on how we can bill customers in eur and usd though,0
562,eurusd  sell 2498 and 12559 with tp  12437 and 12377 with sl 12620,0
563,looking to enter long audnzd and long eurusd at break 12510,0
564,eurusd slip to be shallow and likely shortlivedbank maintains its nterm tactical long while 12440 sup remains intact morgan stanley,0
565,closed the short cable and opened a long eurusd,0
566,good morning all eurusd 12484 i sell below 12471 and 12448,0
567,closed the short eurusd and opened a short cable,0
568,usd buy orders around 12450 but stops sub12420 and sub 12400,0
569,weve got the opportunity to add to our long position on eurusd at 12460 tp remain the same and gbpusd at 15750 tp remain the same,0
570,weve got the opportunity to add to our long position on eurusd at 12460 tp remain the same and gbpusd at 15750 tp remain the same,0
571, daily chart art  august 28 2012 attention swing traders usdchf gbpusd and eurjpy are dishing out super,0
572, ultimately there is a new element here and it is usd or jpy or eur even if temporary on a timeline,0
573, same thing usd and eurusd also no new low 4 days wpl and no new high 4 days csl,0
574, this short eur usd which is your entry stop and target  please,0
575,usd you also can share your opinion and forecast glad if anybody can share with others thanks in advance,0
576,usd will reached to level 118 at september really interest to hear from experts and analyst also senior trader continue,0
577,usd not sure but you guys can check it on your daily chart would it as many forecast from ew and other pool predict usd will,0
578,   porsche and bmw were still highly regarded cars at 160 eurusd this is a biased view main point is  skill,0
579,us dollar index is on some support here and could rally now  would fit the timing of the spx retopping  spy usdx uup eurusd,0
580,  i use looktel money reader for eur gbp and usd and works well,0
581,sell eurusd and take profit at 124910,0
582,closed the short cable and opened a short eurusd,0
583,1 lp 1400  shipping and handling 2100  3500 usd gt 2915 eur f u c k m e s i d e w a y s,0
584,closed the long eurusd and opened a short gbpusd,0
585,usd more larger expiries at 12500 and 12550 for the ny cut,0
586,usd sell orderss andstops at 1253545 remain intact for nowbuy orders below 12500 underpin,0
587, underpeforms todaybut uk holiday has played its partlooking for minor gbp setbackvs usd and eur going forward,0
588,eurusd has found support abv the rising 100hour ma and the hourly uptrend remains intact as result i expect another rise today,0
589,usd progress capped ahead of event risk barragemarket volumes down and price action tighter ahead of bernankewyoming,0
590,i was clearly too aggressive in my gold short positioning so im going to sit an wait but im back long usdcad and short eurjpy,0
591,eurusd sell 12513 and 12581 with tp  12445 and 12377 with sl 12650,0
592,if you have been following im in two trades eurusd long and usdchf short moving stop on both,0
593,eurusd perhaps some real volatility this week as traders come back to their screens politicos jawbone and bankers obfuscate,0
594, depends on the result well that and forexpro dont think ill try and predict it this time but will effect dax and eurusd,0
