,tweet,polarity_score
251,if answer is positive  the eur usd can break the triple top and go for 1328913321,0
252,price piercing 12892 on eurusd and 10449 on audusd would signify the cancellation of any,0
253, and what do you tink about fiscal cliff eurusd and american stoch market,0
254,okeurusd keeps punching lower and audusd refused to close above 10480 what a slow day,0
255,however considering gbpusd is in bearish trending mode and considering other technical aspects of eurusd movement,0
256,eurusd and gbpusd is at resistance here,0
257,watch eurusd at res 1299013015 and sup at 1291012885 bias for extn into 1314013170 nearshort term range unchanged at 129134,0
258,asia markets are mildly higher despite the ecbs downgrade of growth forecasts for the eu which crushed eurusd and sent usdasia fx higher,0
259,fx snapshot 12862 mxn 2077 brl 1605 gbp 1297 eur and 82395 jpy gold 169890 up 650 usd oil 8638 down 150 usd,0
260,eurusd usdchf and eurgbp look likely but bear in mind nfp,0
261, understood sir thank u for your time my 2c is that both the eur and the usd are funders against high growthinflation emfx,0
262, congrats on the bold trade against earlier trend also what do u think on amazing usd divergence vs eur and gold thanks,0
263, thxim thinking of the high daxthe reversing eurusd and the high bund futuresomething seems to be wrong,0
264,chf a trend change for eur and gbp points to a high probability of the same for chf watch for a possible daily chart rally soon,0
265,perfect us session again today 3 wins 1 loss for our signals and eurusd eurgbp eurjpy have clear trend to put good result and profit,0
266,eurusd  that said its oversold now but still holding for test of 12620 i daily close above 13220 and i take the pain,0
267,eonia fwds for june and all of h2 13 pricing slightly ve so explaining some of this eurusd shakeout,0
268,eur  down 100 pips  usd ripping  and the markets oh yeah this rally will hold not  spy spx,0
269,mix technical and fundamental analyze together you can see eurjpy and eurusd back to resistance also eurjpy,0
270,we closed our sales position in the eur  usd and open buy position in the point 12989,0
271,eurusd breaks 13000 support level and moves below 12990 after draghis speech,0
272,eurusd down big today took profits and covered im very happy,0
273,short term call update eurusd  ist target hit at 13005 now trail your stop at selling point 13035 and wait for second target 12970,0
274,short term call eurusd  sell at 13035 stop 13065 targets 13005 and 12970,0
275,aud staying high and eur down on bounce line usd began bounce a little while ago,0
276,eurusd head and shoulder neckline broken  projecting 12960 area as measured target,0
277,short for both gbpusd and eurusd,0
278,usd sharply wider spainitaly to germany spreads andsell orders into 13100 weigh,0
279,middle east cb and asian prop buyers lift usdrally culminates with 13085 stops on strong german data,0
280,  you cant compare us and nl salaries directly even if you remember to convert usd to eur ,0
281,interbank traders fail in their attempt to lever out stops at 13085 usdnow traders long and face wider italy spreads 10 yr by 5bps,0
282,eurusd watching resistance at 13171 bigger targets 13366 and 13674,0
283,jpy downtrend loses its momentum says unicredit and while the downtrend is still in placelimited upside usdjpy and eurjpy,0
284,  rate decision and prezzer due can eurusd remain at its best level as super mario answers questions,0
285, rate decision and prezzer due at 1245gmt amp 1330gmt respectively can eurusd remain at its best level as super mario answers questions,0
286,me account sold usd for gbp and eur,0
287,sorry actually my trade were jpy long short audjpy eurjpy and usdjpy,0
288,75 on eurusd reversal call thats getting 7500 out of 10000 invested 17500 and its not finished yet,0
289,the core strikes traded at 11 am etwhere the bought 9920 usdcadand the sold eurusd 13080,0
290,if the eurusd finishes below 131 and the doji completes pending confirmation of sentiment we could see 13040,0
291,and so eurusd and sampp 500 futures realign again for the first time this week,0
292,still short eur and audstops 13160 and 10620  longer term positions eur coupon repatriation and usd year end buying should take effect,0
293,short on gbpusd eurusd and usdjpyselling the rumuor,0
294,forexwe expect eurusd and gbpusd to take a breather today in their current climb,0
295,gbpeurusd how are the fx markets in the build up to a long day of austerity in the uk and ireland ,0
296,commentary of the day  after ydays mixed closing  sb is almost flat and sbo was slightly down  due to higher eurusd and muddy argie,0
297, eco eur some minor impacting reports usd 830 adp  10 am ism and factory orders,0
298,im long on the eurusd gbpusd and audusdi expect to see 35 to 40pips move now,0
299,im currently short eurusd and gbpusd with a target of 12940 to 12900 on the eur and 16050 to 16000 on the gbp,0
300,packing to go home and counting all my excess currency i have almost the same amount in usd eur amp gbp and so much in change,0
301,fx snapshot 12939 mxn 2119 brl 1610 gbp 1309 eur and 81837 jpy gold 169590 down 2370 usd oil 8841 down 068 usd,0
302,made 121pips with overnight longs on gbpusd and eurusd this month strategy is grab 20to 50pips on each deal,0
303,another new student this week what are you waiting on aapl eurusd and es are moving and making people wealthy your turn,0
304,dick and eurusd 135 ,0
305,usd weekly charts implying inverted head and shoulders bottom weekly close above 13140 necessary to impact forecast 11875 dec2013,0
306,eurusd keep an eye on 13085  neckline for a head and shoulders pattern in 5 min time frame and its soon 1500 gmt reversal time,0
307,usd expect long reloads on dips to 13080 and stops below 1307013050 option expiry price could gravitate but expect delta hedging,0
308,only another 35 pips and i get another eurusd poll right,0
309,usd resistance at swing highs of 13140 and 13170,0
310,nasdaq amp dow jones to open in green eurusd up to 1309 gold down to 1703 oil down to 8864 and thats it for now ,0
311,so fx wise im keeping a close eye on chfjpy eurjpy usdjpy the usdsek is on a 618 and rising tl if hold could pick up steam again,0
312,commentary of the day  in oilseeds and vegoils after ydays appreciations with stronger eurusd  so better prices in usd basis ,0
313,thinking usdchf at bottom of range nownot good news for eur crosses and significantly trimmed holdings,0
314,levels to watch post     10410 10380 aud  8533 8520 and  aud 12550  obviously i think they are going to cut,0
315, warrior  screened it but will leave it  enough work with eurusd and bunds dax amp co  good trades,0
316,fx snapshot 12972 mxn 2123 brl 1609 gbp 1305 eur and 82245 jpy gold 1716 up 010 usd oil 8961 up 013 usd,0
317, eurusd 13050s holding nicely for now  looking forward to daily close and i apologise if i just jinxd it,0
318,plan the trade and trade the plan no matter what eur and gbp shorts have been squeezed eur usd trade is hurting  enjoy,0
319,dec trades didnnt start so well had 4losing trades in a row now im long gbpusd and eurusdtp at 16120 and 13100,0
320,long gbpusd usdcad euraud and short gbpjpy,0
321,eurusd rally is mature too early to call the top but the expected 5th wave up developed nicely and now we also have rsi divergence,0
322,buy stops being hit on us light crudejan as it spikes up toward the 90 mark eurusd and equity markets also pushing higher,0
323,european  price update    025  043  046 and  600 024  eurusd at 13038  greek ase 16,0
324,european  price update    025  043  046 and  600 024  eurusd at 13038  greek ase 16,0
325,eurusd  pair has formed a channel up pattern on the 1h chart the pattern has 55 quality and 91 magnitude in the 217bar period,0
326,gbpusd meets its down trend at 6080 and eurusd at 3070 conveniently both around 40 pips away,0
327, ssi never lets me down gbp and eurusd crowds still short so its not a good idea buy the dollar yet,0
328, what about eurusd short or long and how much,0
329,xauusd to target more deep  1700 and 1691 during euampus market eurusd to target 1288412880 during euampus market,0
330,i am going to sell eurusd 30250 and profit at 129850  what about you ,0
331, sara interested in why the usd and eur act so differently in contrast to similar measures taken by their central banks,0
332,eurusd very close to our first target of 13050 book halfand hold test for final target of 13120,0
333,i guess ill just review my charts all night and prepare for the december volatility  eyes on gbpusd gbpjpy euraud audjpy nzdusd,0
334,looking for entries in fb gmcr and others during week ahead on continuations if they keep getting buyers and eurjpy  eurusd,0
335,eurusd was really profitable this week especially on monday and tuesday when it had a strong sell trend,0
336,fx snapshot 12933 mxn 2136 brl 1602 gbp 1300 eur and 82433 jpy gold 171430 down 1290 usd oil 8886 up 080 usd,0
337,closedeurusd 13011 6oil 8850 9still have 3 oil and 2 eurusd shortsoil tp 8775 idealeurusd tp 12920,0
338,stopped on eurgbp got out of gbpaud small loss and still short eurusd long usdchf will hold over the weekend now time to drink ,0
339,andbearz you would have smashed it eurusd was paying out big time today,0
340,eurusd still holding support at 12950 area although range bound amp tightening and last day of november,0
341,selling the eurusd and i think the us dollar goes higher for next week,0
342,eurusd expected 5th wave up came and now continues momentum hasnt confirmed this mornings drop so it was likely a shortterm setback,0
343,not sure where this is going so shift gears sold audusd from 10440 and eurusd 130211 contemplating exit,0
344,usd next friday is nfp and so many high impact agenda next friday seems volatility on the way for trade,0
345,usd monthend and large 13000s stay the hand of prospective bulls   ,0
346,eurusd back below 130 and gbpusd could head below 160  looking to make a decent end to the weekmonth,0
347,eurusdoffers  1303050bids  129807060option expiries  13000gbpusd offers  1606080 and 16100bids  1604000opti,0
348,eurjpy 7 move of the mth jpns throwing everything at yen to stimulate growth usdjpy to move to 100 10 yr avg and 125 v eur by q2 2014,0
349,eurusd and gbpusd to continue today in a more moderate mood to levels around 1306016090,0
350,eurusd eases after ecbs draghi and data releases,0
351,5 pips caught and out usd ,0
352,eurusd 1302 and bulling  ,0
353,910 cet  eurusd and other usd pairs forecasts a little bit later today audnzdusd short limit order still valid,0
354, expected eco eur  5 am unemployment rate usd 830 several and 945 chicago pmi friday and last day of month so have a nice weekend,0
355,eurusduse 8 hour abs to get back into the bearish market and the 4 hour to get back into the bullish market,0
356,the fiscal cliff continues to be the focus internationally with sentiment shifting back and forth this has kept eurusd swinging in a,0
357,looking for continued usd weakness against eur and gbp cant buy now though  bugger,0
358,eurusd was likely to find support at 12881 wednesdays low and resistance at 13014 thursdays high,0
359, fx and the week that was  i retain the big picture view that usd and gbp will structurally outperform eur and,0
360, fx and the week that was  i retain the big picture view that usd and gbp will structurally outperform eur and,0
361, fx and the week that was  i retain the big picture view that usd and gbp will structurally outperform eur and,0
362,todays best trading opportunity is  usdjpy for my analysis of the set up plus eur chf jpy gbp and nzd  email me at trlnetnz,0
363,last days 130 is magic number for eurusd optimism in fiscal cliff solving is rising and were on the resistancenice,0
364,vip signal plus members message please check your email inboxchatroom for details of secondary trades on gbpusd and eurusd,0
365,euro and british pound under pressure against the dollar eurusd 12950 gbpusd 16020,0
366,eurusd continued to claim as fiscal cliff near to be addressed by congress and government,0
367,fx and the week that was i retain the big picture view that usd and gbp will structurally outperform eur and jpy going forward in,0
368,usd light stops below 12950 or above 13005 and large stops above 13025 are reported,0
369,onwards and upwardseurusd extends rally a little further,0
370,long eurusd and eurjpn,0
371,eurusd  what to expect today expected to trade higher today 12988 13010 13038a break below 12930 targets 12907 and 12880 ,0
372,odays best trading opportunity is audusd for my analysis of the set up  plus eur chf jpy gbp and nzd  email me  trlnetnz,0
373,todays best trading opportunity is audusd for my analysis of the set up  plus eur chf jpy gbp and nzd  email me at trlnetnz,0
374, usdchf and eurusd so far the plan is working beautifully keeping fingers crossed cheers to collaboration ,0
375,currency pairs are in consolidation do to chop between the eur and usd better to keep fx trading to a minimum  when its like this imo,0
376,watching eur usd audusd short and usd chf long,0
377,eurusd recovers from bottom and set the battle at 12950,0
378, okay so who made the eur gbp and usd,0
379,  plummets   all then rocket against  anyone think there is something wrong and a  needed,0
380,  plummets   all then rocket against  anyone think there is something wrong and a  needed,0
381,  plummets   all then rocket against  anyone think there is something wrong and a  needed,0
382,really hope we are back to  weakness and the down moves in eur gbp aud were in fact only corrections,0
383,eurusds retreat from 13008 is still in progress and intraday bias remains mildly on the downside,0
384,eurusd unable to break key resistance at 13000 and retraced back to 12880 just above 200 ema  the next key support at 12824,0
385,at this point long eurusdweve tightened stops and will be watching 12937if we close above well stay a little longerelse go smaller,0
386,at this point long eurusdweve tightened stops and will be watching 12937if we close above well stay a little longerelse go smaller,0
387,at this point long eurusdweve tightened stops and will be watching 12937if we close above well stay a little longerelse go smaller,0
388,at this point long eurusdweve tightened stops and will be watching 12937if we close above well stay a little longerelse go smaller,0
389, am short eurusd from last night and wld be adding to my shorts on retracements so also audusd,0
390,this looks and feels like 08 and if it is look for a big divergence between spx and usd usd falling of a cliff with spx vs eurgbp,0
391,usd specs finally undo reserve demand around 12915russian and real money sellers light stops hit 12910,0
392,eurusd and eurjpy showing a 7 swing decline from their respective peaks a pullback here cant be ruled out   ,0
393,gbpusd to follow eurusd and risk sentiment today,0
394,chfyen  lost 1 still up nearly 3 on the usdyen option selling eurczk and brent stop on brent around 111,0
395,spanish banking greek funding and the us fiscal cliff weighs on the eurusd slam the market,0
396,sell eurusd  at 12935 stop 13030 targets 128601279012720 and 12660,0
397, a new high for eurusd  above 13007 makes sense to me and usdchf to finally fill the gap at 09183 too hope mr market agrees,0
398, im waiting to go long the sampp and possibly eurusd if it drops to near 12800 ,0
399,audusd and eurusd havent even had 10 tick ranges yet after an hrthey are dead,0
400,usd the daily outside reversal tuesday and close below 12940 terminated st rallies retest 12730 through friday stoploss  12965,0
401,3 pips take and out at 13940 again usd ,0
402,eurusd12900buy order stoploss sell and optionnycut,0
403,successful trades on nov 27 2012 according to the analysis of the audusd and eurusd trader profited on a binary options platform,0
404,eurusd consolidative now and positive for mediumlongterm,0
405,stocks and eur look susceptible to a pullback 1405 on sampp 500 global equity indices benchmark and 12950 on eurusd are pivotal,0
406,watch eurusd at 1291512890 and 1304513070 usdjpy at 81658140 and 82408265 trade endtoend,0
407, and vice versa are you telling we can make usd to eur transfers already,0
408,well i was wrong my eurjpy shorts failed but ive been short eurusd since friday and its held this looks promising,0
409,should eurusd fall through 1295 minor resistance expect the fall to go down to 127 in the coming days with a pitstop at 129 and 128,0
410,eurusdoffers  1300050bids  1292000 12895vanilla option expiries  12900 and 13000usdjpyoffers  8250bids  8200,0
411,eur trading fresh lows against gbp and usd,0
412,eurusd for todayoffers  1300050bids  1292000 12895vanilla option expiries  12900 and 13000,0
413,upon the next 15 min close above 12992 eurusd will have a sell there will be 2 separate stop losses  13010 and 13019,0
414,morning all usd continues to look at the reactions at 13 and 1295 today for 3050pip scalp  ,0
415,usdzar has potential to dip into the low 880s if eurusd can play along and local gdp data doesnt upset eurzar is flat around 1150,0
416,buy usdinr near to 5535 for a target of 5570 and sell eurinr at 72 levels for a long term target of 68,0
417,success rewards the prepared and patience this madness shall pass  eurusd 130 again,0
418,it actually took about a minute and a half for it to reflect in the eurusd chart,0
419,eurusd and audusd making new highs interest rates reduced by 100bp in loan facility and loans will recieve extended maturites,0
420,i will be shorting eurusd and audusd dailyweekly until i have achieved massive profits or have been shown to be severely mistaken,0
421,the real news is not another greekisfixed headline but what reaction eurusd and sampp 500 global risk benchmarks have in tuesday trade,0
422,eurusd breaking above top of ichi cloud top but eurjpy is still more important near term and still looking pullback prone,0
423,feeling better now that a clearly bearish take we had on chf and cad last week is better reflected on usd and usd ,0
424,scalp winners today usdcad 191 pips usdmxn 975pips and 336pips  open still yet eurusd 5pip currently targeting 126 long term,0
425,eurusd rangebound as europe meets on greece and us on fiscal cliff,0
426,the eur  usd is at an elevation of 12966 and suggest open sell position in the point 12966 will place our stop at elevation lost 12976,0
427,successful trades on nov 26 2012 according to the analysis of the usdcad and eurusd trader profited on a binary options platform,0
428,us politics greece sampp fut pinning 1400 night and morning 4 correlated crosses audusd 1 audjpy 6 eurjpy 4 usd flat,0
429,eurusd would range between 128 and 130 yearend  rabobank,0
430,short positions in eur against long positions in mxnusd and cad dominate the portfolio,0
431,eurusd has formed a channel down pattern on the 4h chart the pattern has  40 quality and 55 magnitude in the 254bar period,0
432, surprising how strong  stays with no deal on greece and eu budget victory catalonia independence parties usd,0
