,tweet,polarity_score
0,outlook on eurusd its failing to bounce and looking for new lows the usdx has turned resistance into support weak volume rally,0
1,consensus appears to be 2012 risk aversion and strong usd vs jpy eur aud gbp up vs eur chf weak,0
2,take profit hit on the eurusd long scalp  another profitable trading day  have a good weekend and spend some time with your family,0
3,merry xmas and prosperous new  year to all our members followers  rts and viewers  aapl amzn spy spx eurusd goog audjpy,0
4,  eur is dying usd is dying and all of this is thanks to human greed oh noes the imf is announcing a global currency,0
5,eurusd  and crude flat while es has levitated 6 handles in past 2hrvolume extremely light,0
6,it is most likely that the eurusd will give us an signal next week and this may coincide with a gbpusd,0
7,eurusd looks like its trying again and the gbpusd giving us some new daily lows 5600 it should hit some support,0
8,eurusd consolidating at 13030 area its tried to break it twice now and just keeps on bouncing off,0
9,eurusd sell  3050 just barely up its testing that 3030 line and thats been the suppresis line for the last week or soo,0
10,tweet,0
11,outlook on eurusd its failing to bounce and looking for new lows the usdx has turned resistance into support weak volume rally,0
12,consensus appears to be 2012 risk aversion and strong usd vs jpy eur aud gbp up vs eur chf weak,0
13,take profit hit on the eurusd long scalp  another profitable trading day  have a good weekend and spend some time with your family,0
14,merry xmas and prosperous new  year to all our members followers  rts and viewers  aapl amzn spy spx eurusd goog audjpy,0
15,  eur is dying usd is dying and all of this is thanks to human greed oh noes the imf is announcing a global currency,0
16,eurusd  and crude flat while es has levitated 6 handles in past 2hrvolume extremely light,0
17,it is most likely that the eurusd will give us an signal next week and this may coincide with a gbpusd,0
18,eurusd looks like its trying again and the gbpusd giving us some new daily lows 5600 it should hit some support,0
19,eurusd consolidating at 13030 area its tried to break it twice now and just keeps on bouncing off,0
20,eurusd sell  3050 just barely up its testing that 3030 line and thats been the suppresis line for the last week or soo,0
21,interesting iwm not moving with spy dollar flat and eurusd down however tlt is getting hammered mixed signals today,0
22,im still sticking too the short side on the gbpusd eurusd and aususd pairs all 3 seem like theyve gone up as far as that could,0
23,if we can get the next hr candle to close below 5650 on the gbpusd and on the eurusd 3030 this thing has some room to run down further,0
24,spy opens up at 12567 wti flirts with 100 dxf flat and holding key 80 support eurusd still in 130 handle  us 10year tnote 199,0
25,5 new posts available in kantox to exchange eur for usd in february march april may and june,0
26,happy festivis  we are currently selling the usd  10379 gbp  16472 and eur  13805,0
27,eurusd  it is time to exit merry xmas to all followers and helpers thanks  next year will be exciting and consistent ,0
28,staying short on eurusd at 13080 and waiting for the 20 day ema to bust at 13060 and fall to resistance near 13040  ,0
29,usd 1305013100 the new shortterm comfortzonewith squaring up and getting out the door the main priority heading into break ,0
30,intraday options that are due to expire today at 1500gmt 10am ny cut include 13100 in eurusd 7800 in usdjpy and 10200 in usdcad,0
31,intraday options that are due to expire today at 1500gmt 10am ny cut include 13100 in eurusd 7800 in usdjpy and 10200 in usdcad,0
32,eurusd dropping as calculated after hitting resistance and bearish divergence on the hourly will encourage this trend and look for 13040,0
33,took profit of that long scalp of eurusd and similar to yesterday i am reversing my position at 13080 resistance with the broader dtrend,0
34,how and why would france be downgraded by snp when they affirmed this few weeks ago dont get itspy eurusd cac dax aapl,0
35,long scalp eurusd at 13035 quickly hit 13070 for a quick 35 pips now lets see what draghi and obama say,0
36,spx is trading against its positive corr on eurusd and against its negative corr on tnt  this signals weakness good rr for shrts,0
37,support at 13035 on eurusd says go long for around 35 pips but watch out for draghi and obama speaking within the next hr and 15 min,0
38,rt gold no lusterdown 8 in dec with sp up small on month   eurusd breaks 130 soon and gold follows lower,0
39,gold no lusterdown 8 in dec with sp up small on month   eurusd breaks 130 soon and gold follows lower,0
40,still short nzdchf 7235and i getting long eurusd 13020  very small amount,0
41,hungary was junked  ydayand forint sold offbcos we like to buy low or sell high shorting gbphuf 36800 stp 37600 eurusd spy,0
42,back to opening levels for the eurusd the middle eastern led rally ran out of steam at 13120 and we re back down to familiar sessi,0
43,rt options  eurusd taking retrace eurusd is taking some retracement in the long term trend and this retracement is an ext,0
44, yes please ill add it to all the gbp eur usd chf hkd and similar coins i have in my pile,0
45,eurusdgbpusd and gold bullish  usdjpy bearish,0
46,the   fell against the  and  as panel considers measures incl capital controls and negative interest rates to weaken the ,0
47,european banks need usd funding over ye  if you have eur debits you should borrow usd buy eur pay down debit and sell forward past ye,0
48,eurusd has been good to me but it can do me one last favor and take a dive back to 13000 ,0
49,eurozone consumer confidence recorded its worst result in over 2 years eur  usd trapped in the 13057 and 13028 range,0
50,here we go today we are up about 45 on the usdcad 90 on the eurusd and 25 on the gbpusd with more room in each,0
51,eurusd dropped back below 131 level last night but now back to 1304 after negative us housing data and will bounce maybe 35 ,0
52,short eurusd and looking to add positions ideas short gbpusd long usdchf will update when i make a move,0
53,i think the safe bet now is to stay long gbpusd and short eurusd at 21 hedgeuntil this santa rally passes us,0
54, nimbly  market wants to sell eurusd but positioning already at extreme and 25 delta rr have come back alot squeeze coming,0
55,i have now exited my nzdusd and eurusd shorts for profits for 45 and 50 pips each cannot hover of my screens this morning,0
56,well see if the eurusd breaks the 13053 lvl and if we get a bounce there or not,0
57,i am short eurusd from 13096 and nzdusd from 07721 very small positions with 35 pip stops targets for day below 13050 and 07640,0
58,spot eurusdno move above 3200 provided the sell set up progress down relies on 3068 and 3050 clearing,0
59,when the fed was dishing out piles of cash the market took it out of usd into asia china this time expect mkt to sell eur and buy usd,0
60,update  the dec german ifo business climate rose 06 to 1072 strongerthanexpectations of 06 to 1060 stocks and eurusd also,0
61,news now  the dec german ifo business climate rose 06 to 1072 strongerthanexpectations of 06 to 1060 stocks and eurusd also,0
62,breaking news  the dec german ifo business climate rose 06 to 1072 strongerthanexpectations of 06 to 1060 stocks and eurusd,0
63,eurusd and gold bullish,0
64,sold au7ssie at 84 and eurusd at 43,0
65,sold eurusd at 47 and cable at 33,0
66,eurusd  5 min chart above 20 ma and off it went also the 8am 4 hour pivot 13118,0
67,i speak the universal language of usd eur jpy gbp aed zar itl php and even peso talk to me i talk back,0
68,good market is moving up targeted to make 100 pips on eurusd and gbpusd,0
69,short covering again important in early europe eurusd approaches 13140 and gbpusd breaks above 15710 patience needed before selling,0
70, stronger in am trade usd 817 eur 1071 gbp 1279 gold and equity markets higher,0
71,sell eurusd at 13130 to scalp profit at 13105 for 25 and potentially sellin more if trend continues past 131000  ,0
72,just went back long audusd eurusd and nzdusd,0
73,eurusd testing the high resistance point right now if it breaks and heads into the stratosphere watch the futures soar spy qqq vxx,0
74,and youre back at the 31 levelbleh usd,0
75,hs formation figment of imagination they dont make any sense and cant be relied for profitable trading eurusd spx audjpy spy ge,0
76, pcln hitting the hod im in 500 weekly calls and sitting pretty eurusd shows strength and so do the markets in general,0
77,rt correlation between eurusd and metals is loosening very interesting move in line with our forecasts ,0
78,correlation between eurusd and metals is loosening very interesting move in line with our forecasts ,0
79,bearish head and shoulders eurusd  maybe an hour or 2 then selling at 13055,0
80,im seeing it just not buying into it  having a hard time today focusing  head and shoulders being formed on m15 eurusd  right side,0
81,  cracking start of a right shoulder on 30 min and 1 hr eur usd,0
82,eurusd trading between 100 ema and 200 ema love to see a breach of 200ema for a test of 13051299 ,0
83,cad  strengthening ag  and usd  crosses weaker showing  still lagging even as it stregthens,0
84,eurusd breaks above 13100 dow and gold up,0
85,i am short eurusd at 13124 with a stop at 13222 and a limit at 12895,0
86,those on the site gbpusd now 180pips nzdjpy 130 pips among others taking 3050 and stop to bes targets unchanged eurusd tg 13500,0
87,looking to short eurusd gbpusd audusd and go long usdcad and usdchf when this all inevitably falls to pieces   ,0
88,everyone talking about this risk rally but ftse not following dax cac higher and dow looking to open higher eur up v usd but down v gbp,0
89,bulls and bears love some eurusd another 40 pips,0
90, eurusd broke r 3083 now may target 131 resistance and 13116 gtgt dont forget to stya nimble and book or lock trades,0
91,sold eurusd at 70 aussie at 91 and cable at 34,0
92,eur i am dipping back into long eurusd in our short term portfolio  we went short at 13200 and now go long at 13064,0
93,would not be suprised to see eurusd to rally back to 14000 to kill the shorts and create right shoulder of larger hs,0
94,eurusd broke r 3083 now may target 131 resistance and 13116 gtgt dont forget to stya nimble and book or lock trades ,0
95,a bit more perspective on those usd gains after the ifo data and spanish tbill auction  is weaker against  and ,0
96,  at days highs vs  after a better ifo data and a successful spanish auction bolsters risk sentim in thinned preholiday trade,0
97,eurusd  next offersbegin from around 13070 and extend to 13100,0
98,usd index breaks out to the downside now on session lows at 8016 02 as such both eurusd and gbpusd remain around the highs of,0
99,usd index breaks out to the downside now on session lows at 8016 02 as such both eurusd and gbpusd remain around the highs of,0
100,usd supranational is still seen on the sell side to cap gains and the pair just does not seem to have the impetus to break higher ,0
101,sweden cuts interest rates send eursek sharply higher and pulls eurusd and other majors with it,0
102,sweden cuts interest rates send eursek sharply higher and pulls eurusd and other majors with it,0
103,eurusd spikes higher to 13030 as usd gives ground all round gbpusd breaks above 15550 and crude prices also rise,0
104,midmorning kes snapshot 8377 to the usd 10920 to the eur 13055 to the gbp and a 1006 to the rand,0
105,example 15 assuming that the client operates business in eur and now has the obligation to pay usd in 4 months time,0
106,eurusd continues to consolidate above 12946 temporary low for the moment and intraday bias remains neutral,0
107, esf  1200 and eurusd  130  as my good friend saidthose are some round fing numbers,0
108,usd fraois sprd 3m imm1 up 15 today eur fraois sprd 3m imm1 down 22 did someone rob db and deposit the goods at bac ,0
109,usd fraois sprd 3m imm1 up 15 today eur fraois sprd 3m imm1 down 22  did someone rob db and deposit the goods at bac,0
110,taking position that gdx is still ok if gld holds the prior breakout and dollar comes down from failed top of 8144 near month eurusd,0
111,contacts suggesting  and  credit rating affirmed by sp eurusd spx spyaapl amzn,0
112,holding shorts on eurusd gbpusd and audusd,0
113,plan buysell the  diprally when diprally comesoh no looks like  comes in and instead sellbuy diprally  poor eurusd spyge,0
114,eurusd threatens support and moves back into sideways movement,0
115,some think eur goes then usd goes and we see huge changes in the world one day at the time is the luxury i have a s a trader,0
116,esf interesting bullish divergence vgk ewg european stocks are up almost a percent even as xlf banks and fxe eurusd is red,0
117, ecb does backdoor qe and if emu falls apart due to democratic process it pays to get out of eur usd also bad agreed,0
118,some says  eurusd is bearish while audusd is bullish conjuring various levels and charts haha nonsense they move same direction,0
119,stop on short eurusd now be let it run and hope for a big fall,0
120,eurusd and gbpusd both are still in bearish rectangles  i still feel like we are sitting on a bigger move to the south,0
121,13 still in my eurjpy long and some eurusd longs here  new one is eurchf long  who else is bullish now  ,0
122,long eurusd at 26 and aussie at 52,0
123,usd nb  implied vols were hit tomulti monthlows late last week tohighlight the year end slow down and anticipated range trading ,0
124,we hope everyone had a great weekend  the eurusd winner will be announced soonand much more to come,0
125,sold eurusd audusd and gbpusd,0
126,this week cot report has caught the attention of investors will there be another free fall in eurusd and other highyielding currencies,0
127,bearish rectangles in bothe the eurusd and gbpusd are both continuation patterns forming  the bottom of a downtrend,0
128,fx jpy briefing usd gets leg up on kim jongil news eur soggy usdjpy and usd in general got a leg up on news of north korean lead,0
129,north korea system is institutionalized and clear succession in place no need for market to be jittery of kims death spx eurusd aapl,0
130,i have already made  62 pints so far tonight on aussie and euro shorts but now my bias is long eurusd,0
131,ok ez crisis still a crisisnothing new here eurusd below 12970 and i am interested in getting involved for now wait until europe,0
132,advice if u short eurusd last week take ur profit and wait for a rebound to sell it again sell at 13500s,0
133,weekly review and outlook eurusd breached 1  euro weakened broadly last week on delayed reaction to the the eu summit successful b,0
134,euro breaks 13000 whats next if euro crisis intensify i am expecting eur usd move to 12875 and then correction to 13200,0
135,    fwiw i am long both some eur and a lot of usd here,0
136,  ive got mainly usd some gbp and some eur no egp avoid egp like the plague,0
137,good trading week guys between gbpaud eurcad usdsgd we made close to 400 pips still open on a few lots in eurcad and usdsgd,0
138,eurusd and eurjpy time is running out for bearish continuation,0
139, well its a speculation not an investment but i like eurusd so do the  and  ,0
140,coming up on realmoneypro some technical voodoo  the intraday eurusd looks positive based on a head and shoulders config,0
141,contacts say rumour of sp downgrade of italy and spain today highly unlikely action was about fitch neg outlook eurusd usdjpy spy,0
142,the big news of fitch is now off the table sp downgrade today unfounded rumour and unlikely eurusd spx gbpusdaapl,0
143,eurusd and gbpusd are crashing,0
144,eurusd broke 13000 and made new lows for the day like we said i hope everyone was able to catch the move from 3080 down callin it a day,0
145, thx missed ur short exit tweet wed and am still shortlooking for eurusd to break 130 todaydo u have downside spy target,0
146,possible head and shoulder on eurusd 15min,0
147,long aussie at 91 and eurusd at 41,0
148,took aussie long again at 86 and eurusd at 34,0
149,5 down 2 up on m15 eurusd  waiting for next candle to start and possibly start another short  this will form a hs,0
150,long aussie at 76 and eurusd at 33,0
151,eurusd expect too test 130 think it has the power to break it and go further,0
152,why do traders keep their eyes off the ball and keep watching ticks that causes irrational actions eurusd audjpy spx,0
153,fx breakdown of reserves64 usd 28 eur 45 gbp and 35 jpy which is the composition of fx reserves reported  imfs cofer survey,0
154,eurusd overbought gold sliding down from hod no way will the puppet masters let it close gt1600 for wknd and who wants a position anyway,0
155,order setup short usd  13120 and booked profit on long chf,0
156,eurusd holding up germany flat to greenish and futs are strong looks to be green today the big volitile jirations have subsided tna,0
157, ok we will have to declare the value to about 60 eur thats about 77 usd and usually items under 100 usd will not be charged,0
158,usd has been trading a range near 13000 for the last 24 hrswith large vanilla expiries ys and more todayhelping to contain the pair,0
159,since market open eurusd stuck in a 30pip channel and gbpusd stuck in a 40pip channel i expect us to stay consolidated,0
160,good morning dont forget our eurusd prediction contest only ten and a half hours to go,0
161,audusd eurusd resistance levels holding into early europe those levels are at 9990 and 13050 respectively otherwise it s a quiet,0
162,news merkel and fomc ruin euro party early on tuesday the eurusd currency pair briefly rallied conflicting forces may have been acti,0
163,tomorrow is going to be a rough day so much fundamental watch closely eurusd and silver,0
164,chf is no longer a safe haven it is now a yielding currency for risk plays this means only us and jpy remain usdchf eurusd spx,0
165,warrior dudedont you think that one is too tight for that flipflopchickendance eurusd  open a beer and chill ,0
166,resumed buys on aussie at 38 and eurusd at 16,0
167,spy after failed midday rally think we test the lows and go negative on the day  eurusd and gold both failing as well,0
168,sold aussie at 44 and eurusd at 17,0
169,2hr chart eurusd ma7 cross ma21 and heading for ma50 for confirmation if it does risk on again,0
170,bennyb has europe by the balls must print now or eur will implode and ofc he needed the usd strenght to sell toilet paper aka usd bonds,0
171,usdchf at 09396 and also looks heavy  trading inline with eurchf  may tumble lower if eurchf soldoff   ,0
172,long eurusd at 03 and aussie at 18,0
173,still holding eurusd short from 14025 will exit around 12770 and reassess,0
174,copper and eurusd 5 min charts are identical,0
175,i just posted there goes the eurusd crashes right through support at 13150 and is sitting below 13100 if it holds below 13150 next,0
176,breaking  gold files for bankruptcy ceo resigns and cashes bonus in confetti usdeurjpygbp,0
177,i will be joining  on   for  at 5pm to discuss the eurusd and the imf,0
178,i will be on  with  at 11am to discuss the eurusd and the  imf,0
179, eur usd macd and stochastic cross over almost in play macd settings 19 39 9slow stochastic 15 5 5,0
180,eur usd macd and stochastic cross over almost in play macd settings 19 39 9slow stochastic 15 5 5,0
181,expect it to not move much higher today eurusd and aususd still showing up with seperation on 2 and 4 hr charts,0
182, eurusd and eurjpy longpositions  always follow risk and moneymanagement mate  ,0
183,long eurusd at 37 and aussie at 76,0
184,its very hard to deny master zuls viewsell sell even if the buy u selland true enougheurusd crashes 100pips,0
185,had to nip out then rebought aussie at 77 and eurusd at 40,0
186, nee zit op eurusd te studeren klimt and what goes up must come down,0
187,spot eurusd update to continue has to tackle 3046 and 3050 to try higher twords 3100 any counter move must take out 2997 and 2950,0
188,19 minister meetings this year for the euro and still eurusd falls below 13000   will the fed now assist the trouble region,0
189,gbp usd at the trendline and eurusd roughly 12 pips away its trendline  reversal on tap ,0
190,zar in quiet afternoon trade figures in us still to come usd 841 eur 1093 and gbp 1303 eurusd hovering around 130,0
191,took eurusd long at 20 and aussie at 39 again,0
192,eurusd up at 13010 meastern names seen buying early buy stops eventually tripped through 13020 and we got to session high 13037,0
193,my view is that eurusd will find support here at 1300 if temp and have rebought at 1300 and aussie at 20,0
194,my target was hit in the eurusd last night 13035 45 pips and my usdchf made 30 nice start for the day,0
195, and my sense is that eurusd pair could head lower to 120122 8 fall from current prices,0
196,long eurusd at 06 and cable at 92,0
197,usd and eur currently doesnt seem like a good currency for me to change into if i want to gain money later on,0
198,took long eurusd at 20 and cable at 95,0
199,usdchf and eurchf tumble punters cut their long positions before  decision later today    ,0
200,stupid eurusd quit bllshig and fallllllllllllll already ,0
201,eur falls and gets closer to the usd should we say finally,0
202,eurusd strength and resistance for today s3 12808 s2 12877 s1 12929 r1 13050 r2 13119 r3 13171  luck ,0
203, hence usd rally eur selloff and asian currencies take the brunt of the appreciation eg jpy cny so far,0
204,eurusd bull target  and bear target  by fri close pay your money take your choice,0
205,cititechs big calls for 2012 eurusd to 115 gold to 2400 eurusd will fall to 120 and possibly 110115 before bouncing gold rema,0
206,eur is doomed once its over there will be another ccy and finally thje usd will go down the drain that will be in the final chapter,0
207,what i tweeted nov 23rd eurusd 13150 13000 and 12870 will we get there why yes we will     ,0
208,crude  closer and closer to 92 95 is now support no price is too low to keep selling eurusd spx,0
209,the fallacy of fib dmas ew macds  others  is that results differ of diff risks and timeframes  but risks move together  eurusd spx,0
210, 50 pip trailing stop got me out early on both eurusd and audusd you,0
211,rt     interesting how eurcad did spike like eurusd and euraud still short eurcad ,0
212, interesting how eurcad did spike like eurusd and euraud still short eurcad early bearish hs forming as well,0
213,interesting how eurcad did spike like eurusd and euraud  still short eurcad  early bearish hs forming as well,0
214,rumor after rumor and statement france doesnt know anything of a downgrade yet eurusd 12996 030,0
215,all long term technicals and fundamentals supports the usd over the euro on the eurusd,0
216,booked most of usd longsstill like eurcad and eurchf shortsnb will not up targets,0
217,buying eurusd btw this level and 128 and then you will pass a great xmas,0
218,audusd tests 09900 to the downside as wti crude and brent prints new lows usdindex sits at its intraday high weighing upon eurusd,0
219,gold oil and eurusd all are free falling today who sold gold or oil could make 4000 to 6000 in a single lot wtf ,0
220,eurusd 12954 and falling no reason to get into longs yet,0
221,eurusd continues selloff towards 12900 it has just broken 12950 2 minutes ago usd continues to gain strength agst majors and sgd,0
222,   12974  160105 dxy 80524 10yr 19356  and the hits just keep on coming 1048am et,0
223,going for the aussie long again at 38 and eurusd at 87 for limited move from these temp oversold postitions,0
224,long eurusd at 86 and aussie at 48,0
225,eurcad is looking oversold in the short term  studying charts and long entry levels thankfully my eurusd long trade is still alive,0
226,the markets were focused on the fomc meeting todayasian and european trading sessionseuro during the asian trading session the eurusd,0
227,we will sell into any rally here and reignite our bearish view we see what happens eurusd usdcad spx,0
228,we close all risks long intiated at ydays lows in fx and others market internals show potential weakness further eurusd spx,0
229,green shoots eurusd dips below 130 italy 5yr auction at 647 means ez and usa heading for oncoming train,0
230,take a look at eurusd and xauusd in the same time ,0
231,rt  eurusd below 130 and falling  this makes wonders for my account,0
232,eurusd below 130 and falling,0
233,eurusd  chatter suggesting a ticket of bids in place down there and into 12950 where another barrier strike is eyed,0
234,jc repeat after me will not fade strong trendsscares me about the eurusd rally the willingness to sell every uptick and buy every dip,0
235,hola  we are currently selling the usd  10571 eur  13972 wow and gbp  16549  please call for rates on large trades 5197637330,0
236,and were under 13 for the usd how low can you go,0
237,and there we go eurusd successfully breaches 13000 option barrier 12974 touched briefly off,0
238,and voilaitalian bond yield down a fraction and eurusd 11,0
239,looks like italian bond yields are trending upwards10 year  6661 and eurusd now down 04 my assumption eurusd trending down,0
240,rt   news now eurusd rebounded from a 2month low when spain sold 494bn of 12 and 18month tbills compared with ,0
241,currency news gtgt  eurusd rebounded from a 2month low when spain sold 494bn of 12 and 18month tbills compared with the maximum,0
242,attention fx news  eurusd rebounded from a 2month low when spain sold 494bn of 12 and 18month tbills compared with the maximum,0
243,update  eurusd rebounded from a 2month low when spain sold 494bn of 12 and 18month tbills compared with the maximum target of,0
244,news now  eurusd rebounded from a 2month low when spain sold 494bn of 12 and 18month tbills compared with the maximum target,0
245,breaking news  eurusd rebounded from a 2month low when spain sold 494bn of 12 and 18month tbills compared with the maximum,0
