,tweet,textblob_polarity,textblob_subjectivity,nltk,vader
411,"Cable coming off a little now which could drag on eur/usd, aud/usd and eur/jpy.",-0.1,0.07083333333333333,"{'neg': 0.213, 'neu': 0.787, 'pos': 0.0, 'compound': -0.2263}","{'neg': 0.213, 'neu': 0.787, 'pos': 0.0, 'compound': -0.2263}"
412,"EUR/USD has dropped through 1.3163 Yest. low and now testing the 1.3150 level.
Next major downside target 1.3046 (61.8% 1.1876-1.4939 move)",0.03125,0.4,"{'neg': 0.244, 'neu': 0.756, 'pos': 0.0, 'compound': -0.4939}","{'neg': 0.244, 'neu': 0.756, 'pos': 0.0, 'compound': -0.4939}"
413,"Hi, late to the platform this morning so have missed moves down on EUR/USD and WTI Crude.I will SELL later if no further contact with highs.",-0.04666666666666666,0.37999999999999995,"{'neg': 0.127, 'neu': 0.873, 'pos': 0.0, 'compound': -0.1531}","{'neg': 0.127, 'neu': 0.873, 'pos': 0.0, 'compound': -0.1531}"
414,@Dunholme Yeah he and fx_13 always talk about Pandas.  They mean China.  China likes to buy eur/usd :o),-0.3125,0.6875,"{'neg': 0.0, 'neu': 0.657, 'pos': 0.343, 'compound': 0.5719}","{'neg': 0.0, 'neu': 0.657, 'pos': 0.343, 'compound': 0.5719}"
415,"""Some Central Banks and Sovereign Wealth Funds have also been on the offer in eur/usd""",0.0,0.25,"{'neg': 0.0, 'neu': 0.686, 'pos': 0.314, 'compound': 0.4939}","{'neg': 0.0, 'neu': 0.686, 'pos': 0.314, 'compound': 0.4939}"
416,"Lost my silver at sl break-even - but still holding my long usd/eur from 0,7030 and waiting for parity.",-0.05,0.4,"{'neg': 0.204, 'neu': 0.796, 'pos': 0.0, 'compound': -0.3182}","{'neg': 0.204, 'neu': 0.796, 'pos': 0.0, 'compound': -0.3182}"
417,I'm watching 1.3310 and 1.3484 levels in EUR/USD. Further downside PX possible in the near-term until those levels are taken out.,0.0,0.0,"{'neg': 0.0, 'neu': 1.0, 'pos': 0.0, 'compound': 0.0}","{'neg': 0.0, 'neu': 1.0, 'pos': 0.0, 'compound': 0.0}"
418,I'm watching 1.3310 and 1.3484 levels in EUR/USD. Further downside PX possible in the near-term until those levels are taken out.,0.0,0.0,"{'neg': 0.0, 'neu': 1.0, 'pos': 0.0, 'compound': 0.0}","{'neg': 0.0, 'neu': 1.0, 'pos': 0.0, 'compound': 0.0}"
419,EUR/USD remains on the downside for the moment and recent fall should be in progress to 1.3969 from 1.4548 at 1.2979,0.0,0.25,"{'neg': 0.0, 'neu': 0.763, 'pos': 0.237, 'compound': 0.4215}","{'neg': 0.0, 'neu': 0.763, 'pos': 0.237, 'compound': 0.4215}"
420,"Japanese yen is the best performer among major peers. JPY appreciated 1.2% vs. AUD, 1.6% vs. CHF, 1.7% vs. EUR and 0.55% vs.USD",0.53125,0.4,"{'neg': 0.0, 'neu': 0.756, 'pos': 0.244, 'compound': 0.6369}","{'neg': 0.0, 'neu': 0.756, 'pos': 0.244, 'compound': 0.6369}"
421,"Currency play for Q4, Sell EUR and Buy USD, at 1.32 on Oct 3, going to 1.20 by Christmas #Euro #Dollar #Currency",0.0,0.0,"{'neg': 0.0, 'neu': 0.789, 'pos': 0.211, 'compound': 0.34}","{'neg': 0.0, 'neu': 0.789, 'pos': 0.211, 'compound': 0.34}"
422,Still holding my short EUR/USD from 1.4275...1100 pips and counting...another 4 figure currency trade!,0.0,0.3,"{'neg': 0.0, 'neu': 1.0, 'pos': 0.0, 'compound': 0.0}","{'neg': 0.0, 'neu': 1.0, 'pos': 0.0, 'compound': 0.0}"
423,looking at 1040 on the spx as my target; 1.29-1.30 on the eur/usd and will probably get out of my smh puts as well then,0.0,0.0,"{'neg': 0.172, 'neu': 0.672, 'pos': 0.157, 'compound': -0.0516}","{'neg': 0.172, 'neu': 0.672, 'pos': 0.157, 'compound': -0.0516}"
424,EUR/USD intraday. supports at 1.3153 and 1.31,0.0,0.0,"{'neg': 0.0, 'neu': 0.597, 'pos': 0.403, 'compound': 0.4019}","{'neg': 0.0, 'neu': 0.597, 'pos': 0.403, 'compound': 0.4019}"
425,EUR/JPY want to reach 100..since a while...EUR/USD.....is in a general slow going downward trend...GBP and USD weaker in front of JPY...,-0.125,0.44999999999999996,"{'neg': 0.19, 'neu': 0.654, 'pos': 0.157, 'compound': -0.3612}","{'neg': 0.19, 'neu': 0.654, 'pos': 0.157, 'compound': -0.3612}"
426,$EUR/$USD Correlation with $SLV and $GLD shows the fundamental reason behind this decline. Thanks for pointing that out ETF Daily News,-0.4,0.7,"{'neg': 0.0, 'neu': 0.839, 'pos': 0.161, 'compound': 0.3612}","{'neg': 0.0, 'neu': 0.839, 'pos': 0.161, 'compound': 0.3612}"
427,"eur/jpy ,gbp/jpy,usd/jpy, emini trades hit target. prev gold trade stopped. One gold trade in execution and in money",0.0,0.0,"{'neg': 0.136, 'neu': 0.864, 'pos': 0.0, 'compound': -0.296}","{'neg': 0.136, 'neu': 0.864, 'pos': 0.0, 'compound': -0.296}"
428,@alaidiPremiumFX Hi Ashraf. Nice calls today on EUR/USD and EUR/JPY. Do you see any possible upside on EUR/USD at all before 1.29?,0.6,1.0,"{'neg': 0.0, 'neu': 0.781, 'pos': 0.219, 'compound': 0.4215}","{'neg': 0.0, 'neu': 0.781, 'pos': 0.219, 'compound': 0.4215}"
429,And down goes the EUR/USD without me. Lets wait patiently for the next move.,0.0,0.0,"{'neg': 0.0, 'neu': 1.0, 'pos': 0.0, 'compound': 0.0}","{'neg': 0.0, 'neu': 1.0, 'pos': 0.0, 'compound': 0.0}"
430,@HCPG Mkt holding up amazingly well given DX and EUR/USD. May have to get long for a trade if the dollar turns.,-0.05,0.4,"{'neg': 0.0, 'neu': 0.84, 'pos': 0.16, 'compound': 0.2732}","{'neg': 0.0, 'neu': 0.84, 'pos': 0.16, 'compound': 0.2732}"
431,Stopped on EUR/USD... its not BREAKING THOUGH TARGETS on hourly and 15min,0.0,0.0,"{'neg': 0.268, 'neu': 0.732, 'pos': 0.0, 'compound': -0.296}","{'neg': 0.268, 'neu': 0.732, 'pos': 0.0, 'compound': -0.296}"
432,"Traders are bullish for USD and CNO and bearish for EUR, AUD and CHF; the view on JPY and MXN is balanced",0.0,0.0,"{'neg': 0.0, 'neu': 1.0, 'pos': 0.0, 'compound': 0.0}","{'neg': 0.0, 'neu': 1.0, 'pos': 0.0, 'compound': 0.0}"
433,@JoelKruger  Hi Joel: Lets suppose  that ISM Index comes better than expected. What happens to  Dax30 and to EUR USD ?  And if comes worst ?,-0.25,0.75,"{'neg': 0.216, 'neu': 0.632, 'pos': 0.153, 'compound': -0.296}","{'neg': 0.216, 'neu': 0.632, 'pos': 0.153, 'compound': -0.296}"
434,"USD trading at 8.12, EUR 10.82 and GBP at 12.58. GOLD 1659 and TOP 40 down 75 points..",0.5,0.5,"{'neg': 0.0, 'neu': 0.847, 'pos': 0.153, 'compound': 0.2023}","{'neg': 0.0, 'neu': 0.847, 'pos': 0.153, 'compound': 0.2023}"
435,RT @farxyun786 EUR/USD attempting to fill the gap..: We’ve just been up to 1.3382 and almost filled the o/n-weekend gap from  1... ht...,0.0,0.0,"{'neg': 0.0, 'neu': 1.0, 'pos': 0.0, 'compound': 0.0}","{'neg': 0.0, 'neu': 1.0, 'pos': 0.0, 'compound': 0.0}"
436,The gap in EUR/USD is now closed. Expecting another impulsive wave down and a reversal. Let's see.,0.0,0.0,"{'neg': 0.0, 'neu': 1.0, 'pos': 0.0, 'compound': 0.0}","{'neg': 0.0, 'neu': 1.0, 'pos': 0.0, 'compound': 0.0}"
437,Q3 STATS- FTSE DOWN 15.3%. S&P DOWN 14.5%. YEN and USD the biggest FX risers. Yen up 13.7% v's AUD and 11.3% v's EUR.,0.0,0.0,"{'neg': 0.0, 'neu': 1.0, 'pos': 0.0, 'compound': 0.0}","{'neg': 0.0, 'neu': 1.0, 'pos': 0.0, 'compound': 0.0}"
438,"The KES is in the 100.10-100.875 range so far. As I write this, it's at 100.75 to the USD, 156.41 to the GBP and 134.29 to the EUR.",0.1,1.0,"{'neg': 0.0, 'neu': 1.0, 'pos': 0.0, 'compound': 0.0}","{'neg': 0.0, 'neu': 1.0, 'pos': 0.0, 'compound': 0.0}"
439,"ZAR see saw's in morning trade as EUR/ USD trades aroung 1.3350. Top40 down 1.6%. USD 8.12, EUR 10.83 and GBP 12.61.",0.0,0.0,"{'neg': 0.0, 'neu': 1.0, 'pos': 0.0, 'compound': 0.0}","{'neg': 0.0, 'neu': 1.0, 'pos': 0.0, 'compound': 0.0}"
440,initially mired in the red so I BUY EUR/USD and Daily WTI but rise must go 1.3400+ to stay in EUR/USD and 78.50+ to stay with BUYS/longs.,0.0,0.0,"{'neg': 0.0, 'neu': 1.0, 'pos': 0.0, 'compound': 0.0}","{'neg': 0.0, 'neu': 1.0, 'pos': 0.0, 'compound': 0.0}"
441,@zerohedge eurchf peg will hold snb is selling eur vs usd and diversifying eur holdings usdchf is rising so there are no losses,0.0,0.0,"{'neg': 0.161, 'neu': 0.839, 'pos': 0.0, 'compound': -0.3182}","{'neg': 0.161, 'neu': 0.839, 'pos': 0.0, 'compound': -0.3182}"
442,"This week's best trade is NZD/USD. My latest forecasts for EUR, JPY, CHF, GBP, AUD and NZD now available via email from TRL@clear.net.nz",0.75,0.6,"{'neg': 0.0, 'neu': 0.781, 'pos': 0.219, 'compound': 0.6369}","{'neg': 0.0, 'neu': 0.781, 'pos': 0.219, 'compound': 0.6369}"
443,Think that wave 3 of 5 is complete in EUR/USD. Expecting wave 4 to at least close that 1.3380 gap and a final 5th down. #eurusd #elliottwave,-0.15,0.7,"{'neg': 0.0, 'neu': 1.0, 'pos': 0.0, 'compound': 0.0}","{'neg': 0.0, 'neu': 1.0, 'pos': 0.0, 'compound': 0.0}"
444,"@JohnKicklighter Hi John, do you think we will not see the bounce that we are anticipating in the eur/usd and the nzd/usd?",0.0,0.0,"{'neg': 0.0, 'neu': 1.0, 'pos': 0.0, 'compound': 0.0}","{'neg': 0.0, 'neu': 1.0, 'pos': 0.0, 'compound': 0.0}"
445,I'm watching two levels in EUR/USD atm. Above 1.3380 = larger wave 4 is underway that should stay below 1.3520. Above 1.3520 and I'm a buyer,0.0,0.5,"{'neg': 0.0, 'neu': 1.0, 'pos': 0.0, 'compound': 0.0}","{'neg': 0.0, 'neu': 1.0, 'pos': 0.0, 'compound': 0.0}"
446,I'm watching two levels in EUR/USD atm. Above 1.3380 = larger wave 4 is underway that should stay below 1.3520. Above 1.3520 and I'm a buyer,0.0,0.5,"{'neg': 0.0, 'neu': 1.0, 'pos': 0.0, 'compound': 0.0}","{'neg': 0.0, 'neu': 1.0, 'pos': 0.0, 'compound': 0.0}"
447,Before trading in #Silver again I will try a long trade @ 1.3359 for 100.000 x Eur/Usd. stoploss @ 1.3294 and a  TP @ 1.3493 Wish me luck,-0.05,0.4,"{'neg': 0.0, 'neu': 0.637, 'pos': 0.363, 'compound': 0.6908}","{'neg': 0.0, 'neu': 0.637, 'pos': 0.363, 'compound': 0.6908}"
448,EUR/USD already gap down to reach a low of 1.33301 so far today. What does this portend or confirm when Europe and US open?,0.03333333333333333,0.6,"{'neg': 0.159, 'neu': 0.758, 'pos': 0.083, 'compound': -0.25}","{'neg': 0.159, 'neu': 0.758, 'pos': 0.083, 'compound': -0.25}"
449,$EUR/USD at 1.3338 - comfortably below the lows of last week - looking for $ES to open somewhere between  12.50 and 16.50   $$,0.0,0.2888888888888889,"{'neg': 0.154, 'neu': 0.662, 'pos': 0.184, 'compound': 0.1027}","{'neg': 0.154, 'neu': 0.662, 'pos': 0.184, 'compound': 0.1027}"
450,#ft71 DXY and EUR/USD moving back towards Friday close after opening USD strength.  If that keeps up ES could pop.,0.0,0.25,"{'neg': 0.0, 'neu': 0.789, 'pos': 0.211, 'compound': 0.4939}","{'neg': 0.0, 'neu': 0.789, 'pos': 0.211, 'compound': 0.4939}"
451,"hedged on aud/usd, got stopped on usd/cad and eur/usd, considering going short €",0.0,0.3,"{'neg': 0.239, 'neu': 0.761, 'pos': 0.0, 'compound': -0.296}","{'neg': 0.239, 'neu': 0.761, 'pos': 0.0, 'compound': -0.296}"
452,@hambaba Mostly likely 4 more weeks of selling on EUR/USD before we have a selling exhaustion and bottom in place.,0.5,0.5,"{'neg': 0.183, 'neu': 0.584, 'pos': 0.233, 'compound': 0.1513}","{'neg': 0.183, 'neu': 0.584, 'pos': 0.233, 'compound': 0.1513}"
453,"Ok the EURO is dying and Greece is fucked.
But I'd like to point out EUR/USD is JUST turning negative YTD.",0.0,0.0,"{'neg': 0.271, 'neu': 0.556, 'pos': 0.174, 'compound': -0.34}","{'neg': 0.271, 'neu': 0.556, 'pos': 0.174, 'compound': -0.34}"
454,"@Nanzo_s Sure for the next coming few months will focus mainly on EUR/USD, GBP/USD, and USD/JPY. Breakouts, Range, and momentum trading.",0.2222222222222222,0.4074074074074074,"{'neg': 0.0, 'neu': 0.839, 'pos': 0.161, 'compound': 0.3182}","{'neg': 0.0, 'neu': 0.839, 'pos': 0.161, 'compound': 0.3182}"
455,"@JohnKicklighter such a difficult situation, i  have some mistaken eur/usd bought and if we go down i will be so negative, i should plan!!!",-0.5,1.0,"{'neg': 0.5, 'neu': 0.5, 'pos': 0.0, 'compound': -0.6124}","{'neg': 0.5, 'neu': 0.5, 'pos': 0.0, 'compound': -0.6124}"
456,"#INR slides: USD 5+, AUD 2+, GBP 5+ and EUR 3+ in just two months! Any change in Consumer Electronics & Computer Hardware prices? @cr4321",0.0,0.0,"{'neg': 0.0, 'neu': 1.0, 'pos': 0.0, 'compound': 0.0}","{'neg': 0.0, 'neu': 1.0, 'pos': 0.0, 'compound': 0.0}"
457,"200 pips on EUR/USD Short, and EUR/CAD short. Price action rules.",0.03333333333333333,0.2333333333333333,"{'neg': 0.0, 'neu': 1.0, 'pos': 0.0, 'compound': 0.0}","{'neg': 0.0, 'neu': 1.0, 'pos': 0.0, 'compound': 0.0}"
458,Eur/usd weekly close below 1.3400 means further down side move towards 1.3350 and 1.3250,-0.3125,0.6875,"{'neg': 0.0, 'neu': 1.0, 'pos': 0.0, 'compound': 0.0}","{'neg': 0.0, 'neu': 1.0, 'pos': 0.0, 'compound': 0.0}"
459,bot  EUR /USD  @1.3411 and AUD/USD @0.9694 for short term,0.0,0.3,"{'neg': 0.0, 'neu': 1.0, 'pos': 0.0, 'compound': 0.0}","{'neg': 0.0, 'neu': 1.0, 'pos': 0.0, 'compound': 0.0}"
460,"next week may see the USD upmove extend but agnst JPY,EUR, and CHF more so than the peripherals and emerging markets.",0.0,0.0,"{'neg': 0.0, 'neu': 0.876, 'pos': 0.124, 'compound': 0.1779}","{'neg': 0.0, 'neu': 0.876, 'pos': 0.124, 'compound': 0.1779}"
461,TP Hit on both EUR/USD and AUD/USD. EUR at 1.3420 and AUD at 96.95 for +120 pips,0.0,0.0,"{'neg': 0.0, 'neu': 1.0, 'pos': 0.0, 'compound': 0.0}","{'neg': 0.0, 'neu': 1.0, 'pos': 0.0, 'compound': 0.0}"
462,"note USD/Index at resistance and ADR; watch US equities closely, note extensions of entry swing on EUR/USD near figure zone",0.1,0.4,"{'neg': 0.0, 'neu': 1.0, 'pos': 0.0, 'compound': 0.0}","{'neg': 0.0, 'neu': 1.0, 'pos': 0.0, 'compound': 0.0}"
463,"USD is currently selling @ 1.0612, EUR @ 1.4469 and GBP @ 1.6730. Please call for rates on LARGE trades! 519.763.7330",0.0,0.4,"{'neg': 0.0, 'neu': 1.0, 'pos': 0.0, 'compound': 0.0}","{'neg': 0.0, 'neu': 1.0, 'pos': 0.0, 'compound': 0.0}"
464,"EUR/USD falling in month and quarter end trading, GBP/EUR enjoying some upside, high eurozone inflation ignored #euro #sterling",0.28,0.52,"{'neg': 0.0, 'neu': 0.789, 'pos': 0.211, 'compound': 0.4939}","{'neg': 0.0, 'neu': 0.789, 'pos': 0.211, 'compound': 0.4939}"
465,$FX because I'm long eur.usd (from 1.3515) and short aud.usd (from 1.07),-0.025,0.35,"{'neg': 0.0, 'neu': 1.0, 'pos': 0.0, 'compound': 0.0}","{'neg': 0.0, 'neu': 1.0, 'pos': 0.0, 'compound': 0.0}"
466,EUR/USD comes under further pressure breaking the 1.3500 handle to the downside and printing sessions lows at 1.3487,0.0,0.3,"{'neg': 0.174, 'neu': 0.826, 'pos': 0.0, 'compound': -0.2732}","{'neg': 0.174, 'neu': 0.826, 'pos': 0.0, 'compound': -0.2732}"
467,"Nw my trader is talking ""@dayozilon: 4 max profit, cross d 2 and go long Eur/NGN RT Bonafyde27: Beta still go short NGN/USD",-0.016666666666666666,0.2333333333333333,"{'neg': 0.0, 'neu': 0.775, 'pos': 0.225, 'compound': 0.4404}","{'neg': 0.0, 'neu': 0.775, 'pos': 0.225, 'compound': 0.4404}"
468,"@niksoftware will the USD and EUR pricing of your products be brought in line with each other? $200 and €200 is unrealistic, try $200/€150",0.0,0.0,"{'neg': 0.0, 'neu': 1.0, 'pos': 0.0, 'compound': 0.0}","{'neg': 0.0, 'neu': 1.0, 'pos': 0.0, 'compound': 0.0}"
469,"RT @Ramah_Nyang: KES at 99.75 [99.70's the low so far today] to the USD, 155.59 to the GBP, and 134.90 to the EUR. Keep making baby steps KE",0.05,0.65,"{'neg': 0.13, 'neu': 0.87, 'pos': 0.0, 'compound': -0.2732}","{'neg': 0.13, 'neu': 0.87, 'pos': 0.0, 'compound': -0.2732}"
470,"RT @ramah_nyang: KES at 99.75 [99.70's the low so far today] to the USD, 155.59 to the GBP, and 134.90 to the EUR. Keep making baby steps...",0.05,0.65,"{'neg': 0.13, 'neu': 0.87, 'pos': 0.0, 'compound': -0.2732}","{'neg': 0.13, 'neu': 0.87, 'pos': 0.0, 'compound': -0.2732}"
471,"""@Ramah_Nyang KES at 99.75 [99.70's the low so far today] to the USD, 155.59 to the GBP, and 134.90 to the EUR. Keep making baby steps KES.""",0.05,0.65,"{'neg': 0.116, 'neu': 0.884, 'pos': 0.0, 'compound': -0.2732}","{'neg': 0.116, 'neu': 0.884, 'pos': 0.0, 'compound': -0.2732}"
472,"RT @Ramah_Nyang: KES at 99.75 [99.70's the low so far today] to the USD, 155.59 to the GBP, and 134.90 to the EUR. Keep making baby steps KE",0.05,0.65,"{'neg': 0.13, 'neu': 0.87, 'pos': 0.0, 'compound': -0.2732}","{'neg': 0.13, 'neu': 0.87, 'pos': 0.0, 'compound': -0.2732}"
473,"KES at 99.75 [99.70's the low so far today] to the USD, 155.59 to the GBP, and 134.90 to the EUR. Keep making baby steps KES...",0.05,0.65,"{'neg': 0.123, 'neu': 0.877, 'pos': 0.0, 'compound': -0.2732}","{'neg': 0.123, 'neu': 0.877, 'pos': 0.0, 'compound': -0.2732}"
474,I think we are coming to an end of a flat corrective wave @ 1.35180 and going to a zigzag one.  Looking to buy EUR/USD.  Will confirm,-0.025,0.125,"{'neg': 0.0, 'neu': 1.0, 'pos': 0.0, 'compound': 0.0}","{'neg': 0.0, 'neu': 1.0, 'pos': 0.0, 'compound': 0.0}"
475,"#EUR/USD sales from US, European and a host of funds VS Mid-East buying into the lows has slowed the rate of the descent",-0.10000000000000002,0.2333333333333333,"{'neg': 0.174, 'neu': 0.826, 'pos': 0.0, 'compound': -0.2732}","{'neg': 0.174, 'neu': 0.826, 'pos': 0.0, 'compound': -0.2732}"
476,"07:05 GMT: USD is getting stronger, foremost against EUR, GBP and CHF. EUR/USD is under heavy pressure, breaks yesterday's low.",0.0,0.3,"{'neg': 0.119, 'neu': 0.734, 'pos': 0.147, 'compound': 0.128}","{'neg': 0.119, 'neu': 0.734, 'pos': 0.147, 'compound': 0.128}"
477,EUR/USD breaking down..... great short opportunity on CL 82.6 and EXTX50 2185,0.4,0.525,"{'neg': 0.0, 'neu': 0.631, 'pos': 0.369, 'compound': 0.6249}","{'neg': 0.0, 'neu': 0.631, 'pos': 0.369, 'compound': 0.6249}"
478,"EUR/USD, EUR/JPY, GBP/USD are into a flat wave.  Will wait for a break out from the choppy area and ride a new trend.",0.05568181818181818,0.2897727272727273,"{'neg': 0.0, 'neu': 1.0, 'pos': 0.0, 'compound': 0.0}","{'neg': 0.0, 'neu': 1.0, 'pos': 0.0, 'compound': 0.0}"
479,Taking a third EUR/USD long here @ 1.3576 with 1.3540 stop. Second one is @ 1.3558 with 1.3515 stop and First one @ 1.3405 with stop @ BE.,0.05,0.18333333333333335,"{'neg': 0.337, 'neu': 0.663, 'pos': 0.0, 'compound': -0.6808}","{'neg': 0.337, 'neu': 0.663, 'pos': 0.0, 'compound': -0.6808}"
480,Taking a third EUR/USD long here @ 1.3576 with 1.3540 stop. Second one is @ 1.3558 with 1.3515 stop and First one @ 1.3405 with stop @ BE.,0.05,0.18333333333333335,"{'neg': 0.337, 'neu': 0.663, 'pos': 0.0, 'compound': -0.6808}","{'neg': 0.337, 'neu': 0.663, 'pos': 0.0, 'compound': -0.6808}"
481,Love this volatility!!  Still short EUR/USD and AUD/USD....Cha Ching!!!,0.25,0.44999999999999996,"{'neg': 0.0, 'neu': 0.588, 'pos': 0.412, 'compound': 0.6369}","{'neg': 0.0, 'neu': 0.588, 'pos': 0.412, 'compound': 0.6369}"
482,eur/usd & aud/usd correlation stronger than ever. aud been testing 400 SMA since 8 this morning and eur been testing 200 sma since 8...,0.0,0.0,"{'neg': 0.0, 'neu': 0.852, 'pos': 0.148, 'compound': 0.3818}","{'neg': 0.0, 'neu': 0.852, 'pos': 0.148, 'compound': 0.3818}"
483,head and shoulder playing out on eur/usd,0.0,0.0,"{'neg': 0.0, 'neu': 0.556, 'pos': 0.444, 'compound': 0.34}","{'neg': 0.0, 'neu': 0.556, 'pos': 0.444, 'compound': 0.34}"
484,"Normally I would say, buy the rumor and sell the fact with the EUR, but seems very bid today. With asia cb's selling usd, no recycling.hmmm?",0.15,0.6499999999999999,"{'neg': 0.0, 'neu': 1.0, 'pos': 0.0, 'compound': 0.0}","{'neg': 0.0, 'neu': 1.0, 'pos': 0.0, 'compound': 0.0}"
485,@Nanzo_s I think its time to enter position and buy EUR/USD TP: 105.660 & SL: 103.480.  Good luck,0.7,0.6000000000000001,"{'neg': 0.0, 'neu': 0.576, 'pos': 0.424, 'compound': 0.7096}","{'neg': 0.0, 'neu': 0.576, 'pos': 0.424, 'compound': 0.7096}"
486,"The USD is currently selling @ 1.0511, EUR @ 1.4456 and GBP @ 1.6635. Please call for rates on LARGE trades!",0.0,0.4,"{'neg': 0.0, 'neu': 1.0, 'pos': 0.0, 'compound': 0.0}","{'neg': 0.0, 'neu': 1.0, 'pos': 0.0, 'compound': 0.0}"
487,"RT @Ramah_Nyang: KES down to 99.60 against the USD, 155.90 against the GBP, and 135.70 against the EUR",0.0,0.0,"{'neg': 0.0, 'neu': 1.0, 'pos': 0.0, 'compound': 0.0}","{'neg': 0.0, 'neu': 1.0, 'pos': 0.0, 'compound': 0.0}"
488,"KES down to 99.60 against the USD, 155.90 against the GBP, and 135.70 against the EUR - PM's comments on ""action"" next week taking effect.",0.05,0.05,"{'neg': 0.0, 'neu': 1.0, 'pos': 0.0, 'compound': 0.0}","{'neg': 0.0, 'neu': 1.0, 'pos': 0.0, 'compound': 0.0}"
489,"@Nanzo_s Sorry nanzo its EUR/JPY but also get ready for also EUR/USD, GBP/USD and AUD/USD.  Hope by next weekend will maximize profits :)",0.0,0.0,"{'neg': 0.0, 'neu': 0.691, 'pos': 0.309, 'compound': 0.7003}","{'neg': 0.0, 'neu': 0.691, 'pos': 0.309, 'compound': 0.7003}"
490,"Germany pass approval to increase bailout fund and EUR/USD heads south... EFSF will not be big enough if IT, ES go to the wall",0.0,0.3,"{'neg': 0.104, 'neu': 0.896, 'pos': 0.0, 'compound': -0.1027}","{'neg': 0.104, 'neu': 0.896, 'pos': 0.0, 'compound': -0.1027}"
491,$AUD $CAD $EUR and $NZD back in congestion zones established against $USD during 04:00 GMT to 07:00 GMT period.,0.0,0.0,"{'neg': 0.0, 'neu': 1.0, 'pos': 0.0, 'compound': 0.0}","{'neg': 0.0, 'neu': 1.0, 'pos': 0.0, 'compound': 0.0}"
492,$AUD $CAD $EUR and $NZD back in congestion zones established against $USD during 04:00 GMT to 07:00 GMT period.,0.0,0.0,"{'neg': 0.0, 'neu': 1.0, 'pos': 0.0, 'compound': 0.0}","{'neg': 0.0, 'neu': 1.0, 'pos': 0.0, 'compound': 0.0}"
493,"my #Japanese fren says - No way, it’s just weak #USD and #EUR, not strong #JPY ^_^",0.029166666666666646,0.6791666666666667,"{'neg': 0.315, 'neu': 0.326, 'pos': 0.359, 'compound': 0.1027}","{'neg': 0.315, 'neu': 0.326, 'pos': 0.359, 'compound': 0.1027}"
494,"eur/usd going up and down @alaidi , @leanco ,target 3720???",0.0,0.0,"{'neg': 0.0, 'neu': 1.0, 'pos': 0.0, 'compound': 0.0}","{'neg': 0.0, 'neu': 1.0, 'pos': 0.0, 'compound': 0.0}"
495,"New blog post : 29 October, eur / usd and gold analysis",0.13636363636363635,0.45454545454545453,"{'neg': 0.0, 'neu': 1.0, 'pos': 0.0, 'compound': 0.0}","{'neg': 0.0, 'neu': 1.0, 'pos': 0.0, 'compound': 0.0}"
496,#EUR/GBP Offers are tipped at 0.8720 and 0.8750 #GBP #USD,0.0,0.0,"{'neg': 0.0, 'neu': 1.0, 'pos': 0.0, 'compound': 0.0}","{'neg': 0.0, 'neu': 1.0, 'pos': 0.0, 'compound': 0.0}"
497,#EUR/USD offers are still seen lurking above into the 50s and through the upper-1.36s to slow the immediate rate of the recovery. #USD #FX,-0.30000000000000004,0.39999999999999997,"{'neg': 0.167, 'neu': 0.833, 'pos': 0.0, 'compound': -0.2023}","{'neg': 0.167, 'neu': 0.833, 'pos': 0.0, 'compound': -0.2023}"
498,"wont sell eur/usd, both eur/usd and gbp/usd seem to be correlated so will stay with gbp for now #TheTradeManager #TMC_Julian #FX",0.0,0.0,"{'neg': 0.0, 'neu': 1.0, 'pos': 0.0, 'compound': 0.0}","{'neg': 0.0, 'neu': 1.0, 'pos': 0.0, 'compound': 0.0}"
499,"wont sell eur/usd, both eur/usd and gbp/usd seem to be correlated so will stay with gbp for now #TheTradeManager #TMC_Julian #FX",0.0,0.0,"{'neg': 0.0, 'neu': 1.0, 'pos': 0.0, 'compound': 0.0}","{'neg': 0.0, 'neu': 1.0, 'pos': 0.0, 'compound': 0.0}"
500,"wont sell eur/usd, both eur/usd and gbp/usd seem to be correlated so will stay with gbp for now #TheTradeManager #TMC_Julian #FX",0.0,0.0,"{'neg': 0.0, 'neu': 1.0, 'pos': 0.0, 'compound': 0.0}","{'neg': 0.0, 'neu': 1.0, 'pos': 0.0, 'compound': 0.0}"
501,"wont sell eur/usd, both eur/usd and gbp/usd seem to be correlated so will stay with gbp for now #TheTradeManager #TMC_Julian #FX",0.0,0.0,"{'neg': 0.0, 'neu': 1.0, 'pos': 0.0, 'compound': 0.0}","{'neg': 0.0, 'neu': 1.0, 'pos': 0.0, 'compound': 0.0}"
502,"wont sell eur/usd, both eur/usd and gbp/usd seem to be correlated so will stay with gbp for now #TheTradeManager #TMC_Julian #FX",0.0,0.0,"{'neg': 0.0, 'neu': 1.0, 'pos': 0.0, 'compound': 0.0}","{'neg': 0.0, 'neu': 1.0, 'pos': 0.0, 'compound': 0.0}"
503,eur/usd in wait-and-see mode ahead of key German vote,0.0,0.5,"{'neg': 0.0, 'neu': 1.0, 'pos': 0.0, 'compound': 0.0}","{'neg': 0.0, 'neu': 1.0, 'pos': 0.0, 'compound': 0.0}"
504,"Just ended corrective wave in EUR/USD, AUD/USD, and GBP/USD.",0.0,0.0,"{'neg': 0.0, 'neu': 1.0, 'pos': 0.0, 'compound': 0.0}","{'neg': 0.0, 'neu': 1.0, 'pos': 0.0, 'compound': 0.0}"
505,"A banktrader in S'pore and why pain is comin
""It's very clear to me, sell EUR/USD, it's going down""
Nothing is clear in the mkt m8.",0.10000000000000002,0.3833333333333333,"{'neg': 0.213, 'neu': 0.452, 'pos': 0.335, 'compound': 0.2263}","{'neg': 0.213, 'neu': 0.452, 'pos': 0.335, 'compound': 0.2263}"
506,in my CNBC portfolio... long EUR/usd and jpy  -   just shorted USD/CHF,-0.025,0.35,"{'neg': 0.0, 'neu': 1.0, 'pos': 0.0, 'compound': 0.0}","{'neg': 0.0, 'neu': 1.0, 'pos': 0.0, 'compound': 0.0}"
507,"The Fed's speech at 5am this morning tanked EUR, AUD and NZD against USD.",0.0,0.0,"{'neg': 0.0, 'neu': 1.0, 'pos': 0.0, 'compound': 0.0}","{'neg': 0.0, 'neu': 1.0, 'pos': 0.0, 'compound': 0.0}"
508,Also...signals to LONG NZD/USD and EUR/AUD.  Some of these trades correlated so manage risk accordingly.,-0.05,0.4,"{'neg': 0.208, 'neu': 0.792, 'pos': 0.0, 'compound': -0.2732}","{'neg': 0.208, 'neu': 0.792, 'pos': 0.0, 'compound': -0.2732}"
509,Nice head and shoulders on the 15 min chart #eur #usd #forec,0.6,1.0,"{'neg': 0.0, 'neu': 0.588, 'pos': 0.412, 'compound': 0.4215}","{'neg': 0.0, 'neu': 0.588, 'pos': 0.412, 'compound': 0.4215}"
510,EUR/USD under 1.36 ! Silver still collapse and Gold is losing 3% @ 1600$/oz.,0.0,0.0,"{'neg': 0.278, 'neu': 0.722, 'pos': 0.0, 'compound': -0.4019}","{'neg': 0.278, 'neu': 0.722, 'pos': 0.0, 'compound': -0.4019}"
511,EUR/USD fell short of the 1.37 figure and currently trades around 1.3640 with the daily Tenkan line coming in around 1.3625 as a pivot.,0.0,0.35,"{'neg': 0.0, 'neu': 1.0, 'pos': 0.0, 'compound': 0.0}","{'neg': 0.0, 'neu': 1.0, 'pos': 0.0, 'compound': 0.0}"
512,"@alaidiPremiumFX What's your thought with this volatile move in Silver, EUR and CAD/USD.",0.0,0.0,"{'neg': 0.0, 'neu': 1.0, 'pos': 0.0, 'compound': 0.0}","{'neg': 0.0, 'neu': 1.0, 'pos': 0.0, 'compound': 0.0}"
513,@sonigaurav1100 u follows USD/INR and mkt follows EUR/USD,0.0,0.0,"{'neg': 0.0, 'neu': 1.0, 'pos': 0.0, 'compound': 0.0}","{'neg': 0.0, 'neu': 1.0, 'pos': 0.0, 'compound': 0.0}"
