,tweet,polarity_score
0, has hit highs in the  and  is the  next that would mean about 160 oil ,0
1,working on expense report from latest travel  sorting out receipts in usd eur and huf forints  taking forever,0
2,ubs we remain cautious about the resilence of eur gbp and aud vs usd as currency markets have priced in much good news at these levels,0
3,the soap opera continues  gbp plc isnt the focus as eur and usd fight the good fight,0
4, you said jp morgan will be wrong on eurusd but they got it this time as ms and citi did not,0
5,gap guesses minor usd gap up looking for audusd to trade down to 10680 and hols support there eurusd to 13380 buy the dips,0
6,regan re tweet your trade my favorite trade is long eurusd long gold and long cadjpy,0
7, thing is there was a sign giving prices in usd hkd eur  gdp so i gave him the 30p and he said no its free,0
8, there is something i dont like both in us stock and eurusd and audusd is lacking strenght usually it is the opposite,0
9, jordan did you get my email i am still long eurusd i am hoping 1375 and i will bail out,0
10,what usd and jpy crosses are more favorable to trade ie eurusd or audusd long from a euraud analysis etc,0
11,eurusd closes above 13450 and there is a good chance we will gap up to 135,0
12,gold during 2 months will be  level and eurusd again to 125 and 122 levels,0
13,lost 65 pips and gain 93 pips today eurusd was crazy today the pair made me look lyk a fool,0
14,gold during 2 months will be  1475 level and eurusd again to 125 and 122 levels,0
15,the eur continues to show strength against the usd and with all the questions still unanswered in the greek debt deal,0
16, and  sold off today possibly due to far east diversification and  have won outqueue ive greek weekend headlinesgtsafety,0
17,dis morning i placed eurusd no stop loss made a take profit decision of 80 pips at 005 volume and it was a buy limit,0
18, to go higher against usd compare gbp and joy changes gbpjpy especially,0
19,i am going to say this once and only once there is no reason to be short the eurusd  trend is up until its not buy the dips,0
20, move in eurusd  eurjpy this week of risk on nature has helped market stick near highs despite ob conditions and divergences,0
21,wait for it eurusd does 135 and the snb will pop that eurchf  gt they plan these attacks,0
22,eurusd just reached our target 13475 and todays r2 level taking money of the table and just keeping my audusd long for 10750,0
23,eurusd continuing long my entry was 130462 on 02162012 today high 134267 now 13412 i have 366 pips of profit and going,0
24,price in different currencies such as usd gbp and eur this time round it is different as we have to consider other currencies such as ,0
25,and now most peoples are long on eurusd  big money short them soon  wait ans see your money go to bankers ,0
26, enjoy trading eurusd and stay on the green side ,0
27, snb is waiting for the eurusd to pick up steam they will intervene soon and euro will be like fireworks,0
28,i full anticipate the eurusd to be testing 149 in coming months and possibly before summer arrives for northern hemisphere,0
29,heads up eurusd will do 13440 and then 13480 today a massive run on usd is about to occur if you follow me this is old news,0
30, morgan stanley shorts usd at 133 for a downside target of 12390 and a stop at 13460  doubt it will move there,0
31,morgan stanley shorts usd at 133 for a downside target of 12390 and a stop at 13460,0
32,usd sits in a 1336080 band for the moment with bids into the 13350 former barrier level to support dips and supply from the 13385,0
33,in the medium term  and  appear very weak stay aside from ,0
34,usd initial support into the 13350 former barriers with stops below and option dealers noting size 13325  13300 expiries  ,0
35,the   index closed at its highest level since 2008 last night and eurusd is currently at a 2012 high  ,0
36,usd technicals suggest up and fundamentals down but trend prevails,0
37,jpy weakness is laid bareeur and gbp and usd have taken a swift rally against it japanese leaders are on top of the currency now,0
38,usd looks a tad offered going into the tokyo close with sterm players locking in profits on longs and generally squaring positions ,0
39,eur made 10 week highs against the usd and aud rallied to 10738,0
40,euraud right now is a great indicator for your euro and aud v usd gt basically tells you which will move higher faster,0
41,todays best trade is audusd my latest forecasts for eur jpy gbp chf aud and nzd are now available  by email from trlnetnz,0
42, eurusd 5 wave after triangle looks complete and euraud close to 125 target can reverse anytime,0
43,good morning all eurusd popped overnight and usdjpy moving in our direction  great start to the morning,0
44,end of day trade all about ticks and eurusdticks barely negative for hourseuro uppishall indexes grinded upwards,0
45,eurusd attained a new 10week high congrats to all who took and held the long we discussed during todays ny morning session,0
46,eurusd needs to break highs today with authority or i truly do believe we will trade to gap fill and soon,0
47,closed my eurusd short earlier today pair is still climbing added to my aud and nzd against usd shorts,0
48,in eurusd bullish outlook for a break through 13321 towards 13450 and 13540 remains absolutely unchanged,0
49,eurusd is in a generic porno position  use a tight stop and look for a deep downward thrust,0
50,avoid more debt eur and usd buy rmb and gold as hedge buy into equities when it feels like 2008 again when factories shutdown,0
51, i would give the eurusd and sp500 some time to settle down and then look for another reversal as the 13285 low was false,0
52,just look at the derivation from the correlation of eurusd with other usd currencies the sp 500 and the dax index,0
53,us and german eurusd sales keeping the price just shy of the 133s,0
54,possible eurusd and gbpusd entry coming up log into the chat asap for the details,0
55,eurusd and gbpusd in the last 3hours has been disappointing oping for a move soon,0
56,quick short sale here on eurusd and eurjpy 25 pip stops are good,0
57,planning on taking a light eurusd short 12 size  13112 stop is above overnight highs of  3345 and looking for 12 target 13220 ,0
58,eurusd has reached a peak and backed off  is it time for a drop  dont know  but it is a great place for a lowrisk range trade,0
59,13220 support now on eurusd that and the all the way hwb which aligns with gap fill at 13160,0
60,pending long audusd and pending long eurusd hunting a long entry usdollar index short,0
61,despite weakening usd and strengthening eur eurusd risk reversals still strongly favoring eur puts 1m 13 6m 25 1y 265 5y 215,0
62,db gt eur increasingly perceived overvalued against all major currencies except chf jpy seen as undervalued against  usd and  eur ,0
63,eurusd eurjpy close to recovering complet last years losses  04 and  08 respect    ,0
64,reading  eurgbp and usdjpy moved beyond important resistance levels,0
65,congrats to all people on my stream who managed to hold their audusd and eurusd longs well done guys,0
66,mmm yes please the higher the eurusd goes the more we can accumulate and the more we make when it eventually collapses  hold tight,0
67,i have been long the eurusd since tuesday and im up 3400 that not even 12 penny,0
68,eurusd yesterday was so frustrating so i went for audusd at time 3pm long and pleased i did good roll up pattern just hit this morning,0
69,gt  eurjpy and eurusd are up another leg into the european open with an uk clearer seen buying decent amounts in eurusd,0
70,eurjpy and eurusd are up another leg into the european open with an uk clearer seen buying decent amounts in eurusd,0
71,us dollar index made a 7947 high usd was up against the jpy eurtraded sideways this morning and the aud is testing the 10600 level,0
72,7k usd or eur   i hated going to work i started my own home business and now make 7k a month working 4 days,0
73,todays best trades gbpusd and audusd my latest forecasts for these plus eur jpy chf and nzd are now available from trlnetnz,0
74,eurusd the trend is between 13265 and 13192,0
75,eurusd only good news is waiting for the usd and that low the euro is not strong,0
76,update jpy continues to weaken the japanese yen continues its downward stumble against several currencies including the usd and eur,0
77,the inside days on eurusd and usdchfwith xau break 55 days high,0
78,the audusd has been trending lower and opens around 10650 while the eurusd has held up better finding support around 132,0
79,the audusd has been trending lower and opens around 10650 while the eurusd has held up better finding support around 132,0
80,the audusd has been trending lower and opens around 10650 while the eurusd has held up better finding support around 132,0
81,the audusd has been trending lower and opens around 10650 while the eurusd has held up better finding support around 132,0
82,do you hear that sigh of relief coming from asia thats jp corps as the jpy rapidly weakens against the usd and eur,0
83,wow europe is totally fd and the eurusd is  132  ,0
84,pressure cooker is building steam  eurusd looks like its going to pop or drop big and soon gt upside favored and long,0
85,brian we sold the eurusd at 13272 and close our profit target at 13212 60 pipsat the top of the current tight range,0
86, traded heavily against  and  thanks to mpc minutes  but gbpeur should bounce back soon,0
87, i know and eurjpy should b retracing too maybe time to watch the 15 min chart  just jump in long usdjpy on a smalldip,0
88,gbpusd is about to bounce but i still prefer the eurusd take a look at eurgbp and you will see why,0
89,eurusd trades in close proximity to two touted option expires for the ny cut at 13225 and 13250 trades 13234 last 0 pips,0
90,eurusd trades in close proximity to two touted option expires for the ny cut at 13225 and 13250 trades 13234 last 0 pips,0
91,eurusd back to session lows again strong bids found here and a bounce being seen,0
92,usd support still seems strong in the 1321000 area and and resistance lurks above the early london and range highs at 13264,0
93,eur rallies to 13255 vs the usd to test day high and rebounds strongly now back below 13240,0
94, there is technically gap in daily charts of eurusd it may fill up and eur can correct up to 13154,0
95,ubs says sees weaker jpy against both the usd and eur for the end of 2012 and 2013,0
96,ubs says sees weaker jpy against both the usd and eur for the end of 2012 and 2013,0
97,today we notice that the main movements observed are the consequences of gbp and jpy weakningeur and usd taking the advantage of that fact,0
98,january  expected 62 actual 63 yoy december figure 61  dipping to 1214  774  1023 and  13230,0
99,eurusd plummets after weak german and french manufacturing figures next support at 132,0
100,boe minutes may have a bigger impact than normal  watch gbpeur vs gbpusd for clues on both gb economy and eurozone capital flight,0
101,scaled half of eurusd and audusd shorts here this is failure point if they go bad otherwise a lh will take them to next level,0
102,german pmi outcome 501 vs expected 515 not breaking any price trends so far eurjpy and eurusd,0
103,the lacklustre response is most prominent in eurusd which failed to extend into the 133 area yesterday and drifted back to 13220 this,0
104,the notes are posted in the chat new details on the gbpusd and eurusd plus an analysis on gold ,0
105,my latest forecasts for eur gbp chf jpy  aud and nzd are now available from trlnetnz best trades today gbpusd and audusd,0
106,and with the 200 min sma break on eurusd it becomes support and we an squeeze,0
107, hello is that head and shoulders chart pattern in eurusd 1 hour chart neck is at 131970,0
108,  hi   sir can you please give us signals of eurusd and gold,0
109, eurusd slipping but finding bids above 13230 stocks are in the drivers seat at the moment and the risk is for a bigger slump,0
110,eurusd  thats it for the day we remain in eurusd trade stops and limits in place,0
111,closing eurusd and eurgbp 9 pips and  3 pips,0
112,short eurusd and short eurgbp at 13262 and 08395,0
113,gold is at our a target might to try to take out 1750 if we indeed trade higher on sp500 and eurusd then price might even overshoot,0
114,audyen cross down 035 after a similar day yesterday audusd down 044 eurusd even at 13213 and usd dxy up slightly at 7910,0
115,eurusd still finding resistance  ma not too shocking euro is weaker given more austerityweaker growth and likely more protesting,0
116, stay in eurusd will get 13100 and yes then go up or reach 12900 and then go up,0
117,sell the news theme strong as new week starts re europe and china  eurusd appears to have failed vs key 133  king dollar,0
118,eurusd extends decline we re down at 13208 real money still notable sellers apparently sell stops through 13200 and 13180 as a,0
119, of 4 greeceeurusddeal now that the dust has settled and the full facts of this deal have been tabled is it any wonder why the,0
120,usd has failed at 13284 resistance and could dip as far as 13148 today,0
121,i have long positions at 15811 gbpusd and 13229 eur usd hope the news turns a bit more positive for a bullish run,0
122,i would like to enter long eurusd around 13180 and 13140,0
123,k we have supports in eurusd at 13214 and 13180 and 13147  mva 50 100 200  at h1,0
124, slightly weaker against the crosses  770  1020  1220 and  stable at 13265,0
125,now that greek deal has been reached and most positive developments have been priced in market may push eurusd down look for technicals,0
126,eurusd failed to close below support 13025 no clear shortterm trend key levels 13325 and 12970 expect to see unsure trade patterns,0
127,looking to buy at the levels of 13240 eur  usd and targeting 13300 stop loss 13250,0
128,the notes are posted in the chat log in for latest set ups in gold eurusd and gbpusd next live session tues 530am pacific130pm uk,0
129,my latest forecasts for eur gbp chf jpy  aud and nzd are now available from trlnetnz best trades today eurusd and audusd,0
130, climbs to a 3mth high vs  and reverses losses vs  as eu ministers reach agreement on a second bailout package for greece ,0
131,bought eurusd and sold usdchf during volatility and moving stops now to lock in profits,0
132,  does tokyo still think euro looking cheap between 13200 and 13222 against   no news out there and looks like gamble sell,0
133,my latest forecasts for eur gbp chf jpy  aud and nzd are now available from trlnetnz best trades today eurusd and audusd,0
134,the move lower in eurusd towards 13200 will take out of the picture a lot of longs expecting an easy ride to 13400 and beyond usd,0
135,eurusd has a technical daily short setup at 13440 that can be invalidated above 13630 above there and its upward to test 14900,0
136,update we are long eurusd and loosening our sl to 13220 to accommodate price spikes over event risk,0
137,eurusd consolidation holds key 13230 support targets 13290 into asia and europe sessions expect it to be grudgingly slow,0
138,the eurusd has been as high as 13276 and remains supported around 13245 this morning while the nzdusd opens at 08380,0
139,the eurusd has been as high as 13276 and remains supported around 13245 this morning while the nzdusd opens at 08380,0
140,the eurusd has been as high as 13276 and remains supported around 13245 this morning while the nzdusd opens at 08380,0
141,the eurusd has been as high as 13276 and remains supported around 13245 this morning while the nzdusd opens at 08380,0
142,eurusd cant move above 13280 and gbpusd hits resistance near 15880 big risks of gaps with us markets closed,0
143,fx alert eur and usd makes gains on japanese yen the euro and us dollar made significant gains on the depthanalysis economics,0
144,economic news eur and usd makes gains on japanese yen the euro and us dollar made significant gains on depthanalysis investment,0
145,update eur and usd makes gains on japanese yen the euro and us dollar made significant gains on the japanese yen this afternoon so,0
146,fx report eur and usd makes gains on japanese yen the euro and us dollar made significant gains on the japanese yen this more,0
147,currencies eur and usd makes gains on japanese yen the euro and us dollar made significant gains on the depthanalysis business,0
148,news now eur and usd makes gains on japanese yen the euro and us dollar made significant gains on the depthanalysis currency,0
149,fx news gt eur and usd makes gains on japanese yen the euro and us dollar made significant gains on the depthanalysis fx market,0
150,currency news gtgt eur and usd makes gains on japanese yen the euro and us dollar made significant gains on depthanalysis fxtrading,0
151,traders are bullish on cadnokino usd and bearish on chfjpy and eur,0
152,eurusd  bullish continuation versus head and shoulder scenarios,0
153,citi is seeing buyondips interest in jpy jpy with flows biased at 53 and 548 respectively in favor of buying ,0
154,notice  is weaker vs  compared to eurusd  in line with our analysis on daily chart bullish for  and bearish for ,0
155,eurusd has 2 important resistance levels 13262 and 13299 if a reaction off from one of these yields both price action and confirmation,0
156,go to my daily updates to see my strategies for monday i have strategies for    vs  and spx check them on my web site,0
157,short xelgkplong eur usd and the ftsewill close gkp and xel soonjust svalping and ftse also at 5955im still a permobear,0
158,usd topside offers are eyed well ahead of 13300 but stops are seen building above this level and 13310,0
159,things looking ok for both active trades eurchf and aususd  the latter looking like it might dip to provide some profit opportunities,0
160,still holding eurusd long and holding gbpusd long and usdcad short holding them down baby,0
161,rt   eurusd  bullish continuation versus head and shoulder scenarios as the eurusd rebounded from 12974 it face,0
162,rt   eurusd  bullish continuation versus head and shoulder scenarios as the eurusd rebounded from 12974 it face h,0
163,closed both eurusd shorts 32067 for 28 pips and 3pips,0
164,greece is almost ready to reach a deal and receive bailout from europeif so next targets eurusd 13489 gbpusd 16000 audusd 10900,0
165,leading the gains on the dow was intc and dd up 203 and 188usd was weaker against the eur on greek optimism aud above 1075,0
166,eurusd still rising takes out minor hourly resistance an hourly high at 13215 has been breached but progress is slow and orderly and a,0
167, i wish it were that cheap here i paid 167 eur for 1 liter yesterday with 1 eur  140 usd and 1liter  27 gal ,0
168,and we are off 131980s open on eurusd,0
169,find the latest currency exchange rates and convert all major world currencieswith british gbp  euro eur us dollar usd japan,0
170,find the latest currency exchange rates and convert all major world currencieswith british gbp  euro eur us dollar usd japan,0
171,i do have a long eurusd that i did not post on twitter its very small i have a stop on it at 13110 and a target of 13220,0
172,for 2012 im going back to basics  im only trading 6 usd majors eurusd usdjpy usdchf gbpusd audusd and usdcad,0
173,jentho3 nice call on the short eurusd at 12977 for both rob and you,0
174,usd liquidity an issue us data has done a stellar job this week above expectation prints have helped to sustain the eur and other r,0
175, fed is selling usd and buying eur not strong usd policy but keeps ecb from collapse watching economic metrics restabilize,0
176,22 days ago i tweeted to focus on eurjpy and usdjpyenjoy the profitsyou wellcome alllll,0
177,dante h1 spf eurusd and ym valid,0
178,i do fully expect this eurusd to head to above 140 and possibly 150 in 2012 ,0
179,enter long audusd and i expecting a pull back eurusd to get long again eur is arriving to mva 100 13180,0
180, would that mean that would strengthen the usd vs eur gbp and cad,0
181,eurjpy and eurusd sideway,0
182,dnb atms allow eur and usd in and out transactions  when we need this,0
183,i covered my eurusd short earlier this wk at 130 no fx positions  waiting and watching for my levels now,0
184,eurusd  still no trade setups on eurusd and gbpusd,0
185, eurusd  still no trade setups on eurusd and gbpusd,0
186,so see you guys later positions on eurusd and nzdusd long stop to break even,0
187, congrats eta on usd will be needing to move eur to usd in april and would love to use you guys to do it,0
188,looks like sterling rush from good   data also having a mechanical and sentimentbased effect on other pairs eg  ,0
189,eur usd ress 3157 3181 32053250 3272 supp3114 3089 3065 3044 3020 that is my supp and ress,0
190,today eur usd has small range but there is release bullish flag on 4 hr chart and which released bullish piercing line on day chart,0
191, yep usd gt eur pay for the shipping and more thats sweet but also i dont know anyone here that sell the data doubler adaptor,0
192,shorted eurusd and so far up 40pips not to bad for being the first trade after six months of sitting on the sidelines,0
193,still long eurusd and eurgbp from last night,0
194,usd further thrashing in the 1312040 band exected with bids trailing to the figure and offers in the 13150s,0
195,looking back to inland japan boj and govt have no measure to stop collapse of manufacturing high dollarusd and high euroeur,0
196,  the usholiday monday will limit interests into the latter stages of the day and the weekly close will force moderate pos adjustin,0
197,usd supp in the 1306067 area will look to contain weakness and only a sustained break below 13060 would reexpose the 12973 low,0
198,long eurusd from 13120 stops at 13060 with targets of 13220 and 13320,0
199,audusd still hanging eurjpy and gbpjpy win big other loss,0
200, mr ramki now that eurusd has reached 1297 and bounced back do you think it will go straight up to 134xx,0
201,eurusd if the pair breakout 200ma 1hr next target will be 13250 and 13282,0
202,now we are long eurusd and eurgbp from 13090 and 08309 so will see elliot waves tecnical up  vs fundamentls down  euro crisis,0
203,will likely exit that eurusd position at breakeven today and wait for reset higher,0
204,if eurusd break 13125 is no come back until hit 13440 for the 5th wave and them down back,0
205,eur  usd came to downtrend line and corrects,0
206,going to trail my stop on eurusd long cuz of hourly and 4hourly bullish candle,0
207,i think there is more upside for eurusd and sp500,0
208,good morning  usd is selling 0224 gbp6212 and eur is selling 3512 escaping this fantastic weather come get your travel cash,0
209,currently deciding gbp is only being held up bcause eurs drop moves money to usd and to gbp so propping gbp temporarily seeing gbp as sell,0
210,zimbabwe had abandoned its own currency zwd officially and use usd zar south african rand eur gbp etc following hyperinflation ,0
211,12970 eurusd stops below and 12950 options xpiri levels dx 8048 been r,0
212,eurusd  let it go and you learn at once how big and precious it is,0
213,eurusd on a knife edge there is money to made today and lots of it,0
214,danske bank eurusd is testing support levels around 130 and if these are breached we could see another undershoot to the high 120s,0
215,doom it 2985 eurusd and i didnt get in oh well 3030 is good,0
216, no dont do it leave this open and open a long eurusd on 12980,0
217,what a rollercoaster day eurusd jumping up and down n the blaster usdmyr also not sitting down idle testing my balls wei,0
218,with stock markets oversold i expect a bounce the next few hours helping currencies pairs as eurjpy and audusd eurusd might trade higher,0
219,ok we change estrategies we will short nzdusd broke channel audusd and eurusd,0
220,usd buyers in the 12990s slowed the spot descent but dside stops below former barr are in focus and could fuel further sterm losses,0
221,usd lows at 12992 are under pressure but hourly studies are oversolddaily charts retain a bearish bias and favor further weakness,0
222,european indices are seen lower at the start on thursday the eurusd weighs together with greece and yesterdays fomc minutes,0
223,closing my eurgbp short watr seems to be holding and both eurusd and eurjpy are at critical support levels trade update coming up,0
224,my position eurusd fell loss 5900 when closed position i continue to go against the market and losing make money with an opposite position,0
225,eurusd has just broken below intraday support at 13032 and is now targeting fresh 3week lows last at 13010,0
226,eurusd on the cusp of breaking 13   serious erosion mode and its dragging es and nq down with it if you bought aapl today sorry,0
227,when the market gets real and sees that greece is playing games the eurusd will crash below 13000,0
228,heads up eurjpy and eurusd approaching critical support levels,0
229,adding 1 additional unit of eurusd at 13035 with stops at 13020 targets now at 131 and 13150,0
230,i am 100 fundamentally bearish eurusd this trade is purely short term and based on technicals,0
231,looking to get short eurusd tonight i think we are going to test 13000 and head much lower ez mess just getting out of control usd,0
232,no trinity signals but interesting charts doji formed on the gbpusd gbpchf and eurgbp have engulfing candles that nearly fit,0
233,eurusd and the spx has held their long trends medium and long term timeframe neither without squeezing,0
234,  when this is done the eurusd will be at 18000 and too strong to export vw bmw  mbenz holidays to the med will be cheap  ,0
235, interesting that despite spx and eurusd the cartel cant really push gold and silver down,0
236, what is the target for eurusd sir and what is the stop loss,0
237,eurusd taking off the 2nd 12 and booking  profits,0
238,where will the eurusd go after greece greece is likely to be removed from the euro and if that happens the currency is going up sh,0
239,  am short eurusd and stayin put,0
