,tweet,polarity_score
240,stops at entry on both eurusd and usdchf mit level fills not at 1st profit yet but close keeping it tight no fill eurjpy,0
241,the eurusd is eroding here and slowly knawing away at the dow and sp500 aapl holding the naz aloft,0
242,goldman sachs closes long eurusd and short usdmxn trades,0
243,stops very close to entry on eurusd and usdchf early entries at 79r,0
244,greek bailout decision postponement though only in principle will pressure eur tonight usd and jpy to gain,0
245,eurusd i am look for a decline to 13070 and hopefully a break lower,0
246,ringgit is massively strong against usd 303 eur 397 and gbp 476 ,0
247,eurusd pushed lower on eurgbp and boe comments,0
248,much to my frustration eurusd has been holding 131650 but a decisive break below and were in the money,0
249,i am long eurjpy and eurusd 10330 stop 10300 target 10399 and 13165 stop 13140 target 132,0
250, joel is this divergence between eurusd and equities significant  not sure what to make out of the vertical movement in stocks,0
251, 50 are you paying attention to the divergence between eurusd and equities or doesnt matter just play each product sep,0
252,looks like a riskon day is in process till proven otherwise  gbpjpy looks hot  also eurjpy and audusd,0
253,for php 1000  eur 1850  usd 20 all in price for 5 people beer snacks and kareoke great  ,0
254, what about spx and eurusd comparison in points,0
255, i love these two pairs john when eurusd comes down usdchf goes up and vice versa,0
256,any and all longs in the eurusd need to have a stop just below 1300  thats the technical invalidation if thats too big downsize or,0
257, rode out 25 and came out ahead 10 was a long one though was hopeful eur usd would continue to fall and it eventually did,0
258,ive been looking for that break of 131257 for 5 hours lol but we have it and im staying short eurusd,0
259,i dont see any technical reason for the eurusd to rally yet not a single long setup has held today and after every one its traded,0
260,eurusd and audusd is not looking pretty only if the sp500 break under 1345 proves to be false should we expect a eur and aud bounce,0
261,personally looking for es to trade to 1331 with the eurusd to 13070 we get support and its  from there,0
262,do you think gbpusd had enough for today take a look at eurgbp and you will see that a break above 8410 will push gbpusd even lower,0
263, trader prolly a basket of em and commodity currencies as eur and usd as 1t ltro and usd swap lines going to nail them both,0
264,eurusd i got the move higher this morning right and the drop to the current levels lets see if price will trade to 13250 as expected,0
265,buy naw eurusd to 50 pip tpand 40 st try it now,0
266,still long eurusd and aud usd   move stop to 13183 and 10700 target open still it will be perfect to hit 13286 and 10800 will see,0
267, am fix usd 1721 eur 130310 gbp 109180 yesterdays am fix usd 1727 eur 130222 and gbp 109317,0
268, cpi at 36 rpi at 39 exchange rates 15727 11937 and 12289 against usd eur and jpy please rt your followers,0
269,remember levels on the eurusd as well 13150132 is crucial for buyers and sellers to battle out direction,0
270,usd but selling into signs of a topside failure will be pref by some and offers are seen lining up into 132area to slow the bounce,0
271,corporate and real money euro demand cited amid the usd recovery back into the 13170s,0
272,usd jpy fcasts over 1 and 3 months and it now sees the single currency trading at 130 from 120 and at 125 from 115 prev,0
273,well i am long eurusd and audusd,0
274,interest rate difference between eur and usd makes the former resilient to go to low,0
275,dax opened 05 and bounced back to 0my bet we trade lower again  call the eurusd  131,0
276,usd daily trend indicators tick south and show scope for further weakness,0
277,usdjpy and eurchf on intervention watch ,0
278,babypips will eurusd form the low for the week today and start going up,0
279,moody downgrades italy and puts france on negative review eurusd 13175  ,0
280,the eur has lost ground against the usd this evening interesting move considering the greek vote and pending bailout last night ,0
281,for tonight crucial level in eurusd is 13150 if this gives way we are on our way to 13000 and then look out below from there usd,0
282,looks like a head and shoulders pattern forming in eurusd,0
283,eurjpy and eurusd are looking to breakout im long both crosses,0
284,long eurgbp at 08375 and long eurusd,0
285,i looks like we gonna go up long eurusd and long audusd,0
286,usd short on the 30ema cross is up about 50 pips and still rolling  ,0
287,trending lower on the day looks like lunchtime in us and eurusd may be able to keep lid on indexes but have to wait and see,0
288,i see a possible bear wave cycle that collabs my low and when we come in may be about a 70 to 100 pip drop  this is for the eurusd,0
289,usdjpy is trapped by option gamma in eurjpy and competing forces in usdjpy large eurjpy10300 option expiry is stillin play,0
290, eurusdaudusd gbpusd xauusd and ger30 what about you,0
291,eurusd and gold  bearish,0
292,usd stops below 13225 and again sub13200,0
293,well i am long again eurusd at 13255 stop 13235 target 133 and 134,0
294, usd has seen the biggest inflow gbp and eur the biggest outflows ,0
295,usd has seen the biggest inflow gbp and eur the biggest outflows,0
296, just looking at eurjpy eurusd and gbpusd  got a feeling i dont trade feelings but if it ties in with a set up  ,0
297, eurkes and usdkes rates,0
298,call update eurusd  book 50 profit at 13280 level and hold other 50 and trail your stop at your buying level which is 13210,0
299,cable above 158 and eurusd approaching 133,0
300, am using oandaits us regulated and has been around since 97i think have low spreadsusually 12 for eurusd in normal market,0
301,usd a sustained push ab 13284 would bring last weeks high at 13322 back into the picture and after completing a bull flag last week,0
302,eurusd slips back as postvote momentum wanes solid technical resistance at 13260 and sell orders just above there between 1326580 ar,0
303,since the eurusd failed to break out of those targets the only long that remains is same anchor new high and it comes in at 13065,0
304,this eurusd is counter trend going to be either choppy and really sloppy or really fast,0
305,trader and the retail guys will think the buy eurusd is easy trade sell for me,0
306,eurusd to 180  everything has been fixed and eu is great now  everyone get long,0
307,will tweet my trades to keep me in line and embarrass myself with bad trades takenonly trading the audusd gbpusd eurusd and eurjpy,0
308,the eurusd opens at 132 and the audusd at 10670 as broad risk aversion benefits the us dollar,0
309,the eurusd opens at 132 and the audusd at 10670 as broad risk aversion benefits the us dollar,0
310,the eurusd opens at 132 and the audusd at 10670 as broad risk aversion benefits the us dollar,0
311,the eurusd opens at 132 and the audusd at 10670 as broad risk aversion benefits the us dollar,0
312,audusd going down usdjpy going up eurchf peg and warnings cant let it go any worse than 120 it is a no brainer thats worrying ,0
313, dear usd more ups and downs over a greek lunch eur,0
314,i see data and my idea about eur usd in up is stong i see first days on next week and i take my position now my long trade gain 250 pips,0
315,profits for the week210 pips from long eurnzd and usdcad still long usdjpy and eurchf,0
316, v20 a gift to myself i guess i found the usdtoeur rate tempting to buy it and the quality is quite nice indeed,0
317,eurusd has broken 15m longs and is now in countertrend shorts until they fail down to 13065,0
318, jordan  good articleeurusd had given us such a golden opportunity to tradeyesterday i went long usdchf and it payed off,0
319,breaking newsthe new direction for the eurusd has been changed so euro is going down to 13100 13 and 127,0
320,will be funny weekendand funny monday of course usd,0
321,machine performance and human skill speed over time racing money over time eurusd should be calibrated in dollarsecs,0
322,eur usd released that one wave 15 on 15 min chart bearish wave looks between 3283 and 3154,0
323,audusd and eurusd well off lows of 12 hr ago  very resilient risk currencies,0
324,at exactly 3pm eurusd traded for 13170 and had already tested as low as 13156,0
325,instead of taking a term assurance of 15 years or so just buy the yuan andor sell the  against the ,0
326,eurusd  bids at  1316045 but stops noted sub 13145 and further stops sub 13120,0
327,5 posi still in play 2 eurusd shorts at ave be 2 eurchf longs ave up 29 pips and 1 audusd up 55 pips time for another merlot i think,0
328,usd  the break of the 10dma line in the 70s and stops have both aided the descent next leg of the selloff eyeing the 13150area,0
329,ewg out of german stocks with break from resistance and euro break in momentum dollar reversing from support  eurusd usdx uup,0
330,0400 eurusd short  132354131849 505 pipsand thats all she wrote pipmonkey rules,0
331,thank you eurusd while i slept  i woke to profit not bad for my 1st trade in almost 2 weeks of analysis study and slackstreetc ,0
332,eurusd it is friday and we are ranging and consolidating keep an eye on 15 minute chart  stay close to tops and bottoms for entries,0
333,db gt while the biases in the usd and the eur remains unchanged the jpy is being perceived as slightly undervalued against the usd  ,0
334,eurusd and gbpusd strong bullish signal go long,0
335,do you wonder why audusd is struggling while eurusd is higher take a look at euraud and you will see why,0
336,the eurusd pair is absolutely fascinating technically structurally and intellectually weekend of figuring that one out,0
337,another usd options expiry 1bln at 13300 monday and eur 500mln 133s tuesday,0
338,option maturity calendars show some good size eurusd strikes at 13250and 13300for todays 10am new york cut 14gmt,0
339, was sold across a broad front going into todays tokyo fix  and  demand noted jpy reverses postfix bid again,0
340,real money selling eurusd and japanese exporters are selling usdjpy again,0
341,the notes are posted in the chat also weve canceled the eurgbp trade and added an eurusd pending order details in the chat,0
342,oof eur usd back to above 130 and didnt even realise it greece playing nice,0
343,too tired to keep watch on my eurusd i have my sl and limit set so time to sleep,0
344, reaches 2month hi vs  and  after greek political leaders reach agreement on austerity measures needed to obtain a bailout ,0
345, you me both im heavy short on eur gbp and aud against usd been a tough start to year cant wait to see market kick arse,0
346,the nzd opens at 08345 usd 07730 aud 06275 eur 05270 gbp and 6480 jpy,0
347,the nzd opens at 08345 usd 07730 aud 06275 eur 05270 gbp and 6480 jpy,0
348,the nzd opens at 08345 usd 07730 aud 06275 eur 05270 gbp and 6480 jpy,0
349,the nzd opens at 08345 usd 07730 aud 06275 eur 05270 gbp and 6480 jpy,0
350,is eurusd collapsing the next 48 hrs greek is not the problem spain and france will hurt,0
351,great morning in the market we got some good pips on the eurusd were in the audusd now and in profit there as well,0
352,fx updates stopped on audusd long in low tick for 40 pips per unit still long eurusd any new highs today and i will book it,0
353,jpy pairs make short work of the stops usdjpy stops above 7750 and eurjpy stops above 10300 have all been triggered as firmer us yiel,0
354,thats me folks todays success has been from scalping usdeur and gld as im up i feel no shame,0
355,usd talk of a 13325 barrier being defended earlier and asian sellers wiith orders up to and inclusing,0
356,i kept the faithfor over two months and glad to anounceshortly am hitting the positive territory on eurusdamen,0
357,fixed income down eurusd up and stocks  futures higher as a greek deal looks ready official statement expected shortly,0
358,with both the boe and ecb holding their interest rates we expect bullish for gbpusd and eurusd to prevail,0
359,eurusd is now just under the 100day moving average and upside looks limited we expect the big picture downtrend to resume soon,0
360,10 year above 2 again and eurusd nicely above 132 resistance  mixed bag this morning for sure,0
361,forexlive eurusd at session lows as a likely greek delay looms and macro sellers pile into the eurgbp ahead of the ecb announcement h,0
362,heads up eurusd we are trading at interesting levels from a riskreward perspective support around 132 and aiming for 13350,0
363,gold hovers around 1730 after boesterling stronger against usd and eur,0
364,hi kumeil please contact me eurusd next supplyresistance area 13291 and after that is 13323 demandsupport 13256 and 13224,0
365,next equity crisis is being drawn in euraud 20 year chart others are usdjpy and eurnzd and eurcad and eurjpy 20 yr charts,0
366,db    against usd jpy eur perceived slightly overvalued usd and jpy are in any case seen as undervalued against all currencies ,0
367, sell eurusd and audaud now  there is 150 pips in it for youhave an awesome day,0
368,eurusd still looking bullish gbpusd nzdusd and audusd have strong bullish signals go long on these pairs,0
369,euro officials exiting greece from euro would collapse stocks bonds and currencies  be aware eurusd could fall to 115 moreover italy,0
370,small long eurusd at 13228 stop now at breakeven shorting usdcad long nzdusd on dips and small short position dow jones,0
371,heres my take usd is strong early in asia but later crazy bull gamblers come in and buy up all the eur and aud thats available,0
372,we got some entries on the eurusd and gbpusd this asian session so far both are running quite well ,0
373, deal eurusd will rally and then markets comes back to its senses and will start to drop looking to see multiyear low soon,0
374,despite the lack of progress on greece the eur has held onto recent gains and is trading over 13250 against the usd this morning,0
375,despite the lack of progress on greece the eur has held onto recent gains and is trading over 13250 against the usd this morning,0
376,despite the lack of progress on greece the eur has held onto recent gains and is trading over 13250 against the usd this morning,0
377,despite the lack of progress on greece the eur has held onto recent gains and is trading over 13250 against the usd this morning,0
378,couple of trades eurusd and eurusd todayended day  94pips,0
379,1800 call to france  the markets never sleep and apparently neither do my clients gbp looses to 1192 against eur  15824 usd,0
380,after a long dip and recovery eur usd  in london trading closes the day  32670,0
381,eurnzd targeting 15990 and 16180 usdjpy target open i think this has a huge upside to it and audusd 10700 or other wise its momento,0
382, i agree and cheaper too i love the easy currency conversion as well from cad usd or eur,0
383,three trades today dx long e7 short and shorted eurusd,0
384,with eurusd bouncing between 132450 and 132820 its making it very easy to decide when to choose entry and exit points today,0
385,spy 13718 may highs  watching dalla at support 15 min and eurusd  also amzn aapl goog ibm msft  and kanecos favorite brka,0
386,usd returns to the 13270s but offers are still seen into the 90s to keep the immediate tops and the 13300 barr intact in the sterm,0
387,eurusd returns to the 13270s but offers are still seen into the 90s to keep the immediate topside and the 13300 barriers intact in the st,0
388, trader  because eurgbp is so bid and eur is a bigger driver than usd today,0
389,eurchf and eurusd charts posted in london session,0
390,i just posted eurusd dangling on the 100 hour sma bouncing up and down off of it for the last few hours a break below should be off to ,0
391,usd holding above 13270 targets 13440 and probably 13895 before we top out again,0
392,for those who dont want to trade intraday and just too keep their money somewhere look  chf and jpy sl11990 and 7600 25xllev,0
393,eurusd teases us gt only 2 pips away from entry and now diving again,0
394,looking for a low in eurusd between 13240 and 13214 from where to project 118146 pips to the upside 5th wave,0
395,4 attempts at around 13285 in eurusd and 4 rejections bears still grappling hard hope they break their claws harder,0
396,eurusd gbpusd usdchf and usdjpy hiked last day as i noted earlier yesterday,0
397,eurusd and gbpusd both have trade signals suggesting possible reversals but neither has been confirmed yet,0
398,targettp on gbpusd for main trend has changed to 15984 eurusd has no current target of its own and so it will reach its tp once gu has,0
399,not been checking  rates in the past couple days and i have just been greeted with gt 102 jpy and gt 13 usd,0
400,  and helping eurusd higher,0
401,early strength in eurchf and weaker usd overall the pair inches towards 2week highs,0
402,eurusd testing yesterdays high 3267 just broke it 3280 expect some resistance and possible stops,0
403,usdjpy testing todays high eurusd gbpusd and audusd all starting to gain a little ground to the top side dowfutures 16,0
404,eurusdgbpusd pairs starting 2 form bullish continuation patterns for now upside risk is real and will be nearterm at this point,0
405,jpy above 7700 and jpy just about to breakoutclose above 10250 today may lead to higher pricetowards 10500,0
406,eurusd today range is 13135  13290 and i hope in us market will be break to 13300 at 1332513350 and up again for 1350013700,0
407,eurusd pin bar set up came off nicely for 150 pips likewise with the  and y  cha ching,0
408, hardest start to a year for me short audusd and gbpusd but just covered my eurusd until greece confirms its doa,0
409,very good eur usd go up and in this moment his value is on 13264 my position gain 300 pips and i move my stop loss on 13100 by by,0
410,sp500 gets closer to 786 retracement from 2007 peak and 2009 low  tries to go above its ema 20 days eurusd is above 65 days sma,0
411, do you accept payment in multiple currencies im needing usd cad gbp aud and eur,0
412,eurusd broke out and held 13250  as greek prepares final draft of debt plan  aussie hovering in 108 vicinity,0
413,channels on eurusd and gbpusd have broken but what about uchf testing those lows now if support holds a buy might entry might happen,0
414, prefer eurusd compared with audusd as euraud just reversed and can easily go back to 124au area,0
415,watch eurusd and eurjpy note 127r on ej and fig zone,0
416,sell eurusd when it gets to 135 and then go on a long holiday  when you get back in september itll be 110 tops  probably,0
417,eurusd finally getting paid for my eurusd bullish bias its now 1710 in the uk and i suspect that 13270 was todays high,0
418,eurusd short from 13260 gtgt lower lev this time and possible shot slightly over 133ers ,0
419,spread btpbund 361 itrx sovx we 318 and eurusd 13260  tin hat on for the mother of all ralliesor for the altscenario,0
420,my prediction for usdchf sideways consolidation watching the eurusd m30 and 1hr on usdchf indicating further drop imo,0
421, yep we closed out a 87 pip eurusd long today and reversed directions running very close to stops,0
422,eurusd could see13400sooner than later if the rally lasts and the gbpusd possibly seeing numbers int that16000rangeexpecting15900resis,0
423,eurusd likely to see a 127 breakout if it breaks 13235 area with some momentum nothing between here and 3280,0
424,perfect storm bonds crushed and eurusd break out risk on,0
425,eurusd rallies on fed zirp possible greek finality and imf pressure on china to contribute,0
426,if the eurusd can make it up to that 13230 area and stall out taking the short there would be a great spot did it last time it was up here,0
427,eurusd tests above 132 on renewed greek optimism big test for the spec shorts and whether their nerve will hold,0
428,orders to sell audusd and eurusd  both are trading in lock step right now sold the final half of my usdcad long for 40 pips  ,0
429,shorted gbpusd  15830 and eurusd  13180 with a stop just above the days high,0
430,eurusd now trying to make up and bounces triple ema at 13197it may be difficult daily close above 13187 as the initial break out bullish,0
431,and the eurusd up,0
432,eurusd at 13165 up 037 and usd dxy up 009 at 7914 up 01,0
433,european stocks indices and the eurusd rises as greece says to be working on a final bailout document eurusd 13150  dax 075 ,0
434,look for a break of 132 in eurusd but sellinto the stops and meltup sp 1348 huge,0
435,howells  we also need them to cross pivot line resistance eurusd 13095 and audusd 10767,0
436,both eurusd and gbpusd are right at breaking points let the market determine short term direction and lets ride the wave of momentum,0
437,eurusd still trapped between 13025 and 132looking at a mix daysr 2950298530253085313031653195321532303250,0
438,if the eurusd can break 13090 thinking about takin a shot shorting it  13080 and targeting 1300513025 area,0
439, getting a little bounce  in eurchf  12100 would be encouraging   and 132 eurusd as well,0
440,stockbattle  peer to peer stock and currency trading eur v usd anyone,0
441,booking profits 81 pips on eurusd core long and 20 pips on the added one may reenter later ,0
442,booking profits 81 pips on eurusd core long and 20 pips on the added one may reenter later ,0
443,usd there is a game of chicken between greece and the troika says societe generale,0
444,eurusd gbpusd and nzdusd strong bullish signal,0
445,eurusd gbpusd usdchf usdjpy and silver last days closing suggest continuation of prevailing trend,0
446,eurusd over the last few hours finds nearterm support  13090 lvl and  has been hitting shortterm resistance  13111lvl,0
447,morning fwendeurusd staying in  sideway consolidation below 13233 and intraday bias remain  neutral for the moment ,0
448,eurusd trading just above todays low and under 13100  the moment,0
449,shorting eurusd as single top forming and 12 day ema narrowing gap with 26 day ema,0
450,prepare your short on eurusd and your longs on usdchf tomorrow will be the day ,0
451,not much going on as indexes await more news from europegreece and more earnings reports the eurusd futures are off morning lows,0
452,majors as of 1955 gmt aud 41 cad 31 and eur 28 lead intraday declines vs usd as market attention shifts back to greece,0
453,eurusd trades in close proximity to its 50dma line of 13052 watch the eur and swiss franc for confirmation of a move higher or lower,0
454,sell and buy in eurusd total 51 pips,0
455, usd is getting scarily close to hyperinflation and the eur isnt looking too good either,0
456,  wont be long before the usd and the eur are dead currency,0
457, and  remain in sideways trend vs  on their hourly charts so the nearterm outlook remains consolidative in these markets,0
458,i have just taken full profits on both eurusd and gbpusd longs i am off to the gym i suggest you also get some exercise before tomorrow,0
459,and there it is eurusd breaks shorts up up and away,0
460,pelos necios se moja mucho looking for eurusd to 12 next month and near 108 this summer 2012,0
461,looking for eurusd to 12 next month and near 108 this summer 2012,0
462,eurusd shorts have to defend 131 now it breaks and its all over 13320 eventually,0
463,not near as much liquidity as normal trading in tight ranges and it looks like were running into stops and limits n the eurusd 13030 area,0
464, short positions in usdeur and chf against long positions in cadmxn cno and nok dominate the portfolio ,0
465, cad and usd have seen the biggest inflows eur the biggest outflow ,0
466,short positions in usdeur and chf against long positions in cadmxn cno and nok dominate the portfolio,0
467,cad and usd have seen the biggest inflows eur the biggest outflow,0
468,just shorted the eurusd gbpusd and audusd with tight stops,0
469,the eurusd gbpusd and audusd are all trading in a tight range over the last hour and a half dow futures are bouncing around18 to 27,0
470,short eurusd 13060 131 sl and 132 sl,0
471,good week alleurusd still trapped between 13025 and 132looking at a bullish day sr 295029853025price just tested308531303165,0
472, another long entry opportunity coming up on eurusd and gbpusd if these  candles close bullish in 10 min,0
473,eurusd 13041 first support from here is eyed at 13026 12931   12876 23 jan low 12839 19 jan low and 12711,0
474,if the eurusd breaks 3050 looks like we could take a short there and target 130003020 13035 area looks like we will hit support there,0
475,courting 13250 target on eurusd pair as it gets more and more unlikely that it is going to happen ,0
476,that scheme will be such a ball ache for ap we have the same problem with gbp usd and eur accounts,0
477,eurusd audusd nzdusd and gbpusd all still looking bearish just waiting to see it the prices hit the support line for all pairs,0
478,eurusd 130895 look for pop to this level at london open watch action eur following aud pops weaker and delayed headlinerumor risk,0
479,es wants 1335 eurusd breaks 131 and es yawns and hangs out at 1335 zzzzzzzzzzzzzzzzzzzzzzzzzzz,0
480,13083  now that the giants have won eur usd and greece tweets can resume,0
481, now that the giants have won eur usd and greece tweets can resume,0
482,i will take earnings on my shorts and then will sell eurusd again now will normalize,0
483, your indicator im eur usd  is brolen today were short and winning,0
484,eurusd on h1 chart the latest supporting bull trend line is at about 13035 and coincides near ema 20 days level   ,0
485,eurusd on daily chart the sma 65 days has resisted last week and the ema 20 is almost going sideways momentum faded   ,0
486,profits for the week  60 pips from long usdchf trade still long eurchf long usdjpy and short audusd,0
487, i have no idea why the yen keeps rising but the exchange rate seems to be the worse for usd and eur than other currencies,0
