author id,author username,is_verified_user,followers_count,following_count,tweet_count,listed_count,created_at,geo,id,lang,like_count,quote_count,reply_count,retweet_count,source,tweet
55827109,brokerz_bearish,False,2000,2739,12860,29,2012-04-17 14:03:14+00:00, ,192251879223345152,en,0,0,0,0,twitterfeed,"RT @RolfWolf1 - EUR/USD  Sharp Pullback Challenges Bearish Scenario: EUR/USD price action has been very bearish, and did break ... h..."
501249647,Ben_DD_FX,False,97,592,893,2,2012-04-17 13:45:58+00:00, ,192247533861486592,en,0,0,0,0,Twitter Web Client,Cad trade going great and Gold's diving down just a shame my buy order on Eur/Usd was half a pip off the low.... grrrr haha
323586923,LandmarkWGP,False,114,294,466,1,2012-04-17 13:37:49+00:00, ,192245484394524672,en,0,0,0,0,Twitter Web Client,EUR/USD: Comment: The pair has rebounded on its support and should reach its previous high.
348386707,Da_Dude7,False,214,496,2149,6,2012-04-17 12:24:28+00:00, ,192227022272081920,en,0,0,0,0,Twitter for iPhone,"Eur/usd and Gbp/usd both show a turn around, bearish sign go short"
407677912,MB_Consultant,False,276,887,269,5,2012-04-17 12:03:15+00:00, ,192221682411376642,en,0,0,0,0,Twitter Web Client,"The EUR/USD pair has been focusing on the Spanish debt markets lately, and with those ten years now offering more than 6%, concern is lik"
168080343,kingmark444,False,1611,803,6023,6,2012-04-17 11:50:34+00:00, ,192218494316707840,en,0,0,0,0,Twitter Web Client,will continue shorting eur/usd at  3150 and eur/jpy at 106.08
67013704,DanielHusseyJr,False,3735,199,59109,142,2012-04-17 11:46:42+00:00, ,192217517782073346,en,0,0,0,0,TweetDeck,Looking for 1380-90 on SPO's today (maybe higher) and 1.32+ on EUR/USD.... AUD/USD would be put back above 1.04
75432484,dineshydv,False,2683,156,56789,48,2012-04-17 11:34:42+00:00, ,192214499783229440,en,0,0,0,0,Mobile Web,Now everyone would be buying risk on strong earnings...it would be awesome to see EUR GBP AUD kicked down and USD JPY rising..
193680960,Caesar47,False,279,114,2224,7,2012-04-17 11:09:06+00:00, ,192208057839779841,en,0,0,0,0,Twitter Web Client,"EUR/USD, GBP/USD and USD/CAD all making new short term swing highs/low. Keeping and eye open for opportunities."
282540578,magnusliving,False,580,816,1646,9,2012-04-17 10:06:11+00:00, ,192192222156955648,en,0,0,0,0,Twitter Web Client,"Currently in Dow sell position, and have set sell order for EUR/USD at 1.3190"
63691059,AndyLangenkamp,False,1567,4260,35505,91,2012-04-17 09:56:03+00:00, ,192189672343089153,en,0,0,0,0,Twitter Web Client,"Reserve managers lose trust in #EUR.#USD will be in doldrums in not so distant future.Means #CAD,#AUD and eventually #RMB could bloom."
289745762,Eforexsignal,False,924,836,3597,9,2012-04-17 09:51:16+00:00, ,192188471354470400,en,0,0,0,0,Facebook,Today EUR/USD has support and resistance at 1.3082 and 1.3170
535616312,norigy75,False,17,26,236,0,2012-04-17 09:48:20+00:00, ,192187730954948608,en,0,0,0,0,TweetDeck,"Now what? Aussie flies again and RD H4 is in works. Take it? Hmmm, I would prefer EUR/AUD short. Remember, big USD news are in 2:45 hours"
66932703,FxSumrin,False,317,141,8177,8,2012-04-17 09:03:32+00:00, ,192176456812597248,en,0,0,0,0,Twitter Web Client,"Better than expected ZEW and CPI numbers., EUR/USD jumped UP. #in"
66932703,FxSumrin,False,317,141,8177,8,2012-04-17 08:59:02+00:00, ,192175324879003648,en,0,0,0,0,Twitter Web Client,"EUR/USD is a bit quiet, waiting for the ZEW and CPI news. #in"
426722004,RiskR3ward,False,13619,427,25703,309,2012-04-17 08:40:44+00:00, ,192170721311596545,en,0,0,0,0,Twitter Web Client,EUR/USD found support in 1.31 this morning and as long as we trade above this level price might extend higher to test the 1.32 high
42768891,FXPipHeist,False,120,179,949,4,2012-04-17 08:39:13+00:00, ,192170335662112768,en,0,0,0,0,TweetDeck,Mornin trader..stopped out eur/$ and gbp/usd -50 each..
279647987,AndyLeoni,False,289,957,595,5,2012-04-17 08:12:46+00:00, ,192163680488669186,en,0,0,2,0,Twitter Web Client,@petrussantara @dineshydv Morning and happy trading to you too mates & GL. Today I am long on AUD/USD and EUR/USD
97658395,easyfxteacher,False,2846,4070,33,10,2012-04-17 08:10:21+00:00, ,192163072281034753,en,1,0,0,2,Twitter Web Client,"EUR/USD is very up and down today, mainly on a down.....bit.ly/freport"
348386707,Da_Dude7,False,214,496,2149,6,2012-04-17 08:07:22+00:00, ,192162323178328064,en,0,0,0,0,Twitter for iPhone,Eur/usd and Gbp/usd both show strong bullish signal go long
383188100,FXspacetrader,False,903,302,39649,26,2012-04-17 07:46:43+00:00, ,192157127098380288,en,0,0,0,0,Twitter Web Client,eur/usd good base at 07.30 15 minute engulf candle  hour flag and once over 8am pivot 4hr 13104 filled in above space
23210457,melfann,False,398,246,17275,73,2012-04-17 07:32:19+00:00, ,192153502141779969,en,0,0,0,0,Echofon,Was at the clinic and was super surprised at the sudden strong movement up for the EUR/USD just within the last 30 min. Any news?
43975090,daytradersfx,False,3267,8,11500,55,2012-04-17 05:08:28+00:00, ,192117300290273280,en,0,0,0,0,Hootsuite,"The notes are posted in the chat, I outline entries on the #eur/usd and #gbp/usd and we're already in the #aud/usd. Log in for details #fx"
134318851,Lonejmartinez,False,132,566,4354,7,2012-04-17 04:10:06+00:00, ,192102610558398466,en,0,0,0,0,Twitter for Android,internal french bank run and #eur/usd. Couldn't even break 1.3150 lol @zerohedge @dailyfx I wonder who's next
172178937,SagyAnlin,False,91,494,3118,2,2012-04-17 03:13:35+00:00, ,192088388042629120,en,0,0,0,0,fun.ly,EUR/USD momentum and price action forecast break of key support
172178937,SagyAnlin,False,91,494,3118,2,2012-04-17 00:11:01+00:00, ,192042445071065089,en,0,0,0,0,fun.ly,EUR/USD momentum and price action forecast break of key support
543812311,forexfishbowl,False,183,6,358,5,2012-04-17 00:07:42+00:00, ,192041608525512704,en,0,0,0,0,Twitter Web Client,"ForexPM updated: What do I make of the roller-coaster in the dollar, the EUR/USD's bounce, and tonight's aussie. Cue up the video!"
501249647,Ben_DD_FX,False,97,592,893,2,2012-04-16 21:59:23+00:00, ,192009317094932480,en,0,0,0,0,Twitter Web Client,"Rather annoyed by my misjudgement on Eur/Usd today if I had a only left it, live and learn always another day. but still good profit today"
37894813,irums,False,310,117,12577,15,2012-04-16 21:54:42+00:00, ,192008139367919616,en,0,0,2,0,Twitter Web Client,"@lyricaldubbz #eur/usd, is only goin up...1.33690 is next major resistance, and dats 200pips away, i wld reconsider dat short."
172178937,SagyAnlin,False,91,494,3118,2,2012-04-16 21:22:51+00:00, ,192000125810376705,en,0,0,0,0,fun.ly,EUR/USD momentum and price action forecast break of key support
28366310,DailyFXTeam,False,145948,63,381704,2827,2012-04-16 20:22:01+00:00, ,191984815371849729,en,0,0,0,0,Twitter Web Client,$EURUSD: EUR/USD consolidates gains and trades at 1.3138 last
542860335,HesamLamei,False,41,39,120,4,2012-04-16 18:24:36+00:00, ,191955264264601601,en,0,0,0,0,Twitter Web Client,"added more to my #EUR/USD this pop is a joke, this bird is going down to below $1.30. Also added to my #AUD/USD and #NZD/USD short."
172178937,SagyAnlin,False,91,494,3118,2,2012-04-16 18:11:46+00:00, ,191952038207307777,en,0,0,0,0,fun.ly,EUR/USD momentum and price action forecast break of key support
67013704,DanielHusseyJr,False,3735,199,59109,142,2012-04-16 18:06:24+00:00, ,191950684432764928,en,1,0,1,0,TweetDeck,"Taking a moment to asses my net risk but: LONG AUD/USD, AUD/JPY, SPO's, EUR/USD, and orders to buy USD/JPY (will likely cancel these)"
282136529,zhanusic,False,2563,2371,39807,21,2012-04-16 17:46:00+00:00, ,191945554345988096,en,0,0,0,0,twitterfeed,"Weekly Summary on USD, EUR, GBP, JPY, AUD, CAD, MXN and RMB"
170707174,DCBorthwick,False,11598,925,56832,271,2012-04-16 17:40:39+00:00, ,191944207789862912,en,0,0,1,0,TweetDeck,EUR/USD... In battle of Central Bank Bids with no leverage and 50yr time horizon agst short term Spec leverage offers... CB's will win.
435609120,LuigiBissatini,False,42,0,2251,2,2012-04-16 17:26:09+00:00, ,191940556778246144,en,0,0,0,0,Twitter Web Client,"1,3103 and 1,3129 fib levels from where look for another low in EUR/USD below 1,2994$ and possibly above 1,2950$"
220660397,SSLFXGURU,False,221,8,4003,13,2012-04-16 17:22:38+00:00, ,191939670123356160,en,0,0,0,0,Facebook,EUR/USD remains on the downside and current fall should target 100% projection of 1.3385 to 1.3033
67013704,DanielHusseyJr,False,3735,199,59109,142,2012-04-16 17:11:18+00:00, ,191936821452750848,en,0,0,0,0,TweetDeck,"Need to see the EUR/USD above 1.3130 from here, and then eventually above 1.3260 #GetYourSeatbeltsFastened"
171997888,YoungWallSt,False,866,316,11953,55,2012-04-16 17:10:02+00:00, ,191936500492021760,en,0,0,0,0,Twitter Web Client,Added to AUD/USD and EUR/USD shorts for a drop lower where I will cover 2/3 pos on each..
33457888,anyoption,False,6069,618,48061,78,2012-04-16 17:09:21+00:00, ,191936328823353344,en,0,0,0,0,twitterfeed,PIERRE Y: I bought a €25 PUT binary option on EUR/USD at 16.04.12 08:20 and took €42 40 minutes later
37894813,irums,False,310,117,12577,15,2012-04-16 16:53:58+00:00, ,191932456176336896,en,0,0,2,0,Twitter Web Client,"@lyricaldubbz if u look at the daily #eur/usd, its a buy and hold."
37894813,irums,False,310,117,12577,15,2012-04-16 16:53:27+00:00, ,191932327125975040,en,0,0,0,0,Twitter Web Client,"@lyricaldubbz , heres a spooky fact, #eur/usd, found support at dis exact point. 16th feb, 15th march, and look at d date today"
542860335,HesamLamei,False,41,39,120,4,2012-04-16 16:09:18+00:00, ,191921216091729920,en,0,0,0,0,Twitter Web Client,"Its time to sell #EUR/USD, I am selling one lot at $1.3072. Will add more if it goes up. Stop loss $1.33 and take profit at $1.29."
33457888,anyoption,False,6069,618,48061,78,2012-04-16 16:06:21+00:00, ,191920474354233344,en,0,0,0,0,twitterfeed,Waldemar E: I bought a €50 PUT binary option on EUR/USD at 16.04.12 17:01 and took €85 59 minutes later
279647987,AndyLeoni,False,289,957,595,5,2012-04-16 15:46:03+00:00, ,191915364970541058,en,0,0,1,0,Twitter Web Client,@petrussantara EUR and GBP goivng up but AUD not moving. Do you know why? Fortunately I am long on GBP/USD as well
83752426,Forextradingevo,False,1004,1587,783,16,2012-04-16 15:27:32+00:00, ,191910707112062976,en,1,0,0,0,Facebook,Today Signal : Sell EUR/USD at 1.3105 target 1.3020 and stop loss 1.3135
83752426,Forextradingevo,False,1004,1587,783,16,2012-04-16 15:20:57+00:00, ,191909047874756609,en,0,0,0,0,Facebook,Today Signal : Sell EUR/USD at 1.3120 target 1.3020 and stop loss 1.3135
255945982,mnukf,False,47,82,612,0,2012-04-16 14:54:15+00:00, ,191902331242156032,en,0,0,0,0,Twitter Web Client,@DanielHusseyJr we are long on eur/usd from 1.3034 isnt? and what is the target & stop
54325541,FXSavior,False,49,5,519,3,2012-04-16 14:31:35+00:00, ,191896625566846976,en,0,0,0,0,Facebook,"Just took the NZD/JPY off also. Took 155 in that one.
Still in the EUR/USD short, and the EUR/JPY short."
14150892,DH_12,False,88,21,6853,2,2012-04-16 13:52:40+00:00, ,191886831938306048,en,0,0,0,0,Twitter Web Client,@CVecchioFX 4 hour rsi and macd divergence on the Eur/usd and usd index charts argues for near term upside in the eur
48545918,Global4ex,False,334,401,3288,7,2012-04-16 13:46:00+00:00, ,191885154900385792,en,0,0,0,0,TweetDeck,"RT @Trader_Dante: HeHeHe, Now you know ==&gt;Don't forget 1.3150, 1.3200, 1.3250 and 1.3300 today in EUR/USD"
156058889,Trader_Dante,False,127282,0,59674,2449,2012-04-16 13:44:47+00:00, ,191884850125488133,en,0,0,3,0,TweetDeck,"Don't forget 1.3150, 1.3200, 1.3250 and 1.3300 today in EUR/USD"
156058889,Trader_Dante,False,127282,0,59674,2449,2012-04-16 13:43:24+00:00, ,191884498969960449,en,1,0,4,1,TweetDeck,It's 2.42pm. The EUR/USD is at 1.3054. We rallied right off 1.3000 and remember that 1.3100 is above
171997888,YoungWallSt,False,866,316,11953,55,2012-04-16 13:20:46+00:00, ,191878806087282688,en,0,0,0,0,Twitter Web Client,Still short AUD/USD and EUR/USD stops lowered 50 pips below break even price. I dont think I will touch $ES_F today... (cont'd)
33457888,anyoption,False,6069,618,48061,78,2012-04-16 13:07:40+00:00, ,191875505581080578,en,0,0,0,0,twitterfeed,Ahmet G: I bought a 100TL CALL binary option on EUR/USD at 16.04.12 15:37 and took 170TL 23 minutes later
127835834,pipaccumulator,False,3443,82,11889,47,2012-04-16 12:27:15+00:00, ,191865337770283008,en,0,0,0,0,Twitter Web Client,Back after 3 weeks away. Short EUR/USD from 1.3019. Stop at 1.3070 and looking for a breakdown well below 1.2970 (last nights lows) #EUR/USD
49420421,kaeppeli,False,121,166,825,8,2012-04-16 12:00:56+00:00, ,191858712879702016,en,0,0,0,0,Twitter Web Client,EUR/USD Short Entry Target 1.3140-60. Targeting 1.2980 and lower. Stopp above 1.3385. Entered 1.3140
193680960,Caesar47,False,279,114,2224,7,2012-04-16 11:18:50+00:00, ,191848116973084672,en,0,0,0,0,Twitter Web Client,"Long AUD EUR and CAD against USD, and a small Gold long as well."
252571367,rioseco751,False,715,0,14046,34,2012-04-16 10:52:26+00:00, ,191841474231545856,en,0,0,0,0,Twitter Web Client,pending eur/usd short and usd/chf long. will see. still like usd/cad
252571367,rioseco751,False,715,0,14046,34,2012-04-16 10:50:12+00:00, ,191840912031219712,en,0,0,0,0,Twitter Web Client,pending short eur/usd. we still think is going to go a little more up. will see was going on in the open NY and the close from UK
33457888,anyoption,False,6069,618,48061,78,2012-04-16 10:05:43+00:00, ,191829718272720896,en,0,0,0,0,twitterfeed,Ahmet G: I bought a 145TL CALL binary option on EUR/USD at 16.04.12 12:59 and took 159TL 2 minutes later
538860524,djfutures,False,3,7,25,0,2012-04-16 09:59:13+00:00, ,191828082456403968,en,0,0,0,0,Twitter Web Client,Have small long in eur/jpy @ 10510 and gbp/usd @15838
103608510,MrBHogan,False,547,545,8215,9,2012-04-16 09:36:41+00:00, ,191822412352995330,en,0,0,0,0,Twitter Web Client,Euro news just gets worse and worse...#spain  #greece  #euromare  Parity beckons with eur/usd   maybe not immediately but it'll get there!
18005515,GSPBryan,False,1416,2161,50383,35,2012-04-16 08:48:38+00:00, ,191810317523755008,en,0,0,0,0,Industry-News,Industry-News: Scandi Rallies Should be Well Capped; Buy EUR/Scandi and USD/Scandi
357743066,TheManWiThePlan,False,54,305,1360,3,2012-04-16 08:25:53+00:00, ,191804595750711296,en,0,0,0,0,Twitter Web Client,i have no doubt eur/usd is about to run higher after holding 3000 and making higher low #50pips
91068722,iChatMac,False,594,2211,11556,10,2012-04-16 08:21:46+00:00, ,191803556272156673,en,0,0,0,0,Twitter for iPhone,"RT “@gpolitica: #Japan : #JPY is outperforming #EUR , #USD and #AUD. Clear evidence of risk aversion. Difficult to reverse s/t”"
348386707,Da_Dude7,False,214,496,2149,6,2012-04-16 08:14:39+00:00, ,191801766378078208,en,0,0,0,0,Twitter for iPhone,Eur/usd and Gbp/usd both have strong bearish signal
403575801,FBSForexIndo,False,1268,1551,8232,3,2012-04-16 07:49:23+00:00, ,191795408895348736,en,0,0,0,0,Typepad,EUR/USD momentum and price action forecast break of key support
282136529,zhanusic,False,2563,2371,39807,21,2012-04-16 07:12:42+00:00, ,191786178503122946,en,0,0,0,0,twitterfeed,EUR/USD Momentum and Price Action Forecast a Break of Key Support
55827109,brokerz_bearish,False,2000,2739,12860,29,2012-04-16 07:06:00+00:00, ,191784491088490496,en,0,0,0,0,twitterfeed,RT @CosmUnity - Today #EUR #Gold #Silver #Oil #Bearish and #USD #Bullish ?
55825364,brokerz_bullish,False,2453,3258,26157,37,2012-04-16 07:04:00+00:00, ,191783987755237377,en,0,0,0,0,twitterfeed,RT @CosmUnity - Today #EUR #Gold #Silver #Oil #Bearish and #USD #Bullish ?
252571367,rioseco751,False,715,0,14046,34,2012-04-16 07:00:38+00:00, ,191783139859890176,en,0,0,0,0,Twitter for iPad,"Pending short eur/usd and long usd /chf. We will wait for a bounce back around 1,3078 around 38% and 50% retracement from 1,32 to 1,30"
15295339,echelontrade,False,950,220,2201,5,2012-04-16 06:20:53+00:00, ,191773138697203712,en,0,0,0,0,MetroTwit,"To clarify my position, I'm very short EUR/USD and will hold to 1.2800 at least at this stage. Will sell more on rallies."
33457888,anyoption,False,6069,618,48061,78,2012-04-16 05:09:51+00:00, ,191755263009751040,en,0,0,0,0,twitterfeed,NATANAEL  F: I bought a $25 CALL binary option on EUR/USD at 15.04.12 22:46 and took $42 14 minutes later
240142656,PankilShah9,False,165,485,848,4,2012-04-16 02:39:02+00:00, ,191717305737154560,en,0,0,0,0,Twitter Web Client,USD CAD making a run  and so is AUD/USD ... closed GBP too early o well ... i am looking to add to EUR/AUD preety soon ...
15664977,Podcasting101,False,13149,14303,38207,285,2012-04-16 02:06:15+00:00, ,191709058510761987,en,0,0,0,0,TweetDeck,@soolebop wow just looked at a daily on the eur/usd and 3 months support here at 1.3   triple touch... if we loose 1.3  1.26 / new lows?
16195432,soolebop,False,11039,12031,102347,231,2012-04-16 01:18:54+00:00, ,191697140374978560,en,0,0,0,0,Twitter Web Client,ECB spoke of buying bonds and it's been $EUR/USD kryptonite since Friday
551934175,roberto_afx,False,235,118,2753,9,2012-04-15 16:43:23+00:00, ,191567407075168256,en,0,0,1,0,Twitter for Windows Phone,@Jammoum #EUR/USD Expected to be corrected as sso chart. A.R.S at US session maybe the hint. And your expectation? Thanks
321788199,stock_stream,False,7245,7893,1169,44,2012-04-15 02:36:08+00:00, ,191354190285639680,en,0,0,0,0,Twitter Web Client,"Profit for the week = 185 pips. (100 from USD/CHF, 75 from EUR/JPY and 10 from USD/JPY)"
208233696,fkntweetme,False,496,538,17126,21,2012-04-14 23:01:56+00:00, ,191300285241630720,en,0,0,1,0,Twitter Web Client,@paulbooma 55% EUR and 7% GBP so unless you were bullish on Europe you'd have to be bullish USD really?
489755665,TraderArctic,False,423,800,4954,22,2012-04-14 20:50:29+00:00, ,191267201330847745,en,0,0,0,0,Twitter Web Client,Great episode of #moneyinmotion. Entering the EUR USD and the USD CAD trades Sunday - @andrewbusch
435609120,LuigiBissatini,False,42,0,2251,2,2012-04-13 20:19:46+00:00, ,190897087100092417,en,0,0,0,0,Twitter Web Client,"Bearish engulfing candle on Nasdaq, DAX, CAC, EUR/USD, Gold and Silver (daily chart)"
65004270,TDuemesnil,False,23,140,181,2,2012-04-13 19:19:27+00:00, ,190881908203335680,en,0,0,1,0,Twitter Web Client,"@alanlepo @rwang0 And much cheaper as 1.67 EUR/litter in Germany. Which is around 2,17 USD/litter. It is fun here in Germany."
282136529,zhanusic,False,2563,2371,39807,21,2012-04-13 17:09:11+00:00, ,190849122339790850,en,0,0,0,0,twitterfeed,"Daily Summary on USD, EUR, JPY, GBP, AUD, CAD and NZD"
435609120,LuigiBissatini,False,42,0,2251,2,2012-04-13 16:29:52+00:00, ,190839229885054976,en,0,0,0,0,Twitter Web Client,"EUR/USD: below 1,3030$ area an AWFUL bearish Head&Shoulder could push prices towards 1,26$ and 1,22, only critical 1,2950 in between"
67013704,DanielHusseyJr,False,3735,199,59109,142,2012-04-13 15:56:53+00:00, ,190830928036237313,en,0,0,3,0,TweetDeck,UGGG... Even through all that... EUR/USD is still stuck between 1.3050 LONGS and the 1.3440 daily short...
339433762,forexmentor_lct,False,557,0,8870,11,2012-04-13 15:55:42+00:00, ,190830629259190273,en,0,0,0,0,Twitter Web Client,"ADR's have been updated/posted for Apr 13th, in EUR/USD and USD/CHF moving in stops and looking for 1st profit"
266137439,MadristaAP,False,31,33,1196,0,2012-04-13 15:09:27+00:00, ,190818990690549762,en,0,0,0,0,Twitter Web Client,@Vtechp @cato9lives My worst experience was for EUR/USD about year and a half ago . Put limit to short in before went to sleep...
357550024,marcg359,False,166,68,11423,9,2012-04-13 15:04:01+00:00, ,190817622848311297,en,0,0,0,0,Twitter Web Client,@Rilczyszyn isnt this funny how the eur/usd and the spx find support at the same time
67013704,DanielHusseyJr,False,3735,199,59109,142,2012-04-13 14:32:40+00:00, ,190809734931169280,en,0,0,0,0,TweetDeck,"EUR/USD Support 1.3050 -&gt; would be a another test of the daily long, and NOT a good loo!"
63691059,AndyLangenkamp,False,1567,4260,35505,91,2012-04-13 14:22:36+00:00, ,190807201986777091,en,0,0,0,0,Twitter Web Client,Markets nervous again.#Spain is in their crosshairs.Small bit of worrisome news could be enough to drive #stocks and #EUR/USD down.
38402800,Scofield_Fx,False,1861,2030,57200,68,2012-04-13 14:14:01+00:00, ,190805041383354368,en,0,0,1,0,TweetDeck,@echecetmat and EUR/USD has just Tank
252571367,rioseco751,False,715,0,14046,34,2012-04-13 13:57:24+00:00, ,190800861327396864,en,0,0,0,0,Twitter Web Client,"big number here 1,3100 eur/usd ( same 0,9174 if we break and close above this number i will be very bullish for the usd/chf and bearish eur"
104472490,jwholl,False,1755,3511,7336,25,2012-04-13 13:53:10+00:00, ,190799794472628224,en,0,0,0,0,Twitter Web Client,Time and tide waits on nothing.  Not even EUR/USD$.
151848500,TomMcForex,False,1526,277,13727,48,2012-04-13 13:30:42+00:00, ,190794140693446657,en,0,0,0,0,TweetDeck,"@Pipstealer_ On eur/usd, aud/usd and gbp/usd yes it should only be used with the trend determined by 10day SMA on daily chart however....."
357550024,marcg359,False,166,68,11423,9,2012-04-13 12:17:43+00:00, ,190775773760720896,en,0,0,1,0,Twitter Web Client,"@Rilczyszyn gm rich, last night after the china # i shorted eur/usd again at 1.3172  stop @ 1.323 and bought usd/mxn @ 13.05 stop @ 12.95"
20011326,ToddGordonTA,False,26109,851,18147,687,2012-04-13 12:15:27+00:00, ,190775201720578048,en,0,0,2,0,TweetDeck,"What a week, traders.  Few more gray hairs after this one .  Carrying EUR/AUD, EUR/GBP and USD/SGD this week.  What a street fight..."
67013704,DanielHusseyJr,False,3735,199,59109,142,2012-04-13 11:37:15+00:00, ,190765587817955328,en,0,0,0,0,TweetDeck,EUR/USD clears 1.3185 and we technically confirm the short term target 1.3240
426722004,RiskR3ward,False,13619,427,25703,309,2012-04-13 07:54:58+00:00, ,190709649262120960,en,0,0,1,1,Twitter Web Client,EUR/USD is correcting part of yesterday's gains and a drop to 1.3125 appears to be on the cards
251631320,bagi0009,False,127,119,3621,7,2012-04-13 07:04:21+00:00, ,190696911823581184,en,0,0,0,0,Twitter Web Client,"Eur usd tested at 200 sma on 4 hr chart and tested Fibo 50% line(1.3380to1.3030), if it will go down, my first target around 1.3115, BEARISH"
171997888,YoungWallSt,False,866,316,11953,55,2012-04-13 02:37:31+00:00, ,190629760324485121,en,0,0,0,0,Twitter for iPhone,Filled short EUR/USD still short AUD/USD USD/CAD And $ES_F
67013704,DanielHusseyJr,False,3735,199,59109,142,2012-04-13 02:14:49+00:00, ,190624049771196416,en,0,0,0,0,TweetDeck,"The CORE EUR/USD long from 1.3075 -&gt; stop to 1.3100, and TARGET is 1.3680"
158840198,DossInvestments,False,37,44,708,0,2012-04-12 20:11:42+00:00, ,190532666586710016,en,0,0,0,0,Twitter Web Client,Took profits on those EUR/USD and JPY/USD scalps - cheers to another good trading day.
313948924,gfsgroupusa,False,20,31,1392,0,2012-04-12 18:50:51+00:00, ,190512322098364416,en,0,0,0,0,Twitter Web Client,"Perfect trade EUR/USD today, we stopped out on short GBP/USD +1 pip. Only gains today!!!, Now shorting and holding from 1.3202"
170707174,DCBorthwick,False,11598,925,56832,271,2012-04-12 18:21:51+00:00, ,190505023434788864,en,0,0,1,0,TweetDeck,"EUR/USD: FED'S Dovely, Yellen combined with Stronger AUD Jobs, Larger China Loans and rumors of higher China GDP powering EUR/USD higher."
37894813,irums,False,310,117,12577,15,2012-04-12 17:16:25+00:00, ,190488555942985729,en,0,0,1,0,Twitter Web Client,"@lyricaldubbz ok, am out of all positions anyway, and eur/usd is too volatile for me, usd vs cad dukin it out, two almost equal economies"
400066174,TFMkts,False,25043,3291,47890,872,2012-04-12 16:14:06+00:00, ,190472874325327874,en,0,0,0,0,Twitter Web Client,@zerohedge did they do the entire sov bond vs cds analysis without once mentioning that the bonds are in EUR and the CDS is in USD?
282136529,zhanusic,False,2563,2371,39807,21,2012-04-12 16:10:08+00:00, ,190471875263074304,en,0,0,0,0,twitterfeed,"Daily Summary on USD, EUR, JPY, GBP, AUD, CAD and NZD"
29708582,FXDIRK,False,31585,3557,42532,504,2012-04-12 16:00:25+00:00, ,190469430524911618,en,0,0,0,0,Twitter Web Client,"took my 15 pips in EUR/USD @1,3169 ...and run...don´t like yoyo now #FXDIRK"
252571367,rioseco751,False,715,0,14046,34,2012-04-12 15:36:56+00:00, ,190463519177715713,en,0,0,0,0,Twitter for iPhone,Eur/usd is At MVA 50 H4 and MVA 200 H1. If We aré Below.We aré in a down trend. And We aré.
252571367,rioseco751,False,715,0,14046,34,2012-04-12 15:35:18+00:00, ,190463110526681088,en,0,0,0,0,Twitter for iPhone,"We aré At 0,9124. Its MVA 50  H4 and MVA 200 H1. To me tells me If We aré a bull trend or bear. And We still bull. Same with eur/usd short"
171997888,YoungWallSt,False,866,316,11953,55,2012-04-12 14:57:13+00:00, ,190453524168052738,en,0,0,0,0,Twitter Web Client,Its about that time.. You know what time.. To consider shorting AUD/USD and EUR/USD :)
146128105,Topstep,False,9330,101,32058,223,2012-04-12 14:09:45+00:00, ,190441577724915712,en,0,0,0,1,Hootsuite,$6E_F #EUR/USD continues its move to the upside along with stock futures and the energy complex; trades 1.3178 last
426722004,RiskR3ward,False,13619,427,25703,309,2012-04-12 12:58:30+00:00, ,190423648513949696,en,0,0,0,0,Twitter Web Client,@IVrzogic Maybe - but I think that EUR/USD just dropped a bit too much too fast and as we are just above 1.30 very few want to sell.
282136529,zhanusic,False,2563,2371,39807,21,2012-04-12 12:20:44+00:00, ,190414146049818624,en,0,0,0,0,twitterfeed,"EUR/USD, GBP/USD, USD/JPY and USD/CHF Daily Free Signals by WFX-Today"
435609120,LuigiBissatini,False,42,0,2251,2,2012-04-12 11:22:07+00:00, ,190399393038467073,en,0,0,0,0,Twitter Web Client,"had another test of 1,3155$ EUR/USD expect the break to come TO-DAY (and all hints are UP), expecially on the 4h setup"
254034317,omegaigf,False,272,138,18041,20,2012-04-12 09:13:04+00:00, ,190366918379716608,en,0,0,0,0,Twitter Web Client,#Eur/usd 1.3110 in wait and see mode ahead of Italian auction
