author id,author username,is_verified_user,followers_count,following_count,tweet_count,listed_count,created_at,geo,id,lang,like_count,quote_count,reply_count,retweet_count,source,tweet
456554737,CurrencyTredder,False,5,0,35,0,2012-01-08 23:49:01+00:00, ,156160509434003459,en,0,0,0,0,Twitter for iPad,"Markets moving again. Looking good for short $eur/usd, short $gbp/usd, and long $usd/chf trades. Profit targets within reach this week."
338993369,ThirdMoment,False,109,258,2111,20,2012-01-08 23:41:20+00:00, ,156158574882603008,en,0,0,0,0,Echofon,"Large spec position in /6E is getting very stretched, and EUR/USD is at solid support."
396339498,JohnPurdum,False,134,688,2408,6,2012-01-08 23:22:52+00:00, ,156153929523146752,en,0,0,1,0,Twitter Web Client,$EUR/USD is dropping and gaining speed.
171997888,YoungWallSt,False,867,315,11954,55,2012-01-08 22:08:49+00:00, ,156135293530013696,en,0,0,0,0,Twitter Web Client,"USD/CHF just wont quit, I cant wait for some decent headlines to short it and ride a short lived pop in EUR$.. It will happen, always does."
171997888,YoungWallSt,False,867,315,11954,55,2012-01-08 22:07:41+00:00, ,156135009328168960,en,0,0,0,0,Twitter Web Client,Short EUR/USD and AUD/USD - EUR gapped downto 1.2695 and has since gone sideways around 1.2710 #fx
191514098,altaybank,False,10028,11854,13975,45,2012-01-08 20:51:38+00:00, ,156115871029399552,en,0,0,0,0,Twitter Web Client,ForexLive Asian market open: EUR/USD opens lower The low in EUR/USD on Friday night was 1.2696 and we have opened below there this mornin
344794888,toptradingbours,False,556,0,1345,3,2012-01-08 19:11:13+00:00, ,156090597172719616,en,0,0,0,0,Twitter Web Client,"Expecting EUR/USD : an Up Day Monday and Up week with a 99
% apply for daily free trail........
TopSignals-BinaryOptions@hotmail.com"
344794888,toptradingbours,False,556,0,1345,3,2012-01-08 19:01:29+00:00, ,156088149473366016,en,0,0,0,0,Twitter Web Client,"Expecting EUR/USD : an Up Day Monday and Up week with a 99
% apply for daily free trail !!
TopSignals-BinaryOptions@hotmail.com"
260883187,Noowaada,False,537,131,197798,66,2012-01-08 17:40:25+00:00, ,156067747757961216,en,0,0,0,0,Twitter Web Client,"EUR Currency to Crash and Burn this year . depending when the Elites want to blow it up, which will be followed by a USD Default on its Debt"
457562970,KTAFX,False,1404,25,30462,20,2012-01-08 15:23:47+00:00, ,156033363570991104,en,0,0,1,0,Twitter Web Client,"Big opp's this week, support levels to be broken futher based on non-farm results. Specifically Cable, Eur/Usd, and Eur vs Aud, Yen, Gbp"
389119297,2ndwind2015,False,18,35,703,0,2012-01-08 01:32:16+00:00, ,155824105214586880,en,0,0,1,0,Twitter Web Client,":""The Gap "" the time between the end of New York Closing and New Zealand opening Bell . . The EUR/USD trending downward  during  :""the gap"""
95490234,salman_toor,False,196,267,5733,7,2012-01-07 20:27:12+00:00, ,155747334687432704,en,0,0,0,0,Mobile Web,and i am long #eur/usd.. Hahaha
43714931,kuralkan,False,1684,1316,3194,9,2012-01-07 09:52:03+00:00, ,155587491527798784,en,0,0,0,1,Twitter for iPad,"EUR/USD parity; today:1.27, next resistance on 1.24 and 1.18... Watch carefully."
648873,rem,False,48011,473,77157,3069,2012-01-07 09:50:44+00:00, ,155587161377353728,en,0,0,0,0,Twitter Web Client,"Comedy morning trying to be reimbursed GBP owed, after USD tax taken out and payment sent in EUR. Result: I'm short & annoyed #puntintended"
250049301,ThorstenBeeck,False,284,146,7952,58,2012-01-07 09:01:19+00:00, ,155574724116758528,en,0,0,2,0,Twitter Web Client,"@_joshnh The image looks cool. About the pricing...hmm...if the app isn't free you could add the price in USD, AUD, GBP and EUR."
441887409,musthofaa5,False,1,0,205,0,2012-01-07 05:52:51+00:00, ,155527296739057665,en,0,0,0,0,Twitter Web Client,"KES afternoon snapshot: 86.899\tto the USD, 113.37 to the EUR, 135.885 to the GBP, and 10.77 to the South African Rand. Losses all around."
321788199,stock_stream,False,7245,7893,1169,44,2012-01-07 04:46:10+00:00, ,155510512900251650,en,0,0,0,0,Twitter Web Client,Profit for this week = 250 pips generated by our #AUD/USD longs. Remaining longs are in #USD/JPY and #EUR/CHF. Good Luck trading next week.
128616566,lemasabachthani,False,15794,998,57615,683,2012-01-06 23:43:11+00:00, ,155434264152915968,en,0,0,0,3,TweetDeck,Is very singular (obvious) the correlation between EUR devaluation against USD and the subsequent action by FED with its QE. Long EUR on QE3
17049899,daytrend,False,13835,573,123790,516,2012-01-06 23:18:03+00:00, ,155427941386432512,en,0,0,0,0,TweetDeck,"@harmongreg me too.  I want S&P futes, CL, EUR/USD, and US Dollar Index... on a small old display... just about impossible."
456554737,CurrencyTredder,False,5,0,35,0,2012-01-06 23:00:51+00:00, ,155423612604649472,en,0,0,1,0,Twitter for iPhone,"End of jan week 1: still long $usd/chf, short $eur/usd, short $gbp/usd.. Next week: euro worries continue and US companies repatriate USDs."
89520657,MonsterFilmz,False,2233,462,7787,25,2012-01-06 22:18:32+00:00, ,155412963799465984,en,0,0,1,0,Dabr,regardless of what you may read the USD is strong against the EUR and the GBP. but foreign currency now!
345411398,Bonesy68,False,1619,3216,9557,12,2012-01-06 21:57:14+00:00, ,155407604120698880,en,0,0,0,0,Twitter Web Client,@Marc_Hav There is a nice hanging man on the Weekly AUS/USD maybe time to short Aus and poss long EUR/AUD around 1.24 Thoughts  ??
127759625,maxmckegg_TRL,False,1114,177,4725,75,2012-01-06 20:23:01+00:00, ,155383893963440128,en,0,0,0,0,TweetDeck,"EUR/USD is approaching my downside target. My latest forecasts for EUR, JPY,CHF, GBP, AUD and NZD are now available from TRL@clear.net.nz"
139501931,sizzletan25,False,12,32,20,0,2012-01-06 18:19:33+00:00, ,155352821028503552,en,0,0,0,0,Twitter Web Client,Is it the turning point to an upside for EUR/USD next week on the 9-13 Jan 2012 since reaching 1.2788 and down?Gold affected by U.S growth..
156592055,wirraltraders,False,930,508,6128,16,2012-01-06 17:53:19+00:00, ,155346218585821185,en,0,0,0,0,Twitter Web Client,Bought cable at ..26 and eur/usd at 27 for a limited buy
455511607,Kingofinvesting,False,0,0,68,0,2012-01-06 17:46:27+00:00, ,155344492147392512,en,0,0,0,0,Twitter Web Client,"@NiceTrade  there should be friday selling so you should be right and the uup keeps increasing because of the EUR/USD ,"
103588864,TedYokohama,False,3461,3066,114768,70,2012-01-06 17:02:22+00:00, ,155333397605126144,en,0,0,0,0,Twitter Web Client,USD/JPY trading at 77.067 and Eur/JPY at 98/033. Euro is expected to plunge to the level of 88 or close to it.
456554737,CurrencyTredder,False,5,0,35,0,2012-01-06 16:57:26+00:00, ,155332154111434752,en,0,0,0,0,Twitter for iPhone,Just took some profits on the $eur/usd and $gbp/usd in anticipation of others doing same at end of week. Euro has very high short interest.
404137063,ProvidePay,False,21,112,20767,0,2012-01-06 16:07:07+00:00, ,155319493273456641,en,0,0,0,0,dlvr.it,Market talk of option interest and buyers at 1.2700 in EUR/USD - unconfirmed
271399768,BMFNNews,False,1477,1524,99495,39,2012-01-06 16:07:06+00:00, ,155319489309847552,en,0,0,0,0,dlvr.it,Market talk of option interest and buyers at 1.2700 in EUR/USD - unconfirmed
42589787,Newsquawk,False,115924,305,118644,4021,2012-01-06 15:56:27+00:00, ,155316807861932032,en,0,0,0,1,StockTwits Web,Market talk of option interest and buyers at 1.2700 in EUR/USD - unconfirmed $$
171997888,YoungWallSt,False,867,315,11954,55,2012-01-06 15:55:14+00:00, ,155316502810210304,en,0,0,0,0,Twitter Web Client,Come on EUR/USD rip 5 pips and fill my sells......... #YouCanDoIt
40851155,chartingtoday,False,188,1,2956,7,2012-01-06 15:51:23+00:00, ,155315534743879680,en,0,0,0,0,Echofon,"EUR/USD hit 1.2696 and bouncing off it. I expect a renewed sell wave after a retrace, for the target 1.2685 either today or on monday"
171997888,YoungWallSt,False,867,315,11954,55,2012-01-06 15:39:18+00:00, ,155312491516276736,en,0,0,0,0,Twitter Web Client,Im calling for EUR/USD to print a low around 1.19 and rally back to just shy of 1.50 by years end.. Mark it.
171997888,YoungWallSt,False,867,315,11954,55,2012-01-06 15:25:57+00:00, ,155309133988511746,en,0,0,0,0,Twitter Web Client,Sell orders working on EUR/USD and AUD/USD #fx
364586188,Crazydadinc,False,53,128,4157,0,2012-01-06 15:15:02+00:00, ,155306387541471232,en,0,0,0,0,Twitter Web Client,@KeithMcCullough Crude oil sell signal sent...EUR/USD sell signal sent...and now $HYG sell signal.  That's 3...and counting...
424698883,Accountalent,False,274,207,1373,36,2012-01-06 14:58:32+00:00, ,155302231623737344,en,0,0,0,0,Twitter Web Client,"Europe in a deep recession, EUR weakening and USD strengthening are bad news for 4Q11 multinational earnings.  EUR/USD chart looks ugly."
146198538,mehmetturk75,False,1598,617,10380,32,2012-01-06 14:58:03+00:00, ,155302112857825280,en,0,0,0,0,Twitter Web Client,"Break-Out Bayesian model gets back into the short EUR/USD position at 1.2739, with initial take profit at 1.254 and stop-loss at 1.286"
171997888,YoungWallSt,False,867,315,11954,55,2012-01-06 14:56:02+00:00, ,155301602364882944,en,0,0,0,0,Twitter Web Client,Put a sell order in for EUR/USD.. Still thinking about my levels on GBP and AUD vs $.
18745322,Sqwii,False,15603,326,83109,420,2012-01-06 14:44:39+00:00, ,155298739790151681,en,0,0,0,0,TweetDeck,EUR/USD 1.24-1.25 coming and possible below 1.2 near future
171997888,YoungWallSt,False,867,315,11954,55,2012-01-06 14:33:41+00:00, ,155295978843418624,en,0,0,0,0,Twitter Web Client,"Have an order to cover the other half of my short EUR/USD at the LOD.. If we breach, will short large lots for a swing trade and cover @ S/P"
51877816,weizhentang,False,1429,2219,10886,23,2012-01-06 14:17:38+00:00, ,155291941016309762,en,0,0,1,0,LinkedIn,"Investors and traders alike selling eur/usd and european currencies and bank stocks, buy usd and US Stocks"
171997888,YoungWallSt,False,867,315,11954,55,2012-01-06 14:14:23+00:00, ,155291123613581312,en,0,0,0,0,Twitter Web Client,Good morning traders.. Covered GBP/USD AUD/USD and USD/JPY for a profit of +125 pips.. Still long USD/CAD and short EUR/USD #fx
83572407,Madicon1978,False,10,45,63,0,2012-01-06 14:02:30+00:00, ,155288132491808769,en,0,0,0,0,Twitter Web Client,"@JoelKruger could see a turn soon if AUD/USD breaks 1,02 and with EUR/USD oversold?"
155668062,PaoloTheSailor,False,4541,3797,1079,30,2012-01-06 13:58:11+00:00, ,155287045282074624,en,0,0,0,0,Twitter for BlackBerry®,The parity is approaching faster and faster #Eur/Usd
183992358,fxgai,False,459,2725,8172,15,2012-01-06 13:47:33+00:00, ,155284369597145088,en,0,0,0,0,Twitter Web Client,EUR/USD and Cable getting some reprieve now... how far will it go?
178478347,mileslang,False,347,70,1944,27,2012-01-06 13:40:08+00:00, ,155282504071380992,en,0,0,0,0,TweetDeck,EUR/USD falling in earnest now. 1.2738 and counting. USD being bought on back of payrolls data.
183992358,fxgai,False,459,2725,8172,15,2012-01-06 13:22:28+00:00, ,155278058822176769,en,0,0,0,0,Twitter Web Client,"I presume EUR will be sold on a good result, and perhaps shorts will start cover on a USD negative (poor NFP) result."
395760689,1stLtNickJames,False,14,18,690,0,2012-01-06 13:19:50+00:00, ,155277395123908608,en,0,0,0,0,Twitter Web Client,"eur/usd is going 2 need 2 break 1.2750 for it 2continue going any further, gonna sit back and see what the market wants 2 do with the report"
456554737,CurrencyTredder,False,5,0,35,0,2012-01-06 11:58:36+00:00, ,155256952102989825,en,0,0,0,0,Twitter for iPhone,Unemployment rate and change at 8:30. Big day for euro and dollar. Eur/usd target at 1.2650.
29708582,FXDIRK,False,31585,3557,42550,504,2012-01-06 10:46:41+00:00, ,155238853878362112,en,0,0,0,0,Twitter Web Client,"all positions still in progress-EUR/JPY and EUR/GBP under water, but lev is ok to give them a boost / EUR/USD kicks ass right now .sweating!"
56273384,sQuareindia,False,838,4,1468,3,2012-01-06 07:49:47+00:00, ,155194334734585856,en,0,0,0,0,Ping.fm,"EUR/USD Technical:
Pivot: 1.2855
Trend: Pair stands below its resistance and remains under pressure.
ST: Consolidation
MT: Bearish"
102283928,Lukas1336,False,46,104,539,0,2012-01-06 07:29:20+00:00, ,155189186633273344,en,0,0,0,0,Twitter for Android,@JoelKruger what is your prediction for the us results and how do you plan to trade Eur/usd if I may ask.
440203286,ProsperityFXPro,False,459,0,5289,13,2012-01-06 07:28:44+00:00, ,155189037953581058,en,0,0,2,0,Twitter Web Client,"Its is NFP Friday, and the end of the first trading week of 2012. We anticipate short entries on EUR/USD and GBP/USD. Now we have to wait..."
451367425,KyriakidisIsaak,False,7,12,20,0,2012-01-06 06:37:01+00:00, ,155176023363817472,en,0,0,0,0,Twitter Web Client,"Hello and good morning
Today I believe that we will see a short correction for the eur against the usd but with a strong res level at 1.2880"
226457244,kisstvnews,False,83058,406,5753,155,2012-01-06 06:09:38+00:00, ,155169130025201665,en,0,0,1,0,Hootsuite,"KES Morning snapshot: 87 to the USD, 111.17 to the EUR, 134.64 to the GBP and 10.64 to the Rand."
131882691,PrJACQUES,False,53,7,166,0,2012-01-06 06:07:08+00:00, ,155168500661485568,en,0,0,0,0,Twitter Web Client,Keep on shorting the EUR vs USD and Sterling
356203759,zedooman,False,259,287,5697,2,2012-01-06 05:06:09+00:00, ,155153156890836992,en,0,0,0,0,Twitter Web Client,EUR/USD Is Falling To 1.2736 ... And God Knows Better Than Me
389119297,2ndwind2015,False,18,35,703,0,2012-01-06 04:37:17+00:00, ,155145891525820416,en,0,0,0,0,Twitter Web Client,"EUR/USD in a classic whipsaw pattern since the close of the London markets
 fluctuating between 1.27800  and 1.27900"
96377900,thecollecktor,False,98,174,3713,0,2012-01-06 03:07:59+00:00, ,155123416503042048,en,0,0,0,0,Twitter Web Client,"My position of EUR/USD -400000 and cash of $47,000 allowed me to hold to protect my position without a loss as position moved w/my decision"
96377900,thecollecktor,False,98,174,3713,0,2012-01-06 02:44:18+00:00, ,155117456053125120,en,0,0,0,0,Twitter Web Client,Knowing there is  a range for each currency determined my sell position of EUR/USD would recover and held in spite of  possible greater loss
389119297,2ndwind2015,False,18,35,703,0,2012-01-06 01:15:10+00:00, ,155095024726585344,en,0,0,0,0,Twitter Web Client,EUR/USD oscillating  between 1.2782 and 1.2799  in the Sydney and now the Tokyo sessions . . . is there a breakout on the horizon ?
196351917,MaysReport,False,1142,387,17421,50,2012-01-05 23:22:11+00:00, ,155066591518797824,en,0,0,0,0,TweetDeck,Strong correlations between the EUR/USD and Fertilizer companies still exist.  r($MOS)=0.75; r($POT)=0.76; r($CF)=0.70; r($IPI)=0.73.
196351917,MaysReport,False,1142,387,17421,50,2012-01-05 23:19:04+00:00, ,155065809776017409,en,0,0,0,0,TweetDeck,Correlations between the EUR/USD and grains have been broken. Most recent 45 trading days r(wheat)=0.07;r(soybeans)=0.19; r(Corn)=0.30
42409791,windsorbrokers,False,6202,934,65847,90,2012-01-05 22:34:31+00:00, ,155054599160610816,en,0,0,0,0,WinSocial,EUR/USD overnight flows: Pulled bids and downside cover $$
331607249,Ryknow16,False,629,98,18284,29,2012-01-05 22:01:21+00:00, ,155046250528518144,en,0,0,0,0,Twitter Web Client,"@CNBCFastMoney -- Dennis Gartman is on!! He is long, short, and neutral on Gold all at once in EUR, USD, and CAD terms! Amazing! #assclown"
414903634,TraderHiebie,False,7,28,6,0,2012-01-05 21:23:33+00:00, ,155036737368887296,en,0,0,1,0,Twitter Web Client,Big divergence EUR/USD and SP500. AUSSIE and SP500 are on the same track. I wonder how long this divergence lasts...
127759625,maxmckegg_TRL,False,1114,177,4725,75,2012-01-05 21:06:18+00:00, ,155032395341496321,en,0,0,0,0,TweetDeck,"EUR/USD is approaching my downside target. My latest forecasts for EUR, JPY,CHF, GBP, AUD and NZD are now available from TRL@clear.net.nz"
249696950,ShifterBurei,False,144,173,54896,3,2012-01-05 20:51:21+00:00, ,155028635793895425,en,0,0,2,0,Twitter Web Client,"@TheDarkChaplain @SpaceDrakeCF ""available for purchase from Steam and GamersGate beginning on January 17th, 2012, for 25 USD/20 EUR/16 GBP"""
380269116,JuliesPatTips,False,746,1065,602,5,2012-01-05 19:12:25+00:00, ,155003736794742784,en,0,0,0,1,Twitter Web Client,"WTI Crude has gushed pips today, down then up in almost full circle (fairly typical). And EUR/USD hit 15 month lows taking out 2800."
380269116,JuliesPatTips,False,746,1065,602,5,2012-01-05 19:11:02+00:00, ,155003387816062976,en,0,0,0,1,Twitter Web Client,WTI Crude has gushed pips today down then up in almost full circle (fairly typical). And EUR/USD hit 15 month lows taking out 2800.
241738613,KingAbols,False,188,127,4128,9,2012-01-05 17:10:02+00:00, ,154972939777884161,en,0,0,0,0,Twitter Web Client,@CVecchioFX and what about eur/usd you are going long? ;)  Where should place s/l and t/p
171997888,YoungWallSt,False,867,315,11954,55,2012-01-05 16:51:29+00:00, ,154968271777574912,en,0,0,0,0,Twitter Web Client,"Now Im hoping I get filled on short GBP/USD and EUR/USD.. Remember #fx traders, stay nimble and take your profits!! #10percentrule"
20762756,CMCMarkets,False,28534,138,12799,421,2012-01-05 16:46:13+00:00, ,154966944871755776,en,0,0,0,0,Twitter Web Client,#EUR has had a torrid day trading sharply lower and trading against both #GBP and the #USD at levels not witnessed since September 2010
41133866,CMCMarketsIE,False,274,59,3036,15,2012-01-05 16:46:11+00:00, ,154966936923545600,en,0,0,0,0,Twitter Web Client,#EUR has had a torrid day trading sharply lower and trading against both #GBP and the #USD at levels not witnessed since September 2010
151848500,TomMcForex,False,1526,277,13727,48,2012-01-05 15:52:21+00:00, ,154953390911270913,en,0,0,0,0,TweetDeck,@tweeterTrades: Now Im short @ 1.2795 ! Just so ya know LOL #Eur/usd vTs 13 &gt;&gt; And i'm pleased to be on the same side of the market as you.
151848500,TomMcForex,False,1526,277,13727,48,2012-01-05 15:36:33+00:00, ,154949414186786816,en,0,0,0,0,TweetDeck,And again I am short eur/usd.  Another leg lower would do me nicely please.
423775991,Rescue4ce,False,64,69,24823,6,2012-01-05 15:21:50+00:00, ,154945708221411328,en,1,0,1,0,Seesmic,@NicTrades Euro still correlated with gold and i'm looking at eur/usd 1.2860 or above after European close. Apologize for my poor english.
443563656,Forexzing,False,106,231,149,0,2012-01-05 15:04:47+00:00, ,154941419147108352,en,0,0,0,0,Twitter Web Client,Gold should drop to 1530 and 1475 in extension. EUR/USD to weaken too.
94409368,CCofWaterloo,False,171,314,1510,3,2012-01-05 15:03:32+00:00, ,154941104091967489,en,0,0,0,0,Twitter Web Client,Canadian dollar is holding some strength as of 10am the Usd is selling at 1.0358 and EUR selling at 1.3537
171997888,YoungWallSt,False,867,315,11954,55,2012-01-05 14:24:37+00:00, ,154931308819259392,en,0,0,0,0,Twitter Web Client,Going fishing for value here.. Working orders to sell AUD/USD and EUR/USD.. #fx
432299307,ScottClarkson87,False,35,124,143,1,2012-01-05 14:16:07+00:00, ,154929169875210240,en,0,0,0,0,Twitter Web Client,"EUR/USD 1Hour, 30Min and 15Min Doji's"
67013704,DanielHusseyJr,False,3737,199,59119,142,2012-01-05 13:51:28+00:00, ,154922968626102272,en,0,0,0,0,TweetDeck,"EUR/USD can print below 1.2820, and we will move stops on short to BREAK EVEN"
145380594,Andres_vahopski,False,481,64,7030,24,2012-01-05 13:36:35+00:00, ,154919221682384897,en,0,0,0,0,Twitter Web Client,#EUR/USD pops lower as EUR/JPY finally erases option barriers at 98.50. 98.45 hit to allow EUR/USD to slip to new 2012 and near 16-Mth lows
282965018,gmohata,False,308,36,4730,8,2012-01-05 12:58:51+00:00, ,154909726310805504,en,0,0,1,0,Twitter Web Client,@EdMatts Risky - but thats what i said each time you sold EUR/CHF and USD/CHF .. and wont say risky again to you :)
68702219,trendrecogn,False,230,16,6295,14,2012-01-05 11:56:44+00:00, ,154894094588583936,en,0,0,0,0,Twitter Web Client,both #eur and #gbp resumed their declines vs #usd. the next supports are 1.2670 and 1.5260 respectively.
18378349,KeithMcCullough,False,219551,793,225980,3739,2012-01-05 10:27:36+00:00, ,154871664117694464,en,1,0,0,2,TweetDeck,"FX: 1.28-1.31 range to manage risk in the EUR/USD, rinse and repeat $UUP $FXE"
151848500,TomMcForex,False,1526,277,13727,48,2012-01-05 10:07:13+00:00, ,154866531740827648,en,0,0,0,0,TweetDeck,Eur/Usd looking for hold below 1.2850 and then run at 1.28.  Buckle up.
404137063,ProvidePay,False,21,112,20767,0,2012-01-05 09:40:53+00:00, ,154859907257081856,en,0,0,0,0,dlvr.it,USD index continues to strengthen on the back of persistent concerns over EU banks; EUR/USD and GBP/USD both on session lows
271399768,BMFNNews,False,1477,1524,99495,39,2012-01-05 09:40:52+00:00, ,154859902903390208,en,0,0,0,0,dlvr.it,USD index continues to strengthen on the back of persistent concerns over EU banks; EUR/USD and GBP/USD both on session lows
158840198,DossInvestments,False,37,44,708,0,2012-01-05 09:24:58+00:00, ,154855902283968512,en,0,0,0,0,Twitter Web Client,Closed EUR/USD short scalp at +10 (many took profit w/ the recent low hit and the next move may depend on the news of the day)sleep til then
40851155,chartingtoday,False,188,1,2956,7,2012-01-05 09:03:38+00:00, ,154850532249444352,en,0,0,0,0,Echofon,"EUR/USD is collapsing, and its a short on rallies for a 1.2840 target."
158840198,DossInvestments,False,37,44,708,0,2012-01-05 08:24:25+00:00, ,154840663744200704,en,0,0,0,0,Twitter Web Client,"After hitting resistance at 12935, I closed my EUR/USD long scalp of 12920 and am turning bearish for a short scalp"
39905164,only1naf,False,89,282,7479,3,2012-01-05 07:51:01+00:00, ,154832257935360000,en,0,0,0,0,Twitter for Android,"Jesus help us. RT @Ramah_Nyang: KES mid-Morning snapshot: 88.945 to the USD, 114.90 to the EUR, 138.665	to the GBP and 10.89 to the Rand."
41104026,Kamandeh_,False,1102,1455,32484,38,2012-01-05 07:21:51+00:00, ,154824917764935680,en,0,0,0,0,CitCuit,"RT @Ramah_Nyang: KES mid-Morning snapshot: 88.945 to the USD, 114.90 to the EUR, 138.665	to the GBP and 10.89 to the Rand."
212127385,Ramah_Nyang,False,221864,711,108635,297,2012-01-05 07:02:18+00:00, ,154819995543670784,en,0,0,3,3,Hootsuite,"KES mid-Morning snapshot: 88.945 to the USD, 114.90 to the EUR, 138.665	to the GBP and 10.89 to the Rand."
226457244,kisstvnews,False,83058,406,5753,155,2012-01-05 07:02:17+00:00, ,154819994029539328,en,0,0,1,3,Hootsuite,"KES mid-Morning snapshot: 88.945 to the USD, 114.90 to the EUR, 138.665	to the GBP and 10.89 to the Rand."
56273384,sQuareindia,False,838,4,1468,3,2012-01-05 06:45:42+00:00, ,154815819690414080,en,0,0,0,0,Ping.fm,"EUR/USD Technical:
Pivot: 1.3000
Trend: Pair remains under pressure and is challenging its support.
ST: Consolidation
MT: Bearish"
255263381,ailliwre,False,981,575,129401,22,2012-01-05 02:34:53+00:00, ,154752700179939328,en,0,0,2,0,Twitter Web Client,"@Rilczyszyn watching the eur/aud as well - that has been decimated and if that starts to unwind, that'll affect the aud/usd as well"
255263381,ailliwre,False,981,575,129401,22,2012-01-05 01:17:44+00:00, ,154733283991748609,en,0,0,0,0,Twitter for Android,@SellPuts 2 of 2 but selling now in eur/aud affects aud/usd and the unwind of the short eur/aud will also affect aud/usd-('risk on' pair)
409617637,Marketsire,False,9924,211,35524,288,2012-01-04 22:47:13+00:00, ,154695405685317633,en,0,0,0,0,Twitter Web Client,The Euro and the US Dollar are already down by more than 2.5% against the Australian Dollar since the start of 2012 #fx #eur #usd #aud
171997888,YoungWallSt,False,867,315,11954,55,2012-01-04 20:28:40+00:00, ,154660536909430784,en,0,0,0,0,Twitter Web Client,Recap: long usd/jpy short aud/usd gbp/usd.. working order to short eur/usd and buy usd/cad & usd/chf.. taking profits soon.. #riskmgmt #fx
105455733,BrynneKKelly,False,29342,2177,60080,832,2012-01-04 20:00:45+00:00, ,154653511546712064,en,0,0,1,0,Twitter Web Client,i am liking the disconnect between the eur/usd and ES.
363763442,SANA_English,False,20111,197,19511,725,2012-01-04 19:42:42+00:00, ,154648971611082752,en,0,0,0,1,Twitter Web Client,"SYP/USD opened the week at SYP 55.72 and closed at 55.89 (0.304% rise), SYP/EUR started off at 72.73 and closed at 73.04 (0.42% increase)"
158840198,DossInvestments,False,37,44,708,0,2012-01-04 17:21:09+00:00, ,154613347403317249,en,0,0,0,0,Twitter Web Client,Closing long position on EUR/USD and turning around for another short scalp along w/ the broader downtrend down to 12915
158840198,DossInvestments,False,37,44,708,0,2012-01-04 17:08:53+00:00, ,154610262492721153,en,0,0,0,0,Twitter Web Client,Long EUR/USD scalp is looking nice - going to take partial profits and keep a third of the position open for a potential hit 12955
339433762,forexmentor_lct,False,557,0,8870,11,2012-01-04 16:45:02+00:00, ,154604261332881408,en,0,0,0,0,Twitter Web Client,"you have at least 1st profit on EUR/USD and USD/CHF, might still be in EUR/JPY at ext.  Will put in wrap up what I was thinking today."
196351917,MaysReport,False,1142,387,17421,50,2012-01-04 16:36:54+00:00, ,154602211341635584,en,0,0,0,0,TweetDeck,"$$ The correlation between the EUR/USD and the S&P 500 in last 45 trading days is down to 0.08, meaning they are not correlated."
29708582,FXDIRK,False,31585,3557,42550,504,2012-01-04 15:37:08+00:00, ,154587172849192960,en,0,0,0,0,Twitter Web Client,"@fx_13 could give EUR/USD and other Eur-crosses a good bounce back &gt;&gt; fyi MIG told EUR/GBP may hit for 0,8140ies #FXDIRK"
196351917,MaysReport,False,1142,387,17421,50,2012-01-04 15:30:24+00:00, ,154585477377306624,en,0,0,0,0,TweetDeck,$CF up more than 2% while $MOS & and $POT down by more than 2%. Why? CF most correlated to corn/beans while MOS & POT correlated to EUR/USD
191514098,altaybank,False,10028,11854,13975,45,2012-01-04 15:23:06+00:00, ,154583638531506176,en,0,0,1,0,Twitter Web Client,"EUR/USD edging to fresh lows, vistis 1.2920 support Another round of euro weakness as equities extend their losses and oil loses some of"
