author id,author username,is_verified_user,followers_count,following_count,tweet_count,listed_count,created_at,geo,id,lang,like_count,quote_count,reply_count,retweet_count,source,tweet
549188699,RichiePoshMan,False,167,643,1956,2,2013-07-29 04:39:46+00:00, ,361707599642636288,en,0,0,0,0,Twitter for iPhone,Hoping the Eur/Usd hits the resistance level this week. That will be selling at 1.3370 and closing deal at 1.3300 or further at 1.3270.
278937347,mosesharding,False,5905,52,64084,127,2013-07-29 04:08:02+00:00, ,361699611439669248,en,0,0,0,0,Twitter Web Client,EUR/USD may not have steam to extend (or sustain) its strength beyond 1.3450; wud stay with set NT range and watch momentum at higher end
329787485,lynbeej,False,96,454,2922,1,2013-07-28 20:51:29+00:00, ,361589752337661952,en,0,0,0,0,Twitter for Android,@JBoorman check out @blakeyerian on stocktwits.... hes been saying go long: yen aud nzd ... and short: eur gbp usd cad  since thursday.
541793386,BrainsAllGone,False,710,17,1023,4,2013-07-28 17:27:31+00:00, ,361538421757444097,en,0,0,0,2,Twitter Web Client,"Wanna order our debut EP? 
Price with the shipping: 7 USD; 5 EUR; 5 GBP. Send your orders and any questions to brainsallgoneorders@gmail.com"
137303585,trejdevins,False,64,186,2592,4,2013-07-28 17:06:57+00:00, ,361533248154771459,en,0,0,0,0,Twitter Web Client,@FXCM EUR/USD loves 50s and 100s now more than ever.
89829140,phillbyrne,False,35,67,1301,3,2013-07-26 20:08:56+00:00, ,360854270083465216,en,0,0,0,0,Twitter for iPhone,"@Strangeways21 GFED me up, i will take USD, EUR GBP and CHF! Im glad we have @gemjuice  on board! SME. I hope all charges our?"
50360920,Yogi_Chan,False,12200,462,22663,443,2013-07-26 16:20:01+00:00, ,360796660860846082,en,0,0,0,0,Twitter Web Client,"EUR now flat vs USD at $1.3276 after Serbia, Slovenia and Czech Rep get the nod from ratings agencies"
