author id,author username,is_verified_user,followers_count,following_count,tweet_count,listed_count,created_at,geo,id,lang,like_count,quote_count,reply_count,retweet_count,source,tweet
256083531,gorasFX,False,90,652,805,7,2012-04-05 09:10:59+00:00, ,187829677254127616,en,0,0,1,0,Twitter Web Client,@TheSquareMile could I ask you what source you're using to see live chart with EUR/USD and euro bund overlay?
426722004,RiskR3ward,False,13619,427,25703,309,2012-04-05 08:57:04+00:00, ,187826176084033537,en,0,0,0,0,Twitter Web Client,AUD/USD has more downside than EUR/USD and is in a clear down trend on the daily time frame
75290848,I_M_A_Trader,False,3666,164,113321,189,2012-04-05 08:57:00+00:00, ,187826158795108353,en,0,0,0,1,Twitter Web Client,"I trades ftse, dax ,cac, nasdaq, eur/usd and aus/usd predominantly. I avg +200 points p/w ever since the service started , 18 months now."
414259284,Tickmill,False,34145,125,25673,162,2012-04-05 08:16:04+00:00, ,187815859102814208,en,0,0,0,0,Twitter Web Client,"#EUR/USD Searching further inspiration, with the long Easter break looming to limit volume and market is expected to remain thin today. #FX"
543329106,qtradinglog,False,5,12,73,0,2012-04-05 08:01:30+00:00, ,187812191087497216,en,0,0,0,0,Twitter Web Client,no significant eur / usd news today.. apparantly hoping for continuation of the trend and cascade
388934586,AbidexDBaddest,False,20,227,2903,0,2012-04-05 06:10:12+00:00, ,187784182943072256,en,0,0,0,0,Twitter for BlackBerry®,It's already 10 minutes past 6am London Time and price remains at a stand still 1.3150 Eur/Usd.
348386707,Da_Dude7,False,214,496,2149,6,2012-04-05 06:00:16+00:00, ,187781681221087232,en,0,0,0,0,Twitter for iPhone,Gbp/usd and eur/usd both show bullish signal go long
194062382,rosecroix18,False,65,189,443,0,2012-04-05 05:23:38+00:00, ,187772461054558208,en,0,0,0,0,Twitter for BlackBerry®,"If EUR USD stays below 1,3178 sees 1,3034 and 1,28"
543812311,forexfishbowl,False,183,6,358,5,2012-04-05 02:40:31+00:00, ,187731414689644545,en,0,0,0,0,Twitter Web Client,"ForexPM update now online. I discuss the aussie pairs I'm watching, the Dow, EUR/USD and explain ""one thing leads to another"" set ups"
42409791,windsorbrokers,False,6198,934,65818,90,2012-04-05 00:14:43+00:00, ,187694720703672320,en,0,0,0,0,WinSocial,"EURUSD is holding around 1.3140.  Support levels lie at 1.3130, 1.3100;  resistance levels lie at 1.3150, 1.3180 and 1.3210. $$ EUR FX USD"
170707174,DCBorthwick,False,11598,925,56832,271,2012-04-04 20:50:50+00:00, ,187643411812204544,en,0,0,0,0,Twitter for Android,"Buy The Dip, Fed cant afford to step away given looming US Fiscal issues and election. CB diversification cushions Eur/usd downside."
388934586,AbidexDBaddest,False,20,227,2903,0,2012-04-04 19:35:33+00:00, ,187624467567083521,en,0,0,0,0,Twitter for BlackBerry®,8:30pm GMT+1 Eur/Usd 1.3140 as events unfold in Italy and Spain.
434529720,OneGussmaster,False,22,70,1650,0,2012-04-04 18:51:28+00:00, ,187613373825941504,en,0,0,0,0,Twitter Web Client,After a while when the market tries to scare you develop a very thick skin staying short EUR/JPY and USD/JPY
43975090,daytradersfx,False,3267,8,11500,55,2012-04-04 16:20:23+00:00, ,187575352061726722,en,0,0,0,0,Hootsuite,"Nice pips and great runs on the EUR/USD, GBP/USD and AUD/USD... we've had a great week. More coming!"
246012444,ETDaily,False,2582,648,9582,76,2012-04-04 14:20:09+00:00, ,187545095367692288,en,0,0,0,0,Twitter Web Client,"Brent Crude trading down at $124.09 - struggling to lift off session lows due to strengthening USD vs EUR, GBP, CAD and AUD"
414259284,Tickmill,False,34145,125,25673,162,2012-04-04 13:33:27+00:00, ,187533340470034434,en,0,0,0,0,Twitter Web Client,#EUR/USD ACB and other reserve manager buying noted to support Euro but pressure on single currency seems to big. #USD #FX
22278694,_forexsignals,False,3273,111,1152,31,2012-04-04 13:04:48+00:00, ,187526133691068416,en,0,0,0,0,Twitter Web Client,eur/usd gbp/usd eur/jpy all hit my TP | Hope you all got those short .... I am stepped out of eur/usd and eur/jpy. still holding gbp/usd
44193297,jet813,False,500,179,13679,22,2012-04-04 12:54:08+00:00, ,187523447209996288,en,0,0,0,0,TweetDeck,EUR USD had covered it's ATR and the S&P still holding 1400 - bear trap???
434529720,OneGussmaster,False,22,70,1650,0,2012-04-04 12:48:08+00:00, ,187521937810010113,en,0,0,0,0,Twitter Web Client,Got out on EUR/JPY long yesterday went short today and its going good USD and JPY is where it is at!
43513379,4mostCurrency,False,2195,3190,12566,43,2012-04-04 12:39:23+00:00, ,187519737121615873,en,0,0,0,2,Twitter Web Client,"GBP/EUR risen from €1.1970 to €1.2083 in last 24 hours, and still rising. Due to weak Euro and strong USD. Tomorrows blog to explain in full"
348386707,Da_Dude7,False,214,496,2149,6,2012-04-04 09:49:18+00:00, ,187476931783036928,en,0,0,0,0,Twitter for iPhone,Gbp/usd and eur/usd also remain bearish go short
536369827,dpipscom,False,1220,73,56981,46,2012-04-04 09:21:51+00:00, ,187470023206506496,en,0,0,0,0,Twitter Web Client,Impressive breakout at EUR/USD and GBP/USD.
432266999,lievanopkai4,False,0,1,30,0,2012-04-04 09:18:29+00:00, ,187469178230411264,en,0,0,0,0,Twitter Web Client,Closed USD/JPY in the green and opened a few EUR/USD shorts when it tested 13330 again - easy short
426722004,RiskR3ward,False,13619,427,25703,309,2012-04-04 08:17:17+00:00, ,187453777748570113,en,0,0,0,0,Twitter Web Client,It looks like the EUR/USD and GBP/USD needs to correct part of its losses before heading heading lower - outlook out shortly.
55513519,TraderJJS,False,4702,6,9935,87,2012-04-04 08:07:48+00:00, ,187451387699920896,en,0,0,0,0,Echofon,... positive EUR PMI market not satisfied. Lot of eco reports today EUR and USD starting 6 am until 10 :30 am.
422972864,IVrzogic,False,70,689,1130,0,2012-04-04 07:59:45+00:00, ,187449361419075584,en,0,0,0,0,Twitter Web Client,EURO zone in recession and far from out of the woods! So short EUR/USD until 1.26 but looking for good place!
43320653,Ken_Karuri,False,2123,1638,13174,12,2012-04-04 06:19:46+00:00, ,187424200280125440,en,0,0,0,1,Twitter Web Client,"The KES has bounced back since the all time low in Oct 2011 to appreciate 26.0%, 28.2% and 32.9% respectively against the USD, GBP & EUR"
388934586,AbidexDBaddest,False,20,227,2903,0,2012-04-04 06:03:29+00:00, ,187420101836935168,en,0,0,0,0,Twitter for BlackBerry®,Facts and figure from the Hourly Time Frame on the Meta4Trader for Eur/Usd.
83853900,a17nphotography,False,146,97,4441,15,2012-04-04 03:51:34+00:00, ,187386907217506306,en,0,0,0,0,Twitter SMS,EUR/USD holding position with upper and lower bollinger as limit on 30M chart
398032526,Investment_Tip1,False,727,1572,450,9,2012-04-04 01:03:08+00:00, ,187344520315285504,en,0,0,0,0,Twitter Web Client,EUR/USD Signal Midday Update - April 3 EUR/USD signal update based on Elliott Waves and Fibonacci principles. Helpful even if you missed
28366310,DailyFXTeam,False,145948,63,381704,2827,2012-04-03 19:57:10+00:00, ,187267518195441666,en,0,0,0,1,Twitter Web Client,"U.S. dollar strengthens vs. most of its major peers. USD gains 0.84% vs. AUD, rises 0.52% vs. NZD and advances 0.66% vs. EUR."
434529720,OneGussmaster,False,22,70,1650,0,2012-04-03 19:55:39+00:00, ,187267137923067904,en,0,0,0,0,Twitter Web Client,Took too much risk shorting EUR/USD and got stopped out painful watching it drop today but at least I've learnt a lesson
115760030,YokotaArno,False,13298,6063,10288,100,2012-04-03 19:41:09+00:00, ,187263486458478592,en,0,0,0,0,Twitter for BlackBerry®,Now I am getting worried: My 14 year old son have a much better view on the EUR/USD exchange rate than I have. And calculates back faster!!
15295339,echelontrade,False,950,220,2201,5,2012-04-03 19:20:53+00:00, ,187258390127443968,en,0,0,0,0,MetroTwit,BOOM! EUR/USD hammered overnight... and check out Gold - $1640... yes please!!
313948924,gfsgroupusa,False,20,31,1392,0,2012-04-03 19:18:56+00:00, ,187257896390766595,en,0,0,0,0,Twitter Web Client,"Wow, what a movement on EUR/USD, entered short at 1.3285, now closed 3/4 and stop moved +45"
423775991,Rescue4ce,False,64,69,24826,6,2012-04-03 19:00:47+00:00, ,187253328810479616,en,0,0,0,0,Seesmic,so many people expected eur/usd falls. it related with usd/jpy rise and bond market fall or vice versa. falling bond markets is good for ES.
158840198,DossInvestments,False,37,44,708,0,2012-04-03 18:32:48+00:00, ,187246286129467392,en,0,0,0,0,Twitter Web Client,"EUR/USD and USD/JPY don't have much more room to go, therefore im scalping both against the USD for about 20 pips."
158840198,DossInvestments,False,37,44,708,0,2012-04-03 18:21:45+00:00, ,187243506572603394,en,0,0,0,0,Twitter Web Client,Those FOMC minutes really set off the USD - pulling my EUR/USD positions back into the green and took profit at 13250 - good day - $USD #eur
18832346,bansama,False,1255,566,110624,33,2012-04-03 17:45:36+00:00, ,187234408359673857,en,0,0,1,0,TweetDeck,"@GameStopDL How do you get the feed to display different currencies? It only shows yen for me and need to see USD/GBP/EUR, etc."
423775991,Rescue4ce,False,64,69,24826,6,2012-04-03 17:14:21+00:00, ,187226542961725440,en,0,0,0,0,Seesmic,"more usd/jpy and usd/chf selling could trigger eur/chf stop below 1.9995, which is highly unlikely. conversely, usd/jpy at the bottom."
271399768,BMFNNews,False,1478,1524,99495,39,2012-04-03 15:13:08+00:00, ,187196038979919872,en,0,0,0,0,dlvr.it,Within recent trade EUR/USD has cut its session losses and is now trading up 24 pips at 1.3344 headng towards the European equity cash...
313948924,gfsgroupusa,False,20,31,1392,0,2012-04-03 15:08:13+00:00, ,187194804021624832,en,0,0,0,0,Twitter Web Client,Awesome Long closed on EUR/USD from 1.3303 to 1.3340. Out of the market today!! We used 400K and 200:1.
20888115,hedgefundinvest,False,29720,1048,26243,1020,2012-04-03 15:06:04+00:00, ,187194260251086848,en,0,0,0,0,Hootsuite,@lcsonka39 Same argument re: USD/EUR -- US auto sales are local. But you and I are both puzzled. It's something to think about.
146128105,Topstep,False,9330,101,32058,223,2012-04-03 15:00:05+00:00, ,187192754118475777,en,0,0,0,0,Hootsuite,$6E_F Within recent trade EUR/USD has cut session losses and is now trading up 24 ticks 1.3344 headng towards the European cash market close
543156486,Dilanka_1988,False,25,0,13,0,2012-04-03 14:20:40+00:00, ,187182835650670592,en,0,0,1,0,Twitter Web Client,"@AlejandroDFX eur/usda  and aud/usd ,can we expect a bullish outcome frm MOC results"
435609120,LuigiBissatini,False,42,0,2251,2,2012-04-03 12:04:12+00:00, ,187148495252230144,en,0,0,0,0,Twitter Web Client,"EUR/USD not good anymore to sell 1,3370$ IT MADE ALREADY 1,3366$ and back to 1,33$, think next move will be the BREAKOUT ..."
303173865,Anil_T1,False,138,105,534,3,2012-04-03 11:00:33+00:00, ,187132476123127808,en,0,0,0,0,Twitter for iPhone,Looking for eur/usd to test the daily 200ma and DT soon around 13430 then probable pullback in the mrkts.. Dow 13300 resistance.
47551386,jimod9,False,639,483,4335,26,2012-04-03 09:52:38+00:00, ,187115383692599296,en,0,0,0,0,Twitter Web Client,"EUR/USD stalled at last weeks high of 1.3385 and eased back. We have minor support at 1.3250,"
414259284,Tickmill,False,34145,125,25673,162,2012-04-03 09:40:55+00:00, ,187112435184967680,en,0,0,0,0,Twitter Web Client,"#EUR/USD Sell orders are trailing entire upper-1.33s and 1.3400 barrier intact, limiting bullish scope in the longer-term for now. #USD #FX"
314508687,DanielGschwend,False,319,712,12287,16,2012-04-03 07:52:33+00:00, ,187085161538666496,en,0,0,0,0,Twitter for iPhone,@zerohedge @TradingDeck whos the mysterious EUR buyer? HF and most financials are distinctively negative or shirt but EUR vs USD moves up...
435609120,LuigiBissatini,False,42,0,2251,2,2012-04-03 07:42:19+00:00, ,187082586366017536,en,0,0,0,0,Twitter Web Client,"Insert a take profit @1,3370 of our LONG position in EUR/USD and look to buy again in the 1,33$ area"
252571367,rioseco751,False,715,0,14046,34,2012-04-03 07:33:54+00:00, ,187080471153352704,en,0,0,0,0,Twitter Web Client,but we still long eur/usd and short usd/chf because we still in the trend.
252571367,rioseco751,False,715,0,14046,34,2012-04-03 07:32:27+00:00, ,187080104550211584,en,0,0,0,0,Twitter Web Client,"samething with eur/usd short . pending close below 1,3298 but better confirmation will be close below last low 1,3277 and 1,3250"
298746695,JoeFarrington3,False,201,166,894,2,2012-04-03 07:16:12+00:00, ,187076014147506176,en,0,0,0,0,Twitter Web Client,"we are 15minutes in, the FTSE is trading 9points higher. Both the EUR and GBP both trading high against USD"
127759625,maxmckegg_TRL,False,1113,177,4723,74,2012-04-03 06:21:27+00:00, ,187062237666607104,en,0,0,0,0,TweetDeck,"Today's best trading: USD/JPY. For this set up plus my latest forecasts for EUR, CHF, GBP, AUD and NZD email TRL@clear.net.nz"
296807385,ForexTime_blog,False,134,13,905,9,2012-04-03 06:12:56+00:00, ,187060094205304832,en,0,0,0,0,Twitter Web Client,"European session, April, 3:
EUR\USD - to 1.3290; GBP\USD - target 1.5964 and 1.5950;
AUD\USD - expect falling;
USD\CHF - maintenance 0.90."
127759625,maxmckegg_TRL,False,1113,177,4723,74,2012-04-03 04:11:24+00:00, ,187029509076299776,en,0,0,0,0,TweetDeck,"Today's best trading opportunity is USD/JPY. For this set up plus my latest forecasts for EUR, CHF, GBP, AUD and NZD email TRL@clear.net.nz"
187067004,Adriana_Banks,False,3555,4529,68008,35,2012-04-03 01:35:05+00:00, ,186990172221603841,en,0,0,0,0,twitterfeed,"SHORT SALE NEWS AUD/USD, EUR/USD catching an updraft: The short-term AUD market still 'feels' a bit short and I think that's why we a..."
479905382,FxShepherd,False,32,33,328,0,2012-04-03 01:15:47+00:00, ,186985314269663233,en,0,0,0,0,TweetDeck,"Chinese Non-manu PMI in at 58 [fcast 48.4],  AUD and EUR jumped 20 pips higher vs USD, retracing now"
37894813,irums,False,310,117,12577,15,2012-04-02 22:54:58+00:00, ,186949874904862721,en,0,0,0,0,Twitter Web Client,@lyricaldubbz it knocked me black and blue...lol #eur/usd. i like usd/cad. coz they r equally strong..so they range a lot.. predictable
422865459,maugerchrdpu5,False,1,6,224,0,2012-04-02 21:09:14+00:00, ,186923266450006016,en,0,0,0,0,Twitter Web Client,"...it costs just $9.99 USD (£4.99 GBP, €7.49 EUR or $9.49 AUD) and is discounted by 50% until June 2"
67013704,DanielHusseyJr,False,3735,199,59109,142,2012-04-02 20:23:18+00:00, ,186911706881077249,en,0,0,1,0,TweetDeck,but... the prevailing trend is UP right now for EUR/USD -&gt; so this is where we expect it to continue... and too our targets
271399768,BMFNNews,False,1478,1524,99495,39,2012-04-02 19:18:21+00:00, ,186895361800024065,en,0,0,0,0,dlvr.it,"EUR/USD continues to recover from its earlier decline through the 1.3300 level and is close to being flat for the day, last 1.3333 (-8..."
158840198,DossInvestments,False,37,44,708,0,2012-04-02 17:03:33+00:00, ,186861438407684096,en,0,0,0,0,Twitter Web Client,Took profit after doubling down on USD/JPY... Entered short EUR/USD w/ 30 min. chart showing bearish divergence and a good day for US stocks
67013704,DanielHusseyJr,False,3735,199,59109,142,2012-04-02 15:21:15+00:00, ,186835692570152960,en,0,0,0,0,TweetDeck,"@duartefxgroup yes- long EUR/USD from 1.3025, 1.3150, and now 1.3290"
501249647,Ben_DD_FX,False,97,592,893,2,2012-04-02 14:49:29+00:00, ,186827700864942080,en,0,0,0,0,Twitter Web Client,6 hours of pure selling on Eur/Usd back down to the bottom of the range 200 EMA on hourly and good Support level long from here
67013704,DanielHusseyJr,False,3735,199,59109,142,2012-04-02 13:54:08+00:00, ,186813770914480128,en,0,0,0,0,TweetDeck,SHORTS in EUR/USD off the top  are valid until the fail: a solid rally above 1.33 breaks them... and you can buy the first dip
229141520,CortesSteve,False,322804,671,39760,1357,2012-04-02 13:34:11+00:00, ,186808751645405184,en,0,0,1,0,Twitter Web Client,"Yen roars back -- was getting smoked overnight, huge comeback and now well higher against USD and esp. EUR.  Long JPY, wax-on..."
252571367,rioseco751,False,715,0,14046,34,2012-04-02 13:21:46+00:00, ,186805626599514112,en,0,0,0,0,Twitter Web Client,"ok 1,328. looks we gonna reverse. 2/4/12 looks risk off. pending short eur/jpy and eur/usd short , long usd/chf"
192316454,JBL73,False,973,2221,6092,55,2012-04-02 12:46:57+00:00, ,186796863146557441,en,0,0,0,0,Hootsuite,"AUD/YEN and AUD/USD off 0.9% and 0.5%. EUR/USD off 0.3%. Yet, S&P futures flat at 1402."
211506653,JupaFX,False,350,280,26137,24,2012-04-02 10:37:41+00:00, ,186764332896489472,en,0,0,0,0,Twitter Web Client,EUR/USD: offers 1.3380/00 up to a 1.3400 barrier. Bids 1.3330/35 and 1.3300/10
127759625,maxmckegg_TRL,False,1113,177,4723,74,2012-04-02 06:49:00+00:00, ,186706783711137792,en,0,0,0,0,TweetDeck,"Today's best trading opportunity is EUR/USD. For this set up plus my latest forecasts for CHF, JPY, GBP, AUD and NZD email TRL@clear.net.nz"
422678652,ICMCapital,False,2241,1193,6939,51,2012-04-02 06:47:27+00:00, ,186706393745735681,en,0,0,0,0,Twitter Web Client,"EUR/USD: The short term trend is bullish, the medium and long term trends are sideways."
195598646,Ikon_Group,False,337,121,4198,16,2012-04-02 06:40:09+00:00, ,186704557311660032,en,0,0,0,0,Twitter Web Client,#EUR/USD Break will confirm resumption of whole rebound from 1.2625 and should target 61.8% retracement of 1.4246 to 1.2625 -actionforex #fx
198641183,hdcfx,False,432,205,5948,23,2012-04-02 06:18:15+00:00, ,186699042779185152,en,0,0,0,0,Twitter Web Client,"It is going to be an interesting month... with USD neutral, weak JPY and EUR and GBP strong. needed AUD and NZD to go back on track."
43975090,daytradersfx,False,3267,8,11500,55,2012-04-02 06:14:43+00:00, ,186698154639503360,en,0,0,0,0,Hootsuite,"The notes are posted in the chat, we have some GREAT levels on the eur/usd and gbp/usd. Log in for details"
127759625,maxmckegg_TRL,False,1113,177,4723,74,2012-04-02 00:16:37+00:00, ,186608037614714882,en,0,0,0,0,TweetDeck,"Today's best trading opportunity is EUR/USD. For this set up plus my latest forecasts for  CHF, JPY, GBP, AUD and NZD email TRL@clear.net.nz"
67013704,DanielHusseyJr,False,3735,199,59109,142,2012-04-02 00:05:53+00:00, ,186605335761518593,en,0,0,0,0,TweetDeck,And the EUR/USD gap is filled...
20218638,askchrishetrade,False,1234,618,18406,54,2012-04-01 22:54:55+00:00, ,186587473911091201,en,0,0,0,0,TweetDeck,"EUR/USD looking real bullish going into tomorrow and Dollar could get another leg down. Market poised for nice up move, but will it happn$$"
75290848,I_M_A_Trader,False,3666,164,113321,189,2012-04-01 22:44:27+00:00, ,186584840957726720,en,0,0,0,0,Twitter Web Client,"warning signal to all bulls ? Please explain why EUR/JPY and EUR/USD isnt as bullish? 
Why? because they know the China numbers are cooked ?"
26082079,pippuri,False,1033,1065,13211,105,2012-04-01 09:45:32+00:00, ,186388822530064384,en,0,0,0,0,Twitter for Mac,"I hope ""Branson"" will become a new world currency. Both EUR and USD are in trouble."
311086656,_CB01,False,4839,1045,44840,301,2012-04-01 05:13:37+00:00, ,186320390883250177,en,0,0,1,1,TweetDeck,"Ditto journals, where researchers get paid 150 EUR / USD for a review and nothing for the paper, while publishers sell them for 1000s p/a."
230488548,Tex_jacks,False,1270,556,9876,2,2012-04-01 00:07:01+00:00, ,186243233087627266,en,0,0,0,0,Twitter for BlackBerry®,"Actually looking forward to getting back into work here the USD rate and GBP/EUR has had some vast movement , another load of QE maybe ?"
232482174,JRobinsonTweets,False,60,118,125,0,2012-03-31 21:46:02+00:00, ,186207751783972864,en,0,0,1,0,Twitter Web Client,"@ScientificForex It looks like EUR/USD and GBP/USD about to start wave 5 downwards, any time soon on daily chart"
451109960,dieloresanchez,False,1603,3289,17665,56,2012-03-31 19:30:24+00:00, ,186173620593229824,en,0,0,0,0,Twitter Web Client,"What if the ECB, Firewall plans, bailouts and IMF rejects more aid to an EU still living in the edge, could be good an EUR below 1.25 vs USD"
28366310,DailyFXTeam,False,145948,63,381704,2827,2012-03-30 20:30:03+00:00, ,185826245194424320,en,0,0,0,0,Twitter Web Client,"Japanese Yen is the worst performer today. JPY weakens 0.9% vs. CHF, declines 0.8% vs. EUR and slips 0.5% vs. USD"
67013704,DanielHusseyJr,False,3735,199,59109,142,2012-03-30 19:41:50+00:00, ,185814107784613888,en,0,0,0,0,TweetDeck,"EUR/USD STOPS: For the piece i added from 1.3270. stop is at 1.3299, for the core position (1.3025 and 1.3150 longs) 1.3150..."
28807041,wahajs,False,4964,1178,10253,11,2012-03-30 19:08:05+00:00, ,185805615027863552,en,0,0,0,0,Twitter for BlackBerry®,Accepts aed/usd/gbp/eur and gives away 1 from 20/30 currencies. 24/7! No machine does that here. Sort of like an exchange vending machine
170707174,DCBorthwick,False,11598,925,56832,271,2012-03-30 18:03:39+00:00, ,185789399580164098,en,0,0,0,0,Twitter Web Client,EEMEA Afternoon Wrap Regional Overview: Markets are finishing month and quarter-end on a slightly better note as EUR/USD managed to bounc
413205965,SkuerDTahnmi,False,15,25,2619,0,2012-03-30 17:55:49+00:00, ,185787430224400384,en,0,0,0,0,Twitter Web Client,"At this moment, GBP/EUR = 6/5 and EUR/USD = 4/3, to the hundredth of a US penny. I like it when the world turns simple, even for an instant."
372460791,reinman_mt,False,5369,2472,89292,208,2012-03-30 16:58:16+00:00, ,185772947598884864,en,0,0,4,2,TweetDeck,"Nouriel is saying that EUR needs to go to parity with USD for EZ to be competitive. May be, but over Bernanke and Geithner's dead bodies."
474271675,Goldcoast71,False,49,88,1205,1,2012-03-30 15:50:44+00:00, ,185755949489860608,en,0,0,0,0,Twitter for Android,EU leaders take double counting to a new level: 500bn become 1 trn if you count bailouts paid until now and change EUR to USD. Incredible!
67013704,DanielHusseyJr,False,3735,199,59109,142,2012-03-30 15:18:30+00:00, ,185747838385401856,en,0,0,1,0,TweetDeck,Ok.... Thats it EUR/USD and ES have broken shorts after this mornings sell offs... looking for a nice move higher now
170707174,DCBorthwick,False,11598,925,56832,271,2012-03-30 14:46:31+00:00, ,185739791629955072,en,0,0,0,0,Twitter Web Client,"Honey-Badger EURO and US Fiscal Pain Douglas C. Borthwick As we expected, the EUR/USD has rallied over the first quarter of 2012. Current"
43975090,daytradersfx,False,3267,8,11500,55,2012-03-30 14:39:20+00:00, ,185737980508512256,en,0,0,0,0,Hootsuite,we've locked in profit on the aud/usd and we now have an entry on the eur/usd as well. Join us in the chat for details. #fx
271399768,BMFNNews,False,1478,1524,99495,39,2012-03-30 12:43:16+00:00, ,185708771467722753,en,0,0,0,0,dlvr.it,USD Index remains lower on the session (-0.35%) following the US economic data at 1330BST; EUR/USD and GBP/USD still trading with a 60...
55827109,brokerz_bearish,False,2000,2739,12860,29,2012-03-30 12:04:52+00:00, ,185699109116723201,en,0,0,0,0,twitterfeed,RT @DanielHusseyJr - Nothing bearish about EUR/USD London PX so far... just a pullback... and what looks like a wedge at highs
67013704,DanielHusseyJr,False,3735,199,59109,142,2012-03-30 11:41:50+00:00, ,185693314908037120,en,0,0,2,1,TweetDeck,Nothing bearish about EUR/USD London PX so far... just a pullback... and what looks like a wedge at highs
43975090,daytradersfx,False,3267,8,11500,55,2012-03-30 08:53:07+00:00, ,185650854739714049,en,0,0,0,0,Hootsuite,"Updated levels on the eur/usd, gbp/usd and aud/usd posted in the chat, log in and check the announcement area."
22753657,TOTALP,False,127,146,247,2,2012-03-30 08:15:02+00:00, ,185641269752643584,en,0,0,0,0,Twitter Web Client,The q 1 short squeeze overnight in S+P and EUR/USD in the far east has pushed both back to familiar levels for the last week
28366310,DailyFXTeam,False,145948,63,381704,2827,2012-03-30 07:32:36+00:00, ,185630592237441024,en,0,0,0,3,Twitter Web Client,HEADSUP: Eurozone CPI estimate comes in later today and EUR/USD traders should keep their eyes on the meeting of European finance ministers.
414259284,Tickmill,False,34145,125,25673,162,2012-03-30 07:27:24+00:00, ,185629282737991680,en,0,0,0,0,Twitter Web Client,#EUR/USD Sell orders are set 1.3370 through the 1.3400 barriers and stops sit tight above 1.3410 and 1.3420. #USD #FX
414259284,Tickmill,False,34145,125,25673,162,2012-03-30 07:14:58+00:00, ,185626155070656513,en,0,0,0,0,Twitter Web Client,#EUR/USD Option barriers located at 1.3380 and 1.3400(strong res level) Stops are 1.3385+ #USD #FX
414259284,Tickmill,False,34145,125,25673,162,2012-03-30 07:10:35+00:00, ,185625049754124288,en,0,0,0,0,Twitter Web Client,#GBP/USD Leading US name is on the offer above 1.6020 and that Nordic accounts were good sellers of #EUR/GBP. #USD #FX
420222544,waltervannelli,False,27797,707,51688,400,2012-03-30 07:05:45+00:00, ,185623836451020801,en,0,0,0,0,Twitter Web Client,Good morning eur/usd in uptrend I buy over 1.3365 if confirmed target 1.3402 and 1.3440
426722004,RiskR3ward,False,13619,427,25703,309,2012-03-30 06:47:19+00:00, ,185619193889169408,en,0,0,0,0,Twitter Web Client,EUR/USD finally finishes its correction -  lets see if we can get some momentum and reach 1.3400-1.3450. Full rapport out shortly.
538130330,SPTFWD,False,4,10,56,0,2012-03-30 05:52:36+00:00, ,185605427436847104,en,0,0,0,0,Twitter Web Client,"Todays bets:£1,550 SELL EUR/GBP BUY @0.83495
£1,730 SELL EUR/JPY BUY @109.449
£1,770 BUY GBP/USD SELL @1.59815
...and..."
538130330,SPTFWD,False,4,10,56,0,2012-03-30 05:40:58+00:00, ,185602498474684416,en,0,0,0,0,Twitter Web Client,"Disappointing in the end yesterday. Prices drifted late in the day. Shorting EUR, USD and XAU today. Just getting the numbers now."
43975090,daytradersfx,False,3267,8,11500,55,2012-03-30 04:48:50+00:00, ,185589380159782912,en,0,0,0,0,Hootsuite,"The notes are posted in the chat, plus we're already in a EUR/USD Long that is running well and we're about to lock in profit."
