author id,author username,is_verified_user,followers_count,following_count,tweet_count,listed_count,created_at,geo,id,lang,like_count,quote_count,reply_count,retweet_count,source,tweet
823310,peterbihr,False,7749,735,44308,535,2013-08-15 14:56:31+00:00, ,368023404076888064,en,0,0,2,0,YoruFukurou,"German customs charge 1h of work (EUR45) to process a UPS shipment and still confuse USD and EUR? Thanks for nothing, customs."
11995222,moomerman,False,673,1131,3086,48,2013-08-15 14:31:57+00:00, ,368017220258893824,en,1,0,0,0,Twitter Web Client,"@stripe have just launched in the uk, and with GBP, USD and EUR payments.  (that's the sound of 10s of aged uk payment companies collapsing)"
473967709,nickolivari,False,377,95,25198,17,2013-08-15 13:58:04+00:00, ,368008693117239296,en,0,0,0,2,Twitter Web Client,"eur volume picks up, now USD3.4 bln in eur on RD. USD 2.23 bln in jpy and AUD1.37 bln in aud. but still more yen action on a relative basis"
1642912063,FurryDays,False,307,517,3470,4,2013-08-15 13:52:58+00:00, ,368007409488232448,en,0,0,0,0,TweetDeck,LinkedIn just stole 180 eur (240 USD) from my credit card for a service I asked to disable one year ago (and they confirmed it was disabled)
1619942736,GreedyTrader81,False,146,44,4992,12,2013-08-15 13:49:15+00:00, ,368006474749837313,en,2,0,0,0,Twitter Web Client,"Great gains for me on USD/JPY long positions AUD/USD short positions and USD/CHF long positions, EUR/USD short. Covered profits..."
477074187,Anjali_Mirpuri,False,126,11,3559,2,2013-08-15 12:40:20+00:00, ,367989133022879744,en,0,0,0,0,Twitter for iPhone,Buy usd and eur against the canadian dollar !!!!!!! JACKPOT IN A FEW MINUTES :) or RIGHT NOW! :) #jackpot thursday
1469157986,HistomiMusa,True,195,23,468,2,2013-08-15 11:14:35+00:00, ,367967549939396608,en,0,0,1,0,Twitter Web Client,@FRCSIGNALS are we to stay out of trade for GBP/USD and EUR/USD? BEFORE THE US CORE CPI NEWS?
1423244396,bradleyjason332,True,174,58,3370,3,2013-08-15 11:08:31+00:00, ,367966024341389312,en,0,0,0,0,Twitter for Android,Gold &amp; Silver are making their turns. Eur/Usd is freeing up from Aussie and Cable. About to go up. And Yen is looking weak.
1229582402,CSSPartnersFX,True,418,841,103,4,2013-08-15 09:54:29+00:00, ,367947394605785088,en,0,0,0,1,Twitter Web Client,EUR/USD and GBP/USD run higher look to be running out of steam
210812422,VantageFXUK,True,375,474,2003,3,2013-08-15 09:32:19+00:00, ,367941817544626176,en,0,0,0,0,Twitter Web Client,"#EUR did manage to pick up some points though, while both #USD and #JPY dropped slightly... #ForexSentiment"
974345539,MyTreasuryAdv,True,693,1791,1046,13,2013-08-15 08:34:54+00:00, ,367927366367993857,en,0,0,0,0,LinkedIn,After stronger than expected UK July retail sales GBP/USD hits a 1 month high of 1.5580 and EUR/GBP a 1 month low of 0.8525
1423244396,bradleyjason332,True,174,58,3370,3,2013-08-15 08:05:39+00:00, ,367920006707032064,en,0,0,0,0,Twitter for Android,Still short Aud/Usd. Short Gold &amp; Silver with silver having more to lise now. Long Eur/Usd &amp; Eur/Aud and short yen.
414259284,Tickmill,True,34132,125,25711,162,2013-08-15 07:48:32+00:00, ,367915699013812224,en,0,0,0,0,Twitter Web Client,#EUR/USD European Buy Orders 1.3250-60 and 1.3235-40
68654918,Ton4aLiving,True,973,926,40308,22,2013-08-15 07:42:48+00:00, ,367914253811867648,en,0,0,1,0,Janetter,RT @OrderFlowForex EUR/USD - Asian sovereign name sold above 1.33 earlier and has more offers around 1.3320 @ajakkk
280113065,PredatorTrading,True,2603,305,16058,94,2013-08-15 07:26:00+00:00, ,367910027698253824,en,0,0,0,1,Twitter Web Client,EUR/USD - Asian sovereign name sold above 1.33 earlier and has more offers around 1.3320
20243744,FOREXcom,True,203864,124,46855,2281,2013-08-15 07:17:52+00:00, ,367907981494456320,en,0,0,0,0,Twitter Web Client,"#FX: USD is weaker today along wiht the GBP and EUR, AUD, NZD are higher, while CHF and CAD are mixed ^KB"
718119902,armanditoblume,False,97,22,3460,1,2013-08-15 06:55:32+00:00, ,367902357868527616,en,0,0,0,0,Twitter for iPad,"....but it looks like we are getting reversals without volatility more and more..at this point eur/usd could go to 1,30without visiting 134"
259604418,RMBCIB,False,14257,247,21478,127,2013-08-15 05:02:22+00:00, ,367873881539096576,en,0,0,0,2,Ensight,The rand has backed off the key levels of 10.00 on USD/ZAR and 13.25 on EUR/ZAR.
21806379,hasan1,False,826,319,23653,55,2013-08-15 04:10:52+00:00, ,367860921315504129,en,0,0,0,0,Tweetlogix,And that's exactly why you don't short in an uptrend. EUR/USD
760883833,petergo99037185,False,234,40,304257,2,2013-08-15 00:45:53+00:00, ,367809333129523200,en,0,0,0,0,Twitter Web Client,"With DOL Denominated YEN negative, 97.89 -0.24, the lack of BOJ pushy pushy ONE DOLLAR, makes EUR and $USD to react strong, EUR/USD +0.0010"
252584436,owsi1968,False,6370,366,53774,148,2013-08-15 00:34:23+00:00, ,367806441404379136,en,0,0,0,0,Twitter Web Client,Yawn..Still holding my short eur usd..3 weeks now and nothing much..Looking for a break below 130..It will go..just takes time
343722036,salim0896,False,473,530,10014,0,2013-08-14 23:36:58+00:00, ,367791992107196416,en,0,0,0,0,Twitter for BlackBerry®,"@ZishanBaangi trading currencies, Eur/usd, I occasionally trade buy and sell Gold and apple"
1426030922,MingliFX,False,57,40,10209,6,2013-08-14 17:43:14+00:00, ,367702972618125313,en,0,0,0,0,Twitter Web Client,"EUR, GBP, gold and silver have been rallying against the USD for quite some time already. So I will keep undertrading. Patience. Alot of it."
17619280,juliecheung,False,1579,466,20950,81,2013-08-14 17:21:54+00:00, ,367697603850285056,en,0,0,2,0,Twitter Web Client,"@lyndoman lol more money than sense :D - no, never spreadbet FTSE, just straight buy/sell on EUR/USD and GBP/USD only"
891500648,FX_ElliottWave,False,5578,17,2730,102,2013-08-14 15:43:57+00:00, ,367672950549258240,en,0,0,1,1,Twitter Web Client,"USD is flat against EUR and CHF, but down against GBP. Question is, has GBP resumed a larger rally -- or is that just a deep correction?"
1383738607,ElysiumFX,False,119,260,1974,5,2013-08-14 15:32:32+00:00, ,367670077115482113,en,0,0,0,0,TweetDeck,"$USD, $EUR, $AUD, $CHF, and $CAD yen pairs are all hitting important price areas. 4-hr charts."
375731000,KevinJamessfm,False,1106,835,41315,121,2013-08-14 14:31:15+00:00, ,367654658363248641,en,0,0,0,0,Twitter Web Client,closing fx predictions: eur/gbp below0.8550 and eur/usd below 1.3255
1423244396,bradleyjason332,False,174,58,3370,3,2013-08-14 13:44:03+00:00, ,367642777339068416,en,0,0,0,0,Twitter for Android,"The way I see it, no matter what the Fed says about tapering Eur/Usd will rise. And when they really do taper Eur/Usd will skyrocket..."
28169100,NomantisFX,False,95,2,85,0,2013-08-14 13:33:55+00:00, ,367640229642907648,en,0,0,0,0,Twitter Web Client,Orders are in to short EUR/USD at 1.3271 and GBP/JPY at 152.61
1359039774,Hikemangroup,False,340,543,2076,2,2013-08-14 08:54:39+00:00, ,367569946689032192,en,0,0,0,0,Twitter Web Client,Angry in the office...missed two alerts to send out by 10 seconds....damn. buy gbp/usd and sell eur/gbp...At least I got them on my platform
259604418,RMBCIB,False,14257,247,21478,127,2013-08-14 05:14:19+00:00, ,367514501434060801,en,0,0,0,5,Ensight,USD/ZAR opens at just below 10.00 and EUR/ZAR at 13.23.
148290382,fivemack,False,433,265,7642,12,2013-08-13 23:25:04+00:00, ,367426606135906305,en,0,0,0,0,Twitter Web Client,"@cmdrjameson One five-hundred-and-fiftieth, in 2012 (not corrected for different year-ends, EUR/USD exchange rate, position of Neptune &amp;c)"
232136043,Dinkdoo96,False,1272,1236,7601,20,2013-08-13 22:03:20+00:00, ,367406040389660672,en,0,0,0,0,Twitter for Android,"Picked up 40 pips on the Eur/Usd using Supply and Demand, looking to catch momentum waiting for my next signal, Patience makes Pips"
35796723,JeremyWS,False,5044,543,18861,207,2013-08-13 21:12:03+00:00, ,367393135107641344,en,0,0,0,0,TweetDeck,"Getting long Yen against CAD, GBP, EUR and USD for a retracement after today's move. Stochastics oversold and at support"
435790812,terrencewalsh1,False,410,289,4882,47,2013-08-13 17:36:10+00:00, ,367338806241804288,en,0,0,0,0,Twitter for iPad,"Order to short EUR/USD 1.3285/1.3315,S/L and targets upon short entry."
339433762,forexmentor_lct,False,557,0,8870,11,2013-08-13 16:30:51+00:00, ,367322365518024704,en,0,0,0,0,Twitter Web Client,"moving stops to entry on EUR/USD and USD/CHF, with second entries, will be taking profits and closing soon"
14889836,crooy,False,72,145,554,1,2013-08-13 14:01:25+00:00, ,367284760718376960,en,0,0,1,0,Twitter for Mac,@skrebbel en_IE also gives USD and EUR…
23047798,skrebbel,False,654,617,6171,0,2013-08-13 13:50:19+00:00, ,367281967626076160,en,0,0,3,0,Twitter Web Client,"@crooy so I guess they chose consistency (""use weird symbol only for own currency""). Curious: what're USD and EUR in en-IE?"
549188699,RichiePoshMan,False,167,643,1956,2,2013-08-13 13:46:46+00:00, ,367281075552534528,en,0,0,0,0,Twitter for iPhone,Eur/Usd is at 1.3250 and probability of extending to 1.3225 still persists. But I closed the deal at 1.3250
75588314,jhbain,False,128,87,3408,0,2013-08-13 13:45:46+00:00, ,367280820551032832,en,0,0,0,0,Twitter Web Client,Long usd/jpy from 97.95 and short eur/usd from 1.3260
1477718814,winnertrades,False,259,161,9720,6,2013-08-13 13:34:49+00:00, ,367278068236169217,en,0,0,0,0,Twitter Web Client,short gold and eur usd
269294861,SorsTrade1,False,420,802,29862,42,2013-08-13 12:56:51+00:00, ,367268511292207104,en,0,0,0,0,LinkedIn,EUR/USD 1.3250 and tanking
452872127,DarionElite,False,163,593,1760,2,2013-08-13 12:42:01+00:00, ,367264777497612288,en,0,0,0,0,Twitter Web Client,Seeing leveraged and real money buying Eur/Chf around 1.2365/75 region. Usd/Chf rallying sharply post data triggeringmodel stops above0.9320
484328118,ExoticAffluence,False,497,407,15430,8,2013-08-13 10:03:27+00:00, ,367224874642997248,en,0,0,0,0,iOS,"Information On FTSE 100 DAX EUR/Usd
And EUR/JPY
The European markets have rallied based on speculation this morning 
Kennedy@onetwotrade.com"
1423244396,bradleyjason332,False,174,58,3370,3,2013-08-13 10:02:51+00:00, ,367224725577408512,en,0,0,0,0,Twitter for Android,Either jump on the yen weakness train or get left behind. The stage is set for at least 98.50 for Usd/Jpy and Eur/Jpy at 130.60.
25825021,michaelpls91,False,449,1752,6221,1,2013-08-13 09:45:54+00:00, ,367220458917081088,en,0,0,0,0,Twitter Web Client,"the EUR has advanced 0.1 percent each versus the USD and the GBP to trade at USD 1.3312 and GBP 0.8608, respectively."
25825021,michaelpls91,False,449,1752,6221,1,2013-08-13 09:45:22+00:00, ,367220325244604416,en,0,0,0,0,Twitter Web Client,"The JPY has weakened 0.6 percent and 0.4 percent against the EUR and the USD, respectively."
549188699,RichiePoshMan,False,167,643,1956,2,2013-08-13 08:56:36+00:00, ,367208050291404801,en,0,0,0,0,Twitter for iPhone,Eur/Usd: short positions at 1.3300 with target of 1.3260 and 1.3225 in extension. Stop loss at 1.3345
1469157986,HistomiMusa,False,195,23,468,2,2013-08-13 08:28:58+00:00, ,367201096214646784,en,0,0,0,0,Twitter Web Client,@ForexWealthGuru THANKS FOR TODAY SIGNAL. I JUST MADE 40 PIPS IN USD/JPY AND 30 PIPS IN EUR/JPY THANKS. THATS OK FOR ME TODAYGOD I THANK YOU
90916172,tradeincome,False,1131,31,947,12,2013-08-13 07:50:52+00:00, ,367191508388036611,en,1,0,0,0,Twitter Web Client,EUR/USD - I have two orders placed above the recent range.  Buy stop at 13320 and sell stop at 13275.  Both with 30 pip targets.
55513519,TraderJJS,False,4712,6,9956,87,2013-08-13 07:36:11+00:00, ,367187813604663296,en,0,0,0,0,Twitter Web Client,"... Eco EUR 5 am German + EZ ZEW, Industrial Production, USD 8:30 Core|Retail Sales and 10 am Business Inventories."
20243744,FOREXcom,False,203864,124,46855,2281,2013-08-13 07:31:49+00:00, ,367186714264997888,en,0,0,1,1,Twitter Web Client,"In the FX space: The yen is the biggest loser, while EUR, GBP and USD are mostly higher, AUD and NZD are weaker ^KB"
1130474064,CurrenciesGuySA,False,359,804,937,7,2013-08-13 06:57:53+00:00, ,367178173454098432,en,0,0,0,0,Twitter Web Client,Markets will be eyeing German ZEW Economic Sentiment at 11:00 and US Retail Sales at 14:30 SA time: USD/ZAR 9.90 GBP/ZAR 15.32 EUR/ZAR 13.18
576985163,PipSqueakTrader,False,38,25,969,1,2013-08-13 01:53:09+00:00, ,367101485730889728,en,0,0,0,0,StockTwits Web,"after a light Monday, we are getting ready to rock and roll for the week. Good EUR data and crappy USD data = $EURUSD 1.3400 coming up."
760883833,petergo99037185,False,234,40,304257,2,2013-08-13 00:18:46+00:00, ,367077735966834688,en,0,0,0,0,Twitter Web Client,Fx players EUR/USD &amp; GBP/USD shud be shorted if Conditions and NEWS remain same. $/YEN aggressive intervention BOJ propitious profits short&lt;
1351856251,TokyoMTG,False,14313,76,16913,237,2013-08-12 20:49:33+00:00, ,367025084071804928,en,0,0,0,1,Twitter for iPad,"We want to make shopping for JP cards as easy as possible, so we accept the following currencies: USD, JPY, AUD, CAD, EUR, GBP and SGD! #mtg"
101002059,Frances_Coppola,True,73114,5204,597589,2292,2013-08-12 20:41:44+00:00, ,367023117233045504,en,0,0,1,0,Hootsuite,"@rosaltmann Those are the 5-year charts for GBP versus EUR, USD and JPY. If the exch rate doesn't move, QE does not affect £."
850040984,trendtraderplus,True,684,0,16951,28,2013-08-12 19:08:08+00:00, ,366999559261532160,en,0,0,0,0,Twitter Web Client,MEMBERS: Daily Trade Recap video posted and available now. Re: EUR/USD top-down from Monthly to 60m. Is high level Market Flow reversing?
27108990,chrisfkeane,True,2322,316,21259,70,2013-08-12 15:12:22+00:00, ,366940226242879490,en,0,0,0,0,Twitter Web Client,"Followed  by EUR and GBP CPI readings, and the EUR ZEW plus USD Retail Sales.  Sparks everywhere just have to see if any fires start (2/2)"
90916172,tradeincome,True,1131,31,947,12,2013-08-12 14:42:54+00:00, ,366932813083185153,en,0,0,0,0,Twitter Web Client,EUR/USD - Falling off the highs of 13400 and back at the previous resistance 13300.  Looking for more pull back to 13250
86358396,GlobalCurrencyS,True,266,103,2066,7,2013-08-12 14:38:04+00:00, ,366931597049597952,en,0,0,1,1,Facebook,"Happy Monday!!  Today we are selling USD @ 1.0541, EUR @ 1.4197 and GBP @ 1.6404.  Please call for quotes on large trades!"
1351856251,TokyoMTG,True,14313,76,16913,237,2013-08-12 12:04:29+00:00, ,366892945212846081,en,0,0,0,0,Twitter for iPad,"We want to make shopping for JP cards as easy as possible, so we except the following currencies: USD, JPY, AUD, CAD, EUR, GBP and SGD! #mtg"
363418210,ZanderLuke,True,41,285,241,2,2013-08-12 11:54:32+00:00, ,366890442702336001,en,0,0,1,0,TweetCaster for Android,"BOFA and Merrill are selling a bunch of EUR/USD. Getting short, targeting the 1.28210 level"
498885321,MRCoptions,True,28,0,977,0,2013-08-12 11:26:57+00:00, ,366883502391693312,en,0,0,0,0,Twitter Web Client,"USD continues to see strength against EUR, JPY and GBP during a session light on volume and newsflow, with the USD-index seen up 0.4%... #fx"
210812422,VantageFXUK,True,375,474,2003,3,2013-08-12 10:58:33+00:00, ,366876351875121154,en,0,0,0,0,Twitter Web Client,#GBP dropped down over 10 sentiment points in Friday's trading with both #EUR and #USD picking up points... #ForexSentiment #VantageFXUK
20243744,FOREXcom,True,203864,124,46855,2281,2013-08-12 07:42:34+00:00, ,366827033122193408,en,0,0,0,2,Twitter Web Client,"#FX: A very quiet data day today, the USD Is stronger along with the EUR and GBP in the G10, while the yen, AUD and NZD are weak ^KB"
760883833,petergo99037185,False,234,40,304257,2,2013-08-12 06:27:07+00:00, ,366808043154976773,en,0,0,0,0,Twitter Web Client,"with $USD positive and Japan's $Denominated / YEN +0.28 (BOJ pushing YEN down), we can expect EUR/USD to lose ground Sterling too, both down"
1375810338,_Man0lex,False,187,1884,2692,3,2013-08-12 05:17:47+00:00, ,366790598457434114,en,0,0,0,0,Twitter Web Client,"#Breakin #Calendar today, $EUR Consumer price Index M/M and Y/Y Portugal 6:00AM, $USD Budget Statement 2:00PM. Time Chile."
159771343,AMehring,False,25,178,10715,4,2013-08-11 14:20:33+00:00, ,366564800135827456,en,0,0,0,0,Twitter Web Client,"If my boyfriend and I got married, we would save #taxes in the amount of 48,13 EUR (~ 64.21 USD). The German #taxsystem is so unromantic. :("
238416519,jonnodillinger,False,238,197,13581,6,2013-08-11 05:33:51+00:00, ,366432251384307713,en,0,0,0,0,Twitter Web Client,"different bank accounts for EUR, NOK, GBP, and of course USD"
165376839,SNforex,False,87,152,56,0,2013-08-10 14:53:22+00:00, ,366210670192103424,en,3,0,0,0,Twitter for iPhone,Now it is right time to buy USD vs eur and stg at any level on Monday looking for 1.1850
25825021,michaelpls91,False,449,1752,6221,1,2013-08-10 09:01:36+00:00, ,366122145027325952,en,0,0,0,0,Twitter Web Client,"The EUR is trading 0.6 percent, 0.2 percent and 0.1 percent lower against the JPY, the USD and the GBP, respectively."
547904132,drskharlamov,False,1665,4998,119408,250,2013-08-10 07:41:02+00:00, ,366101871955427329,en,1,0,0,0,Twitter for iPad,"Russia should pay to EU and US (1 EUR = 0.75 USD) 46.04 trn EUR + 68.12 trn USD = 97.13 trn EUR in and out of procedure by Sep, 11th, 2013"
224318833,dipsailor,False,445,402,9452,0,2013-08-09 23:47:17+00:00, ,365982647593345027,en,0,0,0,0,Twitter for BlackBerry®,"These are the most liquid and the most sexy (USD, EUR, JPY, GBP, CHF, CAD, NZD, and AUD) #currencies"
850040984,trendtraderplus,False,684,0,16951,28,2013-08-09 17:48:50+00:00, ,365892442244915200,en,0,0,0,0,Twitter Web Client,"#EUR/USD: Daily chart resistance is holding exactly where we expected this time yesterday, and intraday Market Flow is bearish. Topping?"
541793386,BrainsAllGone,False,710,17,1023,4,2013-08-09 16:52:18+00:00, ,365878215396433921,en,4,0,0,3,Twitter Web Client,"Wanna order our debut EP? 
Price with the shipping: 7 USD; 5 EUR; 5 GBP. Send your orders and any questions to brainsallgoneorders@gmail.com"
33973843,PipCzar,False,60157,767,84785,1839,2013-08-09 15:34:47+00:00, ,365858705922732032,en,0,0,0,0,TweetDeck,I am maintaining the AUD/NZD long at 1.1433 and EUR/GBP short at .8600...that's it folks! Strange being short the USD last 3 days for sure
278937347,mosesharding,False,5905,52,64084,127,2013-08-09 15:29:54+00:00, ,365857477474009088,en,0,0,0,0,Twitter for BlackBerry®,EUR/USD failed at mid-point of 1.3350-1.3450 and back below 1.3350; watch 1.3200/1.3250-1.3400/1.3450 now
1260595735,charmer1881,False,259803,285433,23686,422,2013-08-09 14:19:47+00:00, ,365839833274392577,en,0,0,1,0,Twitter for Android,@sunilddesai I only trade the gbp/usd and eur/usd as I know these currencies trates to a tee.....
28140960,spreadthetrend,False,300,347,7329,10,2013-08-09 13:02:49+00:00, ,365820462481162240,en,0,0,0,0,Twitter Web Client,A little bit of #Yen strength again today and once again our Equity markets don't like that so much..... $JPY USD/JPY EUR/JPY
130518134,lil_jay890,False,29,120,348,0,2013-08-09 11:23:16+00:00, ,365795409559420928,en,0,0,0,0,TweetCaster for Android,@measuredmove people were caught overly long usd and factoring in sept taper. Sept in ? And decent eur data = grind higher. Pain trade
372819714,ulas_akincilar,False,1075,485,8405,42,2013-08-09 10:40:25+00:00, ,365784626284871682,en,1,0,0,0,Twitter Web Client,"if its the case EURAUD and GBPAUD will correct lower hard and AUDUSD has big upside potential but i dont want to short USD,EUR or GBP now"
210812422,VantageFXUK,False,375,474,2003,3,2013-08-09 10:11:26+00:00, ,365777332553777154,en,0,0,0,0,Twitter Web Client,#EUR and #USD yo-yoing as sentiment for both reverse with the euro up 14.41 sentiment points and the dollar down 11.88 #forexsentiment
518452185,AfiduAfrim,False,0,2,1,0,2013-08-09 08:38:08+00:00, ,365753851221000192,en,0,0,0,0,Twitter for Websites,@askhaitham653 are we having hidden divergence in Weekly EUR/USD chart and a regular divergence in Daily chart?
547904132,drskharlamov,False,1665,4998,119408,250,2013-08-09 07:43:48+00:00, ,365740178905628674,en,1,0,0,0,Twitter for iPad,"Russia should pay to EU and US (1 EUR = 0.75 USD) 23.02 trn EUR + 34.06 trn USD = 48.57 trn EUR out of procedure by Sep, 11th, 2013"
61431717,TA3Ltd,False,328,1048,4617,17,2013-08-09 06:58:31+00:00, ,365728784248356865,en,0,0,0,0,Twitter Web Client,"EUR/USD now above  2011-2013 downtrend,  200 week ma and the June high  at 1.3402/17 the target to break. 1.3370/30 supports"
760883833,petergo99037185,False,234,40,304257,2,2013-08-08 19:18:29+00:00, ,365552613690843139,en,0,0,0,0,Twitter Web Client,"World Currencies '''COINS'' EUR/USD + 46 pips, USD/JPY + 0.23 , GBP + 54 pips, &lt;&gt; OVERLAY in both EURO and British Pound Sterling, BET DOWN."
273938847,Excalifragilist,False,429,434,6194,12,2013-08-08 16:34:44+00:00, ,365511405220270080,en,1,0,0,0,Mobile Web (M2),"@matigreenspan its been a long wait, may the $GBP/USD $USD/CAD and $EUR/USD bears charge with fury. happy pipping!"
927837920,omni2226,False,129,350,3821,0,2013-08-08 15:29:25+00:00, ,365494966677536770,en,0,0,0,0,Twitter Web Client,Just a few pips to my target of 1.34 on EUR/USD long. Took profit on short USD/YEN. Will reload if it goes below .96 and holds.
440203286,ProsperityFXPro,False,459,0,5289,13,2013-08-08 14:18:51+00:00, ,365477209542098945,en,0,0,0,0,Twitter Web Client,We are finally at EUR/USD shorting levels from weeks back. The call will come live and it will be a precisely technical one. Once I see the
1423244396,bradleyjason332,False,174,58,3370,3,2013-08-08 13:08:44+00:00, ,365459563492814851,en,0,0,0,1,Twitter for Android,Huge diversion with the Eur/Usd on 6 and 8 hour chart.  Going short here. Running out of steam.
383188100,FXspacetrader,False,909,308,40233,26,2013-08-08 13:04:05+00:00, ,365458394481561601,en,0,0,0,0,Twitter for iPad,Eur /usd battling with that 13360/70 area. Low volume August blues etc. candle patterns and price action
86358396,GlobalCurrencyS,False,266,103,2066,7,2013-08-08 12:55:55+00:00, ,365456338031087617,en,0,0,0,1,Facebook,"Good  morning everyone! :) 
The sell rates today are: USD 1.0608; EUR 1.44 and GBP 1.6613.

Please call us for more rates!!!"
139707166,jeanienyc,False,894,392,18949,46,2013-08-08 12:54:24+00:00, ,365455955254718465,en,0,0,0,0,TweetDeck,"RT @keepitrealdude: DANSKE BANK:We close our FX recommendation to buy USD against a basket of EUR, GBP, JPY and CHF and take a loss of 2.1%."
232891639,keepitrealdude,False,1248,56,8875,41,2013-08-08 12:52:56+00:00, ,365455585195470848,en,0,0,0,0,Twitter Web Client,"DANSKE BANK: We close our FX recommendation to buy USD against a basket of EUR, GBP, JPY and CHF and take a loss of 2.1%."
1536214254,ForexOnlinePart,False,277,663,22,0,2013-08-08 09:35:53+00:00, ,365405998334226432,en,0,0,0,0,Twitter Web Client,"The EUR/USD broke up and reached our first target at 1.3350. From here, we can expect the pair to continue towards the 1.34 area."
20846084,warburg100,False,1622,407,50016,107,2013-08-08 06:42:01+00:00, ,365362243665281024,en,0,0,0,0,TweetDeck,"MS entered into a macro tactical short EUR/USD trade from 1.3300 with a stop at 1.3440, and a target at 1.2700."
760883833,petergo99037185,False,234,40,304257,2,2013-08-08 01:05:24+00:00, ,365277532188192769,en,1,0,1,0,Twitter Web Client,"It appear that EUR/USD shud be bet DOWN, THE BOJ is pushing YEN down to make exporters RICHER, this affects $USD, pushes EURO and GBP down.."
274566948,HappyEasterDay,False,320,11,46230,2,2013-08-07 21:46:16+00:00, ,365227417989681153,en,0,0,0,0,Google,"1.3340/45 is the high established last week, and EUR/USD is testing there now, through today’s highs. Its likely to…"
850040984,trendtraderplus,False,684,0,16951,28,2013-08-07 18:24:43+00:00, ,365176694937616386,en,0,0,0,0,Twitter Web Client,"#USD/CAD: Today's further declines in crude oil price are propelling CAD weaknes and thus $CAD higher, even while Cable and EUR rally. #fx"
576985163,PipSqueakTrader,False,38,25,969,1,2013-08-07 16:30:09+00:00, ,365147861773598720,en,0,0,0,0,StockTwits Web,"Look at balance sheets of the Fed and ECB. Tells you all you need to know. Fed growing, ECB shrinking. EUR rises rel to USD $EURUSD"
628521553,JamesDewds,False,179,391,5048,5,2013-08-07 15:02:09+00:00, ,365125719707230210,en,0,0,0,0,Twitter Web Client,"#GBPUSD’s gains, &amp; #USD’s slide against the #EUR and #JPY, have seen the USD index drop through some important support"
891500648,FX_ElliottWave,False,5578,17,2730,102,2013-08-07 14:56:12+00:00, ,365124218746191872,en,0,0,0,1,Twitter Web Client,$USDX is weaker early Wednesday but still has not broken its prior low. $USD is stronger against $JPY and mostly flat against $EUR and $CHF.
1423244396,bradleyjason332,False,174,58,3370,3,2013-08-07 14:55:11+00:00, ,365123963434700800,en,0,0,0,0,Twitter for Android,Gold/Jpy has hit a good support. Go long Usd/Jpy and Eur/Jpy.
701897041,MichelLeter2,False,125,459,230,3,2013-08-07 13:58:05+00:00, ,365109595263336448,en,0,0,0,0,Twitter Web Client,Short EUR/USD 1 lot move the SL to the entry level @ 1.3310 TP unchanged @ 1.3280 and delete 3 lots long limit order.
760883833,petergo99037185,False,234,40,304257,2,2013-08-07 13:51:01+00:00, ,365107818614890497,en,0,0,0,0,Twitter Web Client,"$USD 81.45 -0.15 (minus is good), it will help STOCKS, OIL, METALS like $GLD and $SLV, plus good for EUR &amp; GBP coins vs $USD."
151848500,TomMcForex,False,1526,276,13727,48,2013-08-07 13:32:05+00:00, ,365103049963868161,en,0,0,0,0,TweetDeck,Cheeky 10 pip scalp there in Eur/Usd and that's my trading done for the day.
974345539,MyTreasuryAdv,False,693,1791,1046,13,2013-08-07 12:29:50+00:00, ,365087386985701377,en,0,0,0,2,LinkedIn,"Sterling up 2% over the last week v EUR and USD so it would be prudent to take advantage, especially on £/$ if it reaches 1.55 again."
